game_name,game_genre,review,voted_up,timestamp_created,language,playtime_forever,review_clean,detected_language,review_english,vader_neg,vader_neu,vader_pos,vader_compound,sentiment,vader_voted_match
PUBG,Cok_Oyunculu,真正开挂的玩家不去封禁，就逮着绿玩瞎搞，动不动就vac误封，平替的游戏多他一个不多，少他一个不少,False,2026-06-06 07:37:12,schinese,12038,真正开挂的玩家不去封禁 就逮着绿玩瞎搞 动不动就vac误封 平替的游戏多他一个不多 少他一个不少,schinese,"Players who are really cheating don't ban them, they just mess around with green players, and they get vac-blocked by mistake every now and then. There are more games for him, but not more, and less games for him.",0.137,0.814,0.049,-0.422,negative,1
PUBG,Cok_Oyunculu,还是非常好玩的，但是确实经常误封，希望能改善下,True,2026-06-06 04:08:39,schinese,23283,还是非常好玩的 但是确实经常误封 希望能改善下,schinese,"It's still very fun, but I often get blocked by mistake. I hope this can be improved.",0.205,0.428,0.367,0.6753,positive,1
PUBG,Cok_Oyunculu,氪金游戏，网速显卡显示器，缺一不可,False,2026-06-06 03:31:32,schinese,86190,氪金游戏 网速显卡显示器 缺一不可,schinese,"Krypton gold games, high-speed graphics card and monitor are indispensable",0.0,1.0,0.0,0.0,neutral,1
PUBG,Cok_Oyunculu,游戏环境太差，外挂漫天飞，纯绿玩多杀几个就封号，外挂杀十几个检测都不带检测的，,False,2026-06-06 01:24:52,schinese,481864,游戏环境太差 外挂漫天飞 纯绿玩多杀几个就封号 外挂杀十几个检测都不带检测的,schinese,"The game environment is too bad. There are cheats all over the place. If you kill a few more pure green players, your account will be banned. If you kill more than a dozen cheats, there will be no detection.",0.418,0.582,0.0,-0.9741,negative,1
PUBG,Cok_Oyunculu,"Oyunu güncellerken, yeni güncelleme geliyor...

Sürekli güncellemeniz gerekiyor.",True,2026-06-06 00:47:36,turkish,10784,"Oyunu güncellerken, yeni güncelleme geliyor... Sürekli güncellemeniz gerekiyor.",turkish,"While updating the game, a new update is coming... You need to update it constantly.",0.0,1.0,0.0,0.0,neutral,0
PUBG,Cok_Oyunculu,"The Battle Royale Pioneer
PUBG: Battlegrounds is all about intense tactical tension, realistic gunplay, and high-stakes survival. The loop of dropping completely naked into a massive island, scavenging for realistic military gear, and outlasting 99 other players in a shrinking blue zone is incredibly thrilling and nerve-wracking.

It’s simple to understand the survival premise, but mastering the heavy weapon recoil, bullet velocity drop, and careful positioning takes hundreds of hours. Catching an enemy rotation from a hilltop or clutching a tense, silent final-circle firefight for a ""Chicken Dinner"" never gets old.

While the clunky, heavy character movement, occasional optimization stutters, and the presence of highly experienced ""sweat"" lobbies can heavily frustrate newcomers, the pure adrenaline rush is unmatched.

If you’re looking for a gritty, slower-paced tactical shooter where a single mistake can send you back to the lobby, this pioneer is still a powerhouse. 8.5/10",True,2026-06-05 21:27:39,english,41,"The Battle Royale Pioneer PUBG Battlegrounds is all about intense tactical tension, realistic gunplay, and high-stakes survival. The loop of dropping completely naked into a massive island, scavenging for realistic military gear, and outlasting 99 other players in a shrinking blue zone is incredibly thrilling and nerve-wracking. It s simple to understand the survival premise, but mastering the heavy weapon recoil, bullet velocity drop, and careful positioning takes hundreds of hours. Catching an enemy rotation from a hilltop or clutching a tense, silent final-circle firefight for a ""Chicken Dinner"" never gets old. While the clunky, heavy character movement, occasional optimization stutters, and the presence of highly experienced ""sweat"" lobbies can heavily frustrate newcomers, the pure adrenaline rush is unmatched. If you re looking for a gritty, slower-paced tactical shooter where a single mistake can send you back to the lobby, this pioneer is still a powerhouse. 8.5 10",english,"The Battle Royale Pioneer PUBG Battlegrounds is all about intense tactical tension, realistic gunplay, and high-stakes survival. The loop of dropping completely naked into a massive island, scavenging for realistic military gear, and outlasting 99 other players in a shrinking blue zone is incredibly thrilling and nerve-wracking. It s simple to understand the survival premise, but mastering the heavy weapon recoil, bullet velocity drop, and careful positioning takes hundreds of hours. Catching an enemy rotation from a hilltop or clutching a tense, silent final-circle firefight for a ""Chicken Dinner"" never gets old. While the clunky, heavy character movement, occasional optimization stutters, and the presence of highly experienced ""sweat"" lobbies can heavily frustrate newcomers, the pure adrenaline rush is unmatched. If you re looking for a gritty, slower-paced tactical shooter where a single mistake can send you back to the lobby, this pioneer is still a powerhouse. 8.5 10",0.167,0.778,0.055,-0.9585,negative,0
PUBG,Cok_Oyunculu,"can't even start to play. trying to enter name, then press ""next"" and game just reloads naming page and asking to create name again",False,2026-06-05 19:01:52,english,158,"can't even start to play. trying to enter name, then press ""next"" and game just reloads naming page and asking to create name again",english,"can't even start to play. trying to enter name, then press ""next"" and game just reloads naming page and asking to create name again",0.0,0.83,0.17,0.5423,positive,0
PUBG,Cok_Oyunculu,"[u]Зашел, полутался 20 минут, умер от чела из куста, которого даже не видел. 10 сковородок из 10. А если серьезно — игра легендарная, эмоции дарит топовые, особенно если катать с друзьями. Игра реально затягивает.[/u]",True,2026-06-05 18:11:29,russian,14129,"u Зашел, полутался 20 минут, умер от чела из куста, которого даже не видел. 10 сковородок из 10. А если серьезно игра легендарная, эмоции дарит топовые, особенно если катать с друзьями. Игра реально затягивает. u",russian,"u Came in, lurked around for 20 minutes, died from a blow from a bush that I didn’t even see. 10 frying pans out of 10. But seriously, the game is legendary, it gives top emotions, especially if you play with friends. The game is really addictive. u",0.076,0.752,0.172,0.7576,positive,1
PUBG,Cok_Oyunculu,"Я короче не открыв очи просыпаюсь утром, сижу в самолёте, со мной сто человек, я прыгаю но починки свою тачку починить, а меня сбивают с ног, какой-то мужик меня понёс в уборную, облапал, и потом его убил снайпер с 2 километров от него, и нас облутали два фембоя квадробера, в общем игру советую.",True,2026-06-05 17:56:58,russian,2533,"Я короче не открыв очи просыпаюсь утром, сижу в самолёте, со мной сто человек, я прыгаю но починки свою тачку починить, а меня сбивают с ног, какой-то мужик меня понёс в уборную, облапал, и потом его убил снайпер с 2 километров от него, и нас облутали два фембоя квадробера, в общем игру советую.",russian,"In short, I wake up in the morning without opening my eyes, I’m sitting on a plane, there are a hundred people with me, I’m jumping to fix my car, and they knock me down, some guy carried me to the restroom, groped me, and then he was killed by a sniper from 2 kilometers away, and we were robbed by two femboy quadrobers, in general, I recommend the game.",0.06,0.907,0.033,-0.4588,negative,0
PUBG,Cok_Oyunculu,Stinky cheating ♥♥♥♥! I recently read that employees are paid for reproducing. Now they just ♥♥♥♥ and do nothing else.,False,2026-06-05 17:44:51,russian,75124,Stinky cheating ! I recently read that employees are paid for reproducing. Now they just and do nothing else.,russian,Stinky cheating ! I recently read that employees are paid for reproducing. Now they just and do nothing else.,0.273,0.727,0.0,-0.75,negative,1
PUBG,Cok_Oyunculu,걍 잘만든 게임이기도 하고 어떤 온라인 fps나 팀 게임을 하면 언젠가는 질릴텐데 딱 그때 배그하면 또 며칠 동안하게되는 마성의 게임(크래프톤 이렇게 쓰면 되는거죠?),True,2026-06-05 17:32:28,koreana,12195,걍 잘만든 게임이기도 하고 어떤 온라인 fps나 팀 게임을 하면 언젠가는 질릴텐데 딱 그때 배그하면 또 며칠 동안하게되는 마성의 게임(크래프톤 이렇게 쓰면 되는거죠?),koreana,"It's just a well-made game, and if you play any online FPS or team game, you'll get sick of it at some point, but if you play PUBG just then, it's a devilish game that you'll play for several days (You can use Krafton like this, right?)",0.108,0.701,0.191,0.5927,positive,1
PUBG,Cok_Oyunculu,"엔씨에서 훔쳐온 게임 테라, 그중에서도 엘린의 팬티를 팔아 번 돈으로 얻어걸린 크래프톤의 역작.

테라 시절 버릇 못고치고 이게임 저게임 기웃거리며 똥볼만 차고있는 크래프톤에게 언제나 든든한 지갑.

친구랑 같이 하기엔 재미있지만, 게임이 핵쟁이와 고인물이 많아 가볍게 즐기기엔 아무래도 힘든면이 있다.

맥라렌때만 해도 과금이 착한편이였는데 그 이후로 이중과금요소로 인하여 매워도 너무 매워진 천장 시스템.

솔직히 지금와서 친구들에게 이 게임을 추천하기엔 좀 그래.",False,2026-06-05 17:05:59,koreana,73189,"엔씨에서 훔쳐온 게임 테라, 그중에서도 엘린의 팬티를 팔아 번 돈으로 얻어걸린 크래프톤의 역작. 테라 시절 버릇 못고치고 이게임 저게임 기웃거리며 똥볼만 차고있는 크래프톤에게 언제나 든든한 지갑. 친구랑 같이 하기엔 재미있지만, 게임이 핵쟁이와 고인물이 많아 가볍게 즐기기엔 아무래도 힘든면이 있다. 맥라렌때만 해도 과금이 착한편이였는데 그 이후로 이중과금요소로 인하여 매워도 너무 매워진 천장 시스템. 솔직히 지금와서 친구들에게 이 게임을 추천하기엔 좀 그래.",koreana,"Terra, a game stolen from NC, and especially Krafton's masterpiece, obtained with money earned from selling Elin's panties. A wallet that is always reliable for Krafton, who has not been able to change his habits from his Terra days and is just snooping around in various games. It's fun to play with friends, but there are a lot of hackers and people in the game, so it can be difficult to enjoy casually. Back in the McLaren era, charging was reasonable, but since then, the ceiling system has become too expensive due to the double charging factor. Honestly, it's a bit hard to recommend this game to my friends right now.",0.053,0.752,0.195,0.9564,positive,0
PUBG,Cok_Oyunculu,"cheaters everywhere. let tier 1 players only play with themselves, literally.",False,2026-06-05 15:41:52,english,155578,"cheaters everywhere. let tier 1 players only play with themselves, literally.",english,"cheaters everywhere. let tier 1 players only play with themselves, literally.",0.203,0.629,0.168,-0.128,negative,1
PUBG,Cok_Oyunculu,СКУЧНАЯ. так я магу назвать весь геёмплэй. За раунд дай бог попадётся 1-2 играка. Всё 8 часов я просто бегал по полю пока не остовалось 30/10 чиловек. Потом меня убивал xx_BLOODDIRECHEMPION_xx с 500 ур. ♥♥♥♥♥. Фортнайт круче,False,2026-06-05 15:24:57,russian,567,СКУЧНАЯ. так я магу назвать весь геёмплэй. За раунд дай бог попадётся 1-2 играка. Всё 8 часов я просто бегал по полю пока не остовалось 30 10 чиловек. Потом меня убивал xx_BLOODDIRECHEMPION_xx с 500 ур. . Фортнайт круче,russian,BORING. That’s how I can call the entire gameplay. God forbid you get 1-2 players per round. For 8 hours I just ran around the field until there were 30 10 people left. Then xx_BLOODDIRECHEMPION_xx killed me at level 500. . Fortnite is cooler,0.189,0.77,0.04,-0.8286,negative,1
PUBG,Cok_Oyunculu,越打越能发现其中的乐趣，特别是和朋友一起玩，即便不吃鸡也很有意思,True,2026-06-05 15:04:01,schinese,36923,越打越能发现其中的乐趣 特别是和朋友一起玩 即便不吃鸡也很有意思,schinese,"The more you play, the more fun you’ll find, especially playing with friends. Even if you don’t eat chicken, it’s still fun.",0.0,0.531,0.469,0.9328,positive,1
PUBG,Cok_Oyunculu,"кусок гомна из обрыганского сетевого кода, кемперов с пяткой и софтеров. Пули бывают пролетают сквозь типа при том что с интернетом все гуд. Упасть ровно куда тебе нужно когда в локацию падает человек 20 и более тоже еще тот квест, пакеты улетают ♥♥♥♥♥ в таджикистан. Предметы на ру сервере поднимаются с задержкой сопоставимой с задержкой в развитии матери разраба. Полоумные с 2500 лвлом, мп5 и всс в своих лапах это вообще отдельная история. Оптимизация ну пойдет, но можно лучше, на моем тостере идет фпс в 120-140, но и без  дропов до 80 никуда. Единственное что делается в этой игре это скинчики с жопами чтобы азиаты могли пофапать на них играя в тпп. Более менее играбельный ранкед этим летом превратится в хвх сервер, ведь какому-то долбаебу пришла в голову идея сделать пбг+ за 20к бп)))))) интересное однако решение. Можно еще долго обсирать эту игру, но плюсы все же есть, среди мастурбеков и прочей живности есть адекватные игроки, встретить тяжело, но можно. Ни в одной игре я еще столько знакомств новых не открыл. Начинать играть в это в 26 году? Решать  каждому самому, первые часов 100 я думал что дропну эту игру, ливнул на пол года, потом как то опять к ней пришел, далее 200-400 часов - вполне интересные, ничего не умеешь, бегаешь чето пытаешься убить кого-то, первый топ 1 это неописуемое чувство. После уже более менее рука набита ко всему, нашел клан, играется весело когда фулл пачка. С рандомами идти - затея сомнительная, это больше для мазахистов. Если одним словом то люблю и ненавижу, больше пока добавить нечего. 7/10 кемперов с мп5",True,2026-06-05 14:45:36,russian,60409,"кусок гомна из обрыганского сетевого кода, кемперов с пяткой и софтеров. Пули бывают пролетают сквозь типа при том что с интернетом все гуд. Упасть ровно куда тебе нужно когда в локацию падает человек 20 и более тоже еще тот квест, пакеты улетают в таджикистан. Предметы на ру сервере поднимаются с задержкой сопоставимой с задержкой в развитии матери разраба. Полоумные с 2500 лвлом, мп5 и всс в своих лапах это вообще отдельная история. Оптимизация ну пойдет, но можно лучше, на моем тостере идет фпс в 120-140, но и без дропов до 80 никуда. Единственное что делается в этой игре это скинчики с жопами чтобы азиаты могли пофапать на них играя в тпп. Более менее играбельный ранкед этим летом превратится в хвх сервер, ведь какому-то долбаебу пришла в голову идея сделать пбг за 20к бп)))))) интересное однако решение. Можно еще долго обсирать эту игру, но плюсы все же есть, среди мастурбеков и прочей живности есть адекватные игроки, встретить тяжело, но можно. Ни в одной игре я еще столько знакомств новых не открыл. Начинать играть в это в 26 году? Решать каждому самому, первые часов 100 я думал что дропну эту игру, ливнул на пол года, потом как то опять к ней пришел, далее 200-400 часов - вполне интересные, ничего не умеешь, бегаешь чето пытаешься убить кого-то, первый топ 1 это неописуемое чувство. После уже более менее рука набита ко всему, нашел клан, играется весело когда фулл пачка. С рандомами идти - затея сомнительная, это больше для мазахистов. Если одним словом то люблю и ненавижу, больше пока добавить нечего. 7 10 кемперов с мп5",russian,"a piece of rubbish from Obrygansky network code, campers with a heel and softers. Bullets sometimes fly through, despite the fact that everything is going haywire with the Internet. To fall exactly where you need to when 20 or more people fall into a location is also another quest, the packages fly to Tajikistan. Items on the ru server rise with a delay comparable to the delay in the development of the developer’s mother. Crazy people with lvl 2500, mp5 and everything in their clutches are a different story altogether. Optimization will work, but it can be better, on my toaster the FPS is 120-140, but without drops it’s nowhere near 80. The only thing that is done in this game is skins with asses so that Asians can fap on them while playing TPP. This summer, a more or less playable ranked game will turn into a xvx server, because some idiot came up with the idea of ​​​​making a pbg for 20k bp)))))) but an interesting solution. You can talk about this game for a long time, but there are still advantages, among masturbates and other living creatures there are adequate players, it’s hard to meet, but it’s possible. I have never made so many new acquaintances in any game yet. Start playing this in '26? It’s up to everyone to decide for themselves, for the first 100 hours I thought I would drop this game, I gave it up for half a year, then somehow I came to it again, then 200-400 hours - quite interesting, you can’t do anything, you’re running around trying to kill someone, the first top 1 is an indescribable feeling. After that, I was more or less full of everything, I found a clan, it’s fun to play when there’s a full pack. Going with randoms is a dubious idea, it’s more for masochists. If in one word I love and hate, there is nothing more to add for now. 7 10 campers with MP5",0.083,0.806,0.111,0.8712,positive,1
PUBG,Cok_Oyunculu,垃圾得不行，启动能启动5分钟，是我见过最垃圾的游戏，4399都比你好,False,2026-06-05 14:32:05,schinese,31445,垃圾得不行 启动能启动5分钟 是我见过最垃圾的游戏 4399都比你好,schinese,"It's so rubbish. It takes 5 minutes to start up. It's the rubbish game I've ever seen. 4,399 people are better than you.",0.0,0.884,0.116,0.4404,positive,0
PUBG,Cok_Oyunculu,很喜欢这种枪机游戏 自由射击 主要就是板子挂太多 玩的不舒服有时被挂 打的不想玩了,True,2026-06-05 13:56:52,schinese,6749,很喜欢这种枪机游戏 自由射击 主要就是板子挂太多 玩的不舒服有时被挂 打的不想玩了,schinese,"I really like this kind of gun-and-gun game, Free Fire. The main problem is that there are too many boards hanging on it, which makes it uncomfortable to play. Sometimes I get hung up and I don’t want to play anymore.",0.146,0.624,0.231,0.5413,positive,1
PUBG,Cok_Oyunculu,"Словил маслину когда прятался в будке для псов, очень было круто кстати, разъебал ♥♥♥♥♥ стол в клочья, насадил мать разраба на штырь, а игра хорошая",True,2026-06-05 13:27:47,russian,4428,"Словил маслину когда прятался в будке для псов, очень было круто кстати, разъебал стол в клочья, насадил мать разраба на штырь, а игра хорошая",russian,"I caught an olive when I was hiding in a doghouse, it was very cool by the way, I tore the table to shreds, impaled the developer’s mother on a pin, and the game was good",0.054,0.811,0.135,0.5095,positive,1
PUBG,Cok_Oyunculu,10年前的傻逼游戏依然有挂壁在里面坚持开挂，绿玩就受着，跟人博弈永远被拿捏,False,2026-06-05 12:44:16,schinese,7818,10年前的傻逼游戏依然有挂壁在里面坚持开挂 绿玩就受着 跟人博弈永远被拿捏,schinese,The stupid games from 10 years ago still have wall hangings in them and insist on cheating. Green players will suffer from it. They will always be manipulated when playing games with others.,0.305,0.653,0.042,-0.9062,negative,1
PUBG,Cok_Oyunculu,服务器太垃圾了，经常玩着玩着就掉线然后再也连不上。不知道这个网络到底怎么了,False,2026-06-05 12:10:00,schinese,10143,服务器太垃圾了 经常玩着玩着就掉线然后再也连不上 不知道这个网络到底怎么了,schinese,The server is so rubbish. I often get disconnected while playing and can no longer connect. I don’t know what’s wrong with this network.,0.189,0.747,0.064,-0.5423,negative,1
PUBG,Cok_Oyunculu,"Mam taką jedną zasadę... Porzucam grę z automatu, jeżeli już w pierwszej potyczce moja postać ,,magicznie"" ginie od ,,magicznego"" pocisku, który ,,magicznie"" przechodzi przez ściany. W tym przypadku miało to miejsce kilka razy i to z ręki jednego gracza. Nie, dzięki, pogram w coś innego.",False,2026-06-05 11:58:22,polish,32,"Mam taką jedną zasadę... Porzucam grę z automatu, jeżeli już w pierwszej potyczce moja postać ,,magicznie"" ginie od ,,magicznego"" pocisku, który ,,magicznie"" przechodzi przez ściany. W tym przypadku miało to miejsce kilka razy i to z ręki jednego gracza. Nie, dzięki, pogram w coś innego.",polish,"I have one rule... I abandon the game automatically if, in the first fight, my character ""magically"" dies from a ""magic"" bullet that ""magically"" passes through the walls. In this case, it happened several times and at the hands of one player. No, thanks, I'll play something else.",0.1,0.803,0.097,-0.0516,negative,1
PUBG,Cok_Oyunculu,垃圾游戏全是一堆鼠标宏和外挂绿玩都没几个,False,2026-06-05 11:35:27,schinese,92742,垃圾游戏全是一堆鼠标宏和外挂绿玩都没几个,schinese,Rubbish games are just a bunch of mouse macros and few plug-ins.,0.0,1.0,0.0,0.0,neutral,1
