game_name,game_genre,review,voted_up,timestamp_created,language,playtime_forever,review_clean,detected_language,review_english,vader_neg,vader_neu,vader_pos,vader_compound,sentiment,vader_voted_match
PUBG,Cok_Oyunculu,"0 Control sobre los malditos tramposos, literal he vaciado cargadores enteros en jugadores que aunque caen, no mueren del todo, siguen ahi sin morir esperando a ser reanimados, sin contar que en el 90% de tus juegos siempre hay quienes tienen auto aim, o te matan con un arma de bajo calibre a 10 millas de distancia (he revisado la deathcam y es una joya, gente disparando al aire y todos los tiros van a la cabeza). Me gusta este juego, maldita sea me gusta mucho, pero es injugable y frustrante que los creadores no tengan NADA de control sobre los hacks y lo fácil que cualquiera rompe las medidas de anti-hacks.",False,2026-05-23 02:17:12,spanish,5279,"0 Control sobre los malditos tramposos, literal he vaciado cargadores enteros en jugadores que aunque caen, no mueren del todo, siguen ahi sin morir esperando a ser reanimados, sin contar que en el 90 de tus juegos siempre hay quienes tienen auto aim, o te matan con un arma de bajo calibre a 10 millas de distancia (he revisado la deathcam y es una joya, gente disparando al aire y todos los tiros van a la cabeza). Me gusta este juego, maldita sea me gusta mucho, pero es injugable y frustrante que los creadores no tengan NADA de control sobre los hacks y lo fácil que cualquiera rompe las medidas de anti-hacks.",spanish,"0 Control over the damn cheaters, I have literally emptied entire magazines on players who, although they fall, do not die at all, they are still there without dying waiting to be revived, not to mention that in 90 of your games there are always those who have auto aim, or kill you with a low caliber weapon from 10 miles away (I have reviewed the deathcam and it is a gem, people shooting in the air and all the shots go to the head). I like this game, damn I like it a lot, but it's unplayable and frustrating that the creators have NOTHING control over the hacks and how easily anyone breaks the anti-hacking measures.",0.129,0.804,0.066,-0.7333,negative,1
PUBG,Cok_Oyunculu,"El juego es bueno, pero el rendimiento es una m, esta super atrasado en tecnologias y se ve de la v que mejoren el rendimiento y graficos.",True,2026-05-21 22:47:00,spanish,4403,"El juego es bueno, pero el rendimiento es una m, esta super atrasado en tecnologias y se ve de la v que mejoren el rendimiento y graficos.",spanish,"The game is good, but the performance is a minus, it is super behind in technologies and it seems likely that performance and graphics will improve.",0.0,0.673,0.327,0.9032,positive,1
PUBG,Cok_Oyunculu,"Bu oyunda her yaşa uygun olmayan veya iş yerinde görüntülenmesi sakıncalı olabilecek içerikler yer alabilir: Sıkça Şiddet veya Kan, Genel Yetişkin İçerik",True,2026-05-19 23:21:13,turkish,4775,"Bu oyunda her yaşa uygun olmayan veya iş yerinde görüntülenmesi sakıncalı olabilecek içerikler yer alabilir Sıkça Şiddet veya Kan, Genel Yetişkin İçerik",turkish,"This game may contain content that is not appropriate for all ages or may be inappropriate for viewing at work Frequent Violence or Gore, General Mature Content",0.129,0.784,0.088,-0.3182,negative,0
PUBG,Cok_Oyunculu,"Joguei cerca de 71 horas e posso dizer que PUBG é um jogo razoavelmente bom. A ideia do battle royale ainda funciona muito bem aqui, principalmente pela tensão das partidas e pela sensação mais “pé no chão” dos combates.
O jogo consegue criar momentos muito intensos. Às vezes você passa 15 minutos lootando tranquilo e do nada aparece um cidadão escondido numa janela há 3 eras geológicas esperando alguém passar. Isso deixa as partidas imprevisíveis e divertidas.
As armas têm impacto, os mapas são interessantes e a sensação de sobrevivência funciona bem. Porém, o jogo ainda tem espaço para melhorar bastante em otimização, movimentação e alguns problemas técnicos que aparecem de vez em quando.
Mesmo assim, dá pra se divertir bastante com amigos ou até solo se você tiver paciência e gostar de partidas mais estratégicas.
Não achei perfeito, mas também não achei ruim. PUBG ainda tem potencial para evoluir mais.",True,2026-05-19 01:32:09,brazilian,5797,"Joguei cerca de 71 horas e posso dizer que PUBG é um jogo razoavelmente bom. A ideia do battle royale ainda funciona muito bem aqui, principalmente pela tensão das partidas e pela sensação mais pé no chão dos combates. O jogo consegue criar momentos muito intensos. Às vezes você passa 15 minutos lootando tranquilo e do nada aparece um cidadão escondido numa janela há 3 eras geológicas esperando alguém passar. Isso deixa as partidas imprevisíveis e divertidas. As armas têm impacto, os mapas são interessantes e a sensação de sobrevivência funciona bem. Porém, o jogo ainda tem espaço para melhorar bastante em otimização, movimentação e alguns problemas técnicos que aparecem de vez em quando. Mesmo assim, dá pra se divertir bastante com amigos ou até solo se você tiver paciência e gostar de partidas mais estratégicas. Não achei perfeito, mas também não achei ruim. PUBG ainda tem potencial para evoluir mais.",brazilian,"I played about 71 hours and I can say that PUBG is a reasonably good game. The battle royale idea still works very well here, mainly due to the tension of the matches and the more down-to-earth feel of the combats. The game manages to create very intense moments. Sometimes you spend 15 minutes peacefully looting and out of nowhere a citizen appears hiding in a window for 3 geological eras waiting for someone to pass by. This makes matches unpredictable and fun. The weapons have impact, the maps are interesting and the feeling of survival works well. However, the game still has room to improve a lot in terms of optimization, movement and some technical problems that appear from time to time. Even so, you can have a lot of fun with friends or even solo if you have patience and like more strategic matches. I didn't think it was perfect, but I didn't think it was bad either. PUBG still has the potential to evolve further.",0.079,0.766,0.155,0.8043,positive,1
PUBG,Cok_Oyunculu,"Хорошая игра, правда постоянно проблемы с серверами, а теперь он еще и ПК начал бить палкой. Если вы новичок и хотите за лететь в катку и получить по щам от максимального уровня, то рекомендую, а так игра - не оптимизированный кусок субстанции",False,2026-05-16 08:24:45,russian,23397,"Хорошая игра, правда постоянно проблемы с серверами, а теперь он еще и ПК начал бить палкой. Если вы новичок и хотите за лететь в катку и получить по щам от максимального уровня, то рекомендую, а так игра - не оптимизированный кусок субстанции",russian,"It’s a good game, although there are always problems with the servers, and now he’s also started hitting the PC with a stick. If you are a beginner and want to fly into the rink and get soup from the maximum level, then I recommend it, but the game is not an optimized piece of substance",0.083,0.837,0.08,-0.3004,negative,1
PUBG,Cok_Oyunculu,"[h1] Legit rant [/h1]
This game went downhill the moment it became free to play.
Tons of hackers, the lack of real bans (people automatically switch accounts in 10 minutes using tools hackers provide), and updates that don't address real issues ([b] they removed the weapons people loved so far [/b] recently, nobody asked for it).

It's not a great competitive FPS like it was before; it's just a playground for hackers that's slowly drifting into GTA-like arcade gameplay.

[h1] Synoposis [/h1]
I can't recommend this to anyone in 2026.",False,2026-05-13 16:53:42,english,103394,"h1 Legit rant h1 This game went downhill the moment it became free to play. Tons of hackers, the lack of real bans (people automatically switch accounts in 10 minutes using tools hackers provide), and updates that don't address real issues ( b they removed the weapons people loved so far b recently, nobody asked for it). It's not a great competitive FPS like it was before it's just a playground for hackers that's slowly drifting into GTA-like arcade gameplay. h1 Synoposis h1 I can't recommend this to anyone in 2026.",english,"h1 Legit rant h1 This game went downhill the moment it became free to play. Tons of hackers, the lack of real bans (people automatically switch accounts in 10 minutes using tools hackers provide), and updates that don't address real issues ( b they removed the weapons people loved so far b recently, nobody asked for it). It's not a great competitive FPS like it was before it's just a playground for hackers that's slowly drifting into GTA-like arcade gameplay. h1 Synoposis h1 I can't recommend this to anyone in 2026.",0.135,0.753,0.112,-0.1083,negative,1
PUBG,Cok_Oyunculu,"Lo jugaba en consola pero ahora estoy en pc y se siente la diferencia absoluta de como juegan en pc, para mi es un poco complicado porque jugaba con control y ahora empiezo con teclado.",True,2026-05-13 01:22:16,spanish,4413,"Lo jugaba en consola pero ahora estoy en pc y se siente la diferencia absoluta de como juegan en pc, para mi es un poco complicado porque jugaba con control y ahora empiezo con teclado.",spanish,I played it on a console but now I'm on a PC and you can feel the absolute difference from how they play on a PC. For me it's a little complicated because I played with a controller and now I start with a keyboard.,0.0,0.842,0.158,0.7845,positive,1
PUBG,Cok_Oyunculu,"คือการอัพเดท เปลี่ยนจากจ่ายตังค์จริง เป็นใช้ 20,000 BP ได้ หรือ 500 G-Coins เนี่ย คิดไรอยู่คือเกมโปรมันเยอะอยู่แล้วมาโครเยอะอยู่แล้วในแร๊งค์ก็โปรลึ่มๆ อะดิ หมดไฟเล่นจริงๆ นะอัพเดทแย่ขึ้นๆ เรื่อยๆ",False,2026-05-12 10:16:50,thai,13246,"ค อการอ พเดท เปล ยนจากจ ายต งค จร ง เป นใช 20,000 BP ได หร อ 500 G-Coins เน ย ค ดไรอย ค อเกมโปรม นเยอะอย แล วมาโครเยอะอย แล วในแร งค ก โปรล มๆ อะด หมดไฟเล นจร งๆ นะอ พเดทแย ข นๆ เร อยๆ",thai,"Is it okay for gamers to change from real payments to using 20,000 BP or 500 G-Coins? There are a lot of promotions for gamers, there are a lot of macros, and there are a lot of promotions in the game. I'm really running out of energy to play. More and more updates. No, no, no.",0.0,0.892,0.108,0.6597,positive,0
PUBG,Cok_Oyunculu,"솔직히 FPS 장르를 넘어서서 현질 없이 즐길 수 있는 '판제 PVP 온라인 게임' 중에 원탑이라고 봄. 게임이 너무 고였다고 단점이라고 볼 수도 있겠지만 비싼 현질 무기나 방어구, 노가다 파밍이나 캐릭터 레벨링 없이 순수 실력으로만 압도적인 격차가 나는것도 이 게임이 얼마나 구조적으로 잘 만든 게임인지 알 수 있는 매력이라고 볼 수 있음

정말 갓겜이라고 생각하지만 이제 늙어서 사람 상대하는 PVP류 게임은 슬슬 힘들고 피곤하긴 하다",True,2026-05-12 01:27:55,koreana,28322,"솔직히 FPS 장르를 넘어서서 현질 없이 즐길 수 있는 '판제 PVP 온라인 게임' 중에 원탑이라고 봄. 게임이 너무 고였다고 단점이라고 볼 수도 있겠지만 비싼 현질 무기나 방어구, 노가다 파밍이나 캐릭터 레벨링 없이 순수 실력으로만 압도적인 격차가 나는것도 이 게임이 얼마나 구조적으로 잘 만든 게임인지 알 수 있는 매력이라고 볼 수 있음 정말 갓겜이라고 생각하지만 이제 늙어서 사람 상대하는 PVP류 게임은 슬슬 힘들고 피곤하긴 하다",koreana,"Honestly, I think it is the best among 'Panje PVP online games' that go beyond the FPS genre and can be enjoyed without any fuss. It may be seen as a drawback that the game is too sophisticated, but the overwhelming gap based on pure skill alone, without expensive quality weapons or armor, laborious farming, or character leveling, can also be seen as an attraction that shows how well-made this game is structurally. I think it's a really good game, but I'm getting older now, and PVP-type games where you play against people are slowly becoming difficult and tiring.",0.049,0.752,0.199,0.9501,positive,1
PUBG,Cok_Oyunculu,เรารู้สึกสนุกกับเกมนี้ เเต่เลิกเอาทีมเเย่ๆมาให้ เเล้วก็เรื่องวงด้วย เลิกหนีห่างจะตัวเรา เเต่รวมๆสนุกท่ามีเพื่อนหรือทีมประจำจะสนุกเป็นพิเศษ สรุปเราเอามันออกจากชีวิตไม่ได้เพราะอะไรไม่รู้ เเล้วก็อีกอย่างชอบโดนรุ่มเป็นเเซนวิช XD (‾◡◝),True,2026-05-09 05:27:19,thai,46424,เราร ส กสน กก บเกมน เเต เล กเอาท มเเย ๆมาให เเล วก เร องวงด วย เล กหน ห างจะต วเรา เเต รวมๆสน กท าม เพ อนหร อท มประจำจะสน กเป นพ เศษ สร ปเราเอาม นออกจากช ว ตไม ได เพราะอะไรไม ร เเล วก อ กอย างชอบโดนร มเป นเเซนว ช XD ( ),thai,"We're interested in the game, but we've picked up a lot of things to give you, including the horror story. The next time we'll talk about it, we'll just include a friend or a regular who'll be interested as an extra. So, we can't take him out of our life, why not? Koyang likes to be praised as a celebrity XD ( )",0.095,0.664,0.241,0.9224,positive,1
PUBG,Cok_Oyunculu,"Скачал игру, но разачаровался в логике баланса. В обычном режиме попадаются игроки с бесконечными тысячами часов, разъезжают обычно в толпе и устранить их - буквально непосильная задача. Надоело сдыхать в первой стычке? Так заходи в рейтинговый. Один нюанс: для игры надо купить Plus (~13$). Ой, не хотите платить? Тогда игра не для вас. Вне рейтинга адекватному человеку получить удовольствие не получится. 

это не монетизация, а уборка специально насранного.",False,2026-05-27 08:35:21,russian,827,"Скачал игру, но разачаровался в логике баланса. В обычном режиме попадаются игроки с бесконечными тысячами часов, разъезжают обычно в толпе и устранить их - буквально непосильная задача. Надоело сдыхать в первой стычке? Так заходи в рейтинговый. Один нюанс для игры надо купить Plus ( 13 ). Ой, не хотите платить? Тогда игра не для вас. Вне рейтинга адекватному человеку получить удовольствие не получится. это не монетизация, а уборка специально насранного.",russian,"I downloaded the game, but was disappointed in the logic of the balance. In normal mode, you come across players with endless thousands of hours, usually driving around in a crowd, and eliminating them is literally an impossible task. Tired of dying in the first skirmish? So go to the rating room. One caveat for the game you need to buy Plus (13). Oh, don't want to pay? Then the game is not for you. Outside of the rating, an adequate person will not be able to enjoy it. This is not monetization, but cleaning up specifically crap.",0.117,0.811,0.072,-0.7183,negative,1
PUBG,Cok_Oyunculu,"해킹 계정 복구 이후 2번 연속으로 ""비정상적인 행위"",""부정행위/불법프로그램 이용"" 으로 연속으로 정지 먹은 사람입니다.
고객지원 문의 해봤자 조사 하는 중이다 기다려라 라는 제스처만 취할 뿐 아무 대응도 없는 게임입니다.

이번 정지도 문의는 넣었으나 별 기대도 안하는 상태입니다.",False,2026-06-07 02:21:47,koreana,38990,"해킹 계정 복구 이후 2번 연속으로 ""비정상적인 행위"",""부정행위 불법프로그램 이용"" 으로 연속으로 정지 먹은 사람입니다. 고객지원 문의 해봤자 조사 하는 중이다 기다려라 라는 제스처만 취할 뿐 아무 대응도 없는 게임입니다. 이번 정지도 문의는 넣었으나 별 기대도 안하는 상태입니다.",koreana,"This is a person who has been suspended twice in a row for “abnormal behavior” and “cheating and using illegal programs” after recovering a hacked account. Even if you contact customer support, the game just makes a gesture that says they are investigating and says wait, but there is no response. I've made inquiries about this suspension, but I don't have any expectations.",0.131,0.842,0.027,-0.7311,negative,1
PUBG,Cok_Oyunculu,"игра полная ♥♥♥♥♥,♥♥♥♥♥ не регает,у разрабов матеря в канавах,собаки ♥♥♥♥♥♥ сьели всю их родню,а отцы ебутся с лезвиями,потому что рождение таких хуесосов ради создания это просто фантастика, 10/10",False,2026-05-31 16:42:42,russian,54932,"игра полная , не регает,у разрабов матеря в канавах,собаки сьели всю их родню,а отцы ебутся с лезвиями,потому что рождение таких хуесосов ради создания это просто фантастика, 10 10",russian,"the game is complete, doesn't crash, the developers have mothers in ditches, dogs ate all their relatives, and fathers fuck with blades, because the birth of such cocksuckers for the sake of creation is simply fantastic, 10 10",0.148,0.687,0.166,-0.0366,neutral,1
PUBG,Cok_Oyunculu,"Pubg ist echt ein schönes game, macht spaß im Team, die welten sind schön und es läuft auf meinem pc super",True,2026-05-19 14:56:28,german,9625,"Pubg ist echt ein schönes game, macht spaß im Team, die welten sind schön und es läuft auf meinem pc super",german,"Pubg is a really nice game, it's fun to play in a team, the worlds are beautiful and it runs great on my PC",0.0,0.531,0.469,0.9501,positive,1
PUBG,Cok_Oyunculu,"혼자 하면 손이 잘 가지 않는 똥@겜인 것 같지만
친구랑 같이하면 레전드 갓겜이 되어버리는 환상의 게임",True,2026-05-18 14:31:43,koreana,2399,혼자 하면 손이 잘 가지 않는 똥 겜인 것 같지만 친구랑 같이하면 레전드 갓겜이 되어버리는 환상의 게임,koreana,"If you play it alone, it may seem like a crappy game, but if you play it with a friend, it becomes a legendary godgame.",0.113,0.565,0.322,0.7935,positive,1
PUBG,Cok_Oyunculu,"Game is movement and combat feel super clunky, they havent updated it sense it came out instead added a bunch of micro transactions. not a good game at all.",False,2026-05-18 00:15:25,english,924,"Game is movement and combat feel super clunky, they havent updated it sense it came out instead added a bunch of micro transactions. not a good game at all.",english,"Game is movement and combat feel super clunky, they havent updated it sense it came out instead added a bunch of micro transactions. not a good game at all.",0.138,0.749,0.112,0.0243,neutral,1
PUBG,Cok_Oyunculu,O jogo ultimamente está um lixo cheio de xitados tomara que em breve esse jogo fali logo parabens vcs que fica xitando em jogo viu espero de coração9 que esse jogo fali logo,False,2026-05-31 23:26:19,brazilian,43011,O jogo ultimamente está um lixo cheio de xitados tomara que em breve esse jogo fali logo parabens vcs que fica xitando em jogo viu espero de coração9 que esse jogo fali logo,brazilian,"The game lately is rubbish full of angry people, I hope this game goes out of business soon, congratulations to those of you who are angry about the game, I really hope that this game goes out of business soon",0.128,0.678,0.194,0.5256,positive,0
PUBG,Cok_Oyunculu,"PUBG: Battlegrounds — это суровый, но захватывающий мир, где новичкам действительно ""не место""... пока они не научатся. Да, вы будете умирать. Часто. Но каждая смерть — это урок, а каждый шаг вперёд — маленькая победа. Осваивайте механики, изучайте карты, играйте с друзьями и не бойтесь ошибок. Со временем вы начнёте замечать, как реже умираете и как ближе подбираетесь к заветному ""Winner Winner Chicken Dinner!""",True,2026-05-31 10:40:30,russian,27811,"PUBG Battlegrounds это суровый, но захватывающий мир, где новичкам действительно ""не место""... пока они не научатся. Да, вы будете умирать. Часто. Но каждая смерть это урок, а каждый шаг вперёд маленькая победа. Осваивайте механики, изучайте карты, играйте с друзьями и не бойтесь ошибок. Со временем вы начнёте замечать, как реже умираете и как ближе подбираетесь к заветному ""Winner Winner Chicken Dinner!""",russian,"PUBG Battlegrounds is a harsh but exciting world where there really is no place for beginners... until they learn. Yes, you will die. Often. But every death is a lesson, and every step forward is a small victory. Master mechanics, study maps, play with friends and don’t be afraid of mistakes. Over time, you will begin to notice how less often you die and how closer you get to the coveted “Winner Winner Chicken Dinner!”",0.236,0.578,0.186,-0.6558,negative,0
