game_name,game_genre,review,voted_up,timestamp_created,language,playtime_forever,review_clean,detected_language,review_english,vader_neg,vader_neu,vader_pos,vader_compound,sentiment,vader_voted_match
PUBG,Cok_Oyunculu,"游戏是好游戏。
玩家是坏玩家。
蓝洞是坏蓝洞。
氪金是骗氪金。
中奖是不中奖。
骗钱是真骗钱。",True,2026-05-10 12:50:04,schinese,262280,游戏是好游戏 玩家是坏玩家 蓝洞是坏蓝洞 氪金是骗氪金 中奖是不中奖 骗钱是真骗钱,schinese,"The game is a good game, the players are bad players, the blue hole is a bad blue hole, krypton gold is cheating, krypton gold is cheating, winning is not winning, cheating money is real cheating",0.362,0.475,0.162,-0.9072,negative,0
PUBG,Cok_Oyunculu,"Since day one player, over 1300 hours, one of my top most played games, lots of time streaming and making memories with friends AND NOW...no more.

For the TLDR, game bad. Carless greedy company, the worst gambling of loot boxes I've ever seen, no concern for the quality of experience for the players, laughable attempts of quashing the constant surge of cheaters, severly limited servers with no option of choice, insane ratio of in game currency value to the dollar and on top of all that is an extreme lapse of quality of in game content.

Understandably, there are many different points of view and likes accross many different personalities so there is great varience in opinions and therefore not everything is for everyone. Aside from previous satement there is still some measure of quality that is objective and I'd like to dive into those over personal feelings or experience.

Most importantly is quality of Publisher/Developer. Naturally, the ideals and desires of the two are often differing, conflicting, independant, selfish. Why not, one will care more about face, money and status while the other concerns themselves with quality of product and it's users. Uncertain as to which one is more reasponsible for the copious negatives BUT there is almost nothing possitive to say about anything purtaining to the responsibilities of quality in game that either company oversee. Gambling is quite possibly one of the worst things to be implemented in casual and competitive gaming in order to create a strive for goals and the rewards of their completion and PUBG is without a doubt the worst one in the gaming industry containing: Several different tabs to visit to obtain in game cosmetics, a couple different unique currency PER TAB, obscure ways to obtain said currency, painfully slow gain of currency, the value of the items woeully insignificant to the total value of game time and possibility to earn, multiple loot box systems with a miniscule chance to earn anything valuable, grotesquely unfair ratio of covertion rate of real dollar to premium currency with next to no way to gain outside of spending real money.

There remains a fair deal of cosmetic content to gain without dropping a single dollar and it REMAINS a choice for the user if they wish, which I sadly have chosen and lament the thought of calculating that total value. Possibly sitting somewhere in the highest of tripple diggits. As it stands, not an ounce of this game is pay to win, all of the currencies prelude to just cosmetics and PUBG has some of the flashiest character designs, gun vehicle and even lobby skins BUT unlocking them is akin to an enternity of scraping your nails on a chalkboard and hoping that the next minute might yield gold.

Another point is the game mechanics. As a drop in, loot, survive and winner winner chicken dinner it is safe to say that, while not being the first in it's genre, PUBG has set the ultimate ground work and become synonymous with the game type, Battle Royal. Veritably the most saddest example of a ""where are they now?"" scenario like a slap in the face is that of PUBG now, similar to discovering your childhood hero is infact in rehab for various illegal activities. Which isn't to say the overabundance of cosmetics and crossover deals has interfered much at all with the overall game experience, just look at fortnite, everyone loves a bit of whimsy in their lives. Saddly the level of detail in gunplay, the strategey unique in many Mil Sims, the squad based gameplay and skill levels and outcomes have ALL been on a rapid decline. Quality of gameplay systematically making way for the glam and glitter designed to distract players into painfully forcing themselves into the meat grinder with the epitath of ""just one more"".

Futhermore understandable is the claim of ""get good"" in a game of competitive challenge. With most games, a progression from beginner to top player is meant to scale with the player, combining challenge with reward further cultivating an overall positive experience which provides opportunity to ""get good"". However many new player, returning player or just a casual drop in and out player are met with matchups agaisnt skill levels that belong only in the eSports level, denying the first five to ten steps required to obtain ""good"" status. Personally to say after 1300+ hours I have very little skill to show for time spent, of which at one point I commited time and effort to train myself. Learning in game physics, selecting guns to master an understanding of, developing of tactics and even perfection of the drop system, like the broken shattered dreams laid before me I am left with naught but ruin and frustration. After all that I'd like to point out, only ever casual gaming, never trying for anything other than drop in and play. That level of standard for a game is grotesque in it's entirety, solidifying the game primarily as a private club of people built only on the extremely skilled player. 

Throughout the many years PUBG has been alive, it has seen far more than it's fair share of cheaters. Myself and friends of mine have personally seen some of the worst cheating in our gaming experiences, from the simple terrain cliping or expliot, wall hacks, auto aim, zero recoil to some severe diobolical cheating. I personally witenessed a kill cam reveal a player from across the map, lock instantly onto various people positions throughout the map, move through ground, wall and building in seconds to end up right behind me. While the appeal of a free game is very attractive to many players, there is always a little caveat of the previously mentioned problems such as high loot box focus, agressive battle pass, small to moderate percentage of the game locked away ABOVE ALL lies the biggest achilies heel in the form of cheaters. There is ZERO recompense for these cheaters, bans easy to work back around, accounts to be made as infinatly as you can create emails. Understandably there can be little done sometimes, if someone wants to cheat and ruin other players games, they are going to BUT one simple way that can stop cheaters or at least a vast majority of them is a game price. You can't bounce back from a ban anywhere near as easily if it costs you financially.

Finally as a nail in the coffin, I have not once seen a game require in order to simply use a feature of it you phone number, personal phone number, information which is only likely needed to track or steal information. Security is an extremely garbage reason to require personal information in order to play ranked modes as opposed to quick match. Systems across the whole of game space in the entirety of ever have never once needed that type of feature and it should come as a precursor for what either the game devs or publishers really care about which is tracking it's users.

Whilst personaly I've had my own ups and downs, possitive and negative memories, pros and cons, loves and hates and despite this length of a review, I could fill this space double over with my own personal thoughts and experiences. This game and it's makers care and hope for only one thing, the money they can bleed out of it's users while they distract players with the flashy lights of pretty outfits and instill false hope that the random chances are remotely achieveable. Solid 0/10, this game deserves to be laid to rest.

Edited Adendum: The cheating is not nearly as prolific as previously stated and has been handle quite well of late compared to PUBG's earlier years.",False,2026-05-11 14:34:39,english,80711,"Since day one player, over 1300 hours, one of my top most played games, lots of time streaming and making memories with friends AND NOW...no more. For the TLDR, game bad. Carless greedy company, the worst gambling of loot boxes I've ever seen, no concern for the quality of experience for the players, laughable attempts of quashing the constant surge of cheaters, severly limited servers with no option of choice, insane ratio of in game currency value to the dollar and on top of all that is an extreme lapse of quality of in game content. Understandably, there are many different points of view and likes accross many different personalities so there is great varience in opinions and therefore not everything is for everyone. Aside from previous satement there is still some measure of quality that is objective and I'd like to dive into those over personal feelings or experience. Most importantly is quality of Publisher Developer. Naturally, the ideals and desires of the two are often differing, conflicting, independant, selfish. Why not, one will care more about face, money and status while the other concerns themselves with quality of product and it's users. Uncertain as to which one is more reasponsible for the copious negatives BUT there is almost nothing possitive to say about anything purtaining to the responsibilities of quality in game that either company oversee. Gambling is quite possibly one of the worst things to be implemented in casual and competitive gaming in order to create a strive for goals and the rewards of their completion and PUBG is without a doubt the worst one in the gaming industry containing Several different tabs to visit to obtain in game cosmetics, a couple different unique currency PER TAB, obscure ways to obtain said currency, painfully slow gain of currency, the value of the items woeully insignificant to the total value of game time and possibility to earn, multiple loot box systems with a miniscule chance to earn anything valuable, grotesquely unfair ratio of covertion rate of real dollar to premium currency with next to no way to gain outside of spending real money. There remains a fair deal of cosmetic content to gain without dropping a single dollar and it REMAINS a choice for the user if they wish, which I sadly have chosen and lament the thought of calculating that total value. Possibly sitting somewhere in the highest of tripple diggits. As it stands, not an ounce of this game is pay to win, all of the currencies prelude to just cosmetics and PUBG has some of the flashiest character designs, gun vehicle and even lobby skins BUT unlocking them is akin to an enternity of scraping your nails on a chalkboard and hoping that the next minute might yield gold. Another point is the game mechanics. As a drop in, loot, survive and winner winner chicken dinner it is safe to say that, while not being the first in it's genre, PUBG has set the ultimate ground work and become synonymous with the game type, Battle Royal. Veritably the most saddest example of a ""where are they now?"" scenario like a slap in the face is that of PUBG now, similar to discovering your childhood hero is infact in rehab for various illegal activities. Which isn't to say the overabundance of cosmetics and crossover deals has interfered much at all with the overall game experience, just look at fortnite, everyone loves a bit of whimsy in their lives. Saddly the level of detail in gunplay, the strategey unique in many Mil Sims, the squad based gameplay and skill levels and outcomes have ALL been on a rapid decline. Quality of gameplay systematically making way for the glam and glitter designed to distract players into painfully forcing themselves into the meat grinder with the epitath of ""just one more"". Futhermore understandable is the claim of ""get good"" in a game of competitive challenge. With most games, a progression from beginner to top player is meant to scale with the player, combining challenge with reward further cultivating an overall positive experience which provides opportunity to ""get good"". However many new player, returning player or just a casual drop in and out player are met with matchups agaisnt skill levels that belong only in the eSports level, denying the first five to ten steps required to obtain ""good"" status. Personally to say after 1300 hours I have very little skill to show for time spent, of which at one point I commited time and effort to train myself. Learning in game physics, selecting guns to master an understanding of, developing of tactics and even perfection of the drop system, like the broken shattered dreams laid before me I am left with naught but ruin and frustration. After all that I'd like to point out, only ever casual gaming, never trying for anything other than drop in and play. That level of standard for a game is grotesque in it's entirety, solidifying the game primarily as a private club of people built only on the extremely skilled player. Throughout the many years PUBG has been alive, it has seen far more than it's fair share of cheaters. Myself and friends of mine have personally seen some of the worst cheating in our gaming experiences, from the simple terrain cliping or expliot, wall hacks, auto aim, zero recoil to some severe diobolical cheating. I personally witenessed a kill cam reveal a player from across the map, lock instantly onto various people positions throughout the map, move through ground, wall and building in seconds to end up right behind me. While the appeal of a free game is very attractive to many players, there is always a little caveat of the previously mentioned problems such as high loot box focus, agressive battle pass, small to moderate percentage of the game locked away ABOVE ALL lies the biggest achilies heel in the form of cheaters. There is ZERO recompense for these cheaters, bans easy to work back around, accounts to be made as infinatly as you can create emails. Understandably there can be little done sometimes, if someone wants to cheat and ruin other players games, they are going to BUT one simple way that can stop cheaters or at least a vast majority of them is a game price. You can't bounce back from a ban anywhere near as easily if it costs you financially. Finally as a nail in the coffin, I have not once seen a game require in order to simply use a feature of it you phone number, personal phone number, information which is only likely needed to track or steal information. Security is an extremely garbage reason to require personal information in order to play ranked modes as opposed to quick match. Systems across the whole of game space in the entirety of ever have never once needed that type of feature and it should come as a precursor for what either the game devs or publishers really care about which is tracking it's users. Whilst personaly I've had my own ups and downs, possitive and negative memories, pros and cons, loves and hates and despite this length of a review, I could fill this space double over with my own personal thoughts and experiences. This game and it's makers care and hope for only one thing, the money they can bleed out of it's users while they distract players with the flashy lights of pretty outfits and instill false hope that the random chances are remotely achieveable. Solid 0 10, this game deserves to be laid to rest. Edited Adendum The cheating is not nearly as prolific as previously stated and has been handle quite well of late compared to PUBG's earlier years.",english,"Since day one player, over 1300 hours, one of my top most played games, lots of time streaming and making memories with friends AND NOW...no more. For the TLDR, game bad. Carless greedy company, the worst gambling of loot boxes I've ever seen, no concern for the quality of experience for the players, laughable attempts of quashing the constant surge of cheaters, severly limited servers with no option of choice, insane ratio of in game currency value to the dollar and on top of all that is an extreme lapse of quality of in game content. Understandably, there are many different points of view and likes accross many different personalities so there is great varience in opinions and therefore not everything is for everyone. Aside from previous satement there is still some measure of quality that is objective and I'd like to dive into those over personal feelings or experience. Most importantly is quality of Publisher Developer. Naturally, the ideals and desires of the two are often differing, conflicting, independant, selfish. Why not, one will care more about face, money and status while the other concerns themselves with quality of product and it's users. Uncertain as to which one is more reasponsible for the copious negatives BUT there is almost nothing possitive to say about anything purtaining to the responsibilities of quality in game that either company oversee. Gambling is quite possibly one of the worst things to be implemented in casual and competitive gaming in order to create a strive for goals and the rewards of their completion and PUBG is without a doubt the worst one in the gaming industry containing Several different tabs to visit to obtain in game cosmetics, a couple different unique currency PER TAB, obscure ways to obtain said currency, painfully slow gain of currency, the value of the items woeully insignificant to the total value of game time and possibility to earn, multiple loot box systems with a miniscule chance to earn anything valuable, grotesquely unfair ratio of covertion rate of real dollar to premium currency with next to no way to gain outside of spending real money. There remains a fair deal of cosmetic content to gain without dropping a single dollar and it REMAINS a choice for the user if they wish, which I sadly have chosen and lament the thought of calculating that total value. Possibly sitting somewhere in the highest of tripple diggits. As it stands, not an ounce of this game is pay to win, all of the currencies prelude to just cosmetics and PUBG has some of the flashiest character designs, gun vehicle and even lobby skins BUT unlocking them is akin to an enternity of scraping your nails on a chalkboard and hoping that the next minute might yield gold. Another point is the game mechanics. As a drop in, loot, survive and winner winner chicken dinner it is safe to say that, while not being the first in it's genre, PUBG has set the ultimate ground work and become synonymous with the game type, Battle Royal. Veritably the most saddest example of a ""where are they now?"" scenario like a slap in the face is that of PUBG now, similar to discovering your childhood hero is infact in rehab for various illegal activities. Which isn't to say the overabundance of cosmetics and crossover deals has interfered much at all with the overall game experience, just look at fortnite, everyone loves a bit of whimsy in their lives. Saddly the level of detail in gunplay, the strategey unique in many Mil Sims, the squad based gameplay and skill levels and outcomes have ALL been on a rapid decline. Quality of gameplay systematically making way for the glam and glitter designed to distract players into painfully forcing themselves into the meat grinder with the epitath of ""just one more"". Futhermore understandable is the claim of ""get good"" in a game of competitive challenge. With most games, a progression from beginner to top player is meant to scale with the player, combining challenge with reward further cultivating an overall positive experience which provides opportunity to ""get good"". However many new player, returning player or just a casual drop in and out player are met with matchups agaisnt skill levels that belong only in the eSports level, denying the first five to ten steps required to obtain ""good"" status. Personally to say after 1300 hours I have very little skill to show for time spent, of which at one point I commited time and effort to train myself. Learning in game physics, selecting guns to master an understanding of, developing of tactics and even perfection of the drop system, like the broken shattered dreams laid before me I am left with naught but ruin and frustration. After all that I'd like to point out, only ever casual gaming, never trying for anything other than drop in and play. That level of standard for a game is grotesque in it's entirety, solidifying the game primarily as a private club of people built only on the extremely skilled player. Throughout the many years PUBG has been alive, it has seen far more than it's fair share of cheaters. Myself and friends of mine have personally seen some of the worst cheating in our gaming experiences, from the simple terrain cliping or expliot, wall hacks, auto aim, zero recoil to some severe diobolical cheating. I personally witenessed a kill cam reveal a player from across the map, lock instantly onto various people positions throughout the map, move through ground, wall and building in seconds to end up right behind me. While the appeal of a free game is very attractive to many players, there is always a little caveat of the previously mentioned problems such as high loot box focus, agressive battle pass, small to moderate percentage of the game locked away ABOVE ALL lies the biggest achilies heel in the form of cheaters. There is ZERO recompense for these cheaters, bans easy to work back around, accounts to be made as infinatly as you can create emails. Understandably there can be little done sometimes, if someone wants to cheat and ruin other players games, they are going to BUT one simple way that can stop cheaters or at least a vast majority of them is a game price. You can't bounce back from a ban anywhere near as easily if it costs you financially. Finally as a nail in the coffin, I have not once seen a game require in order to simply use a feature of it you phone number, personal phone number, information which is only likely needed to track or steal information. Security is an extremely garbage reason to require personal information in order to play ranked modes as opposed to quick match. Systems across the whole of game space in the entirety of ever have never once needed that type of feature and it should come as a precursor for what either the game devs or publishers really care about which is tracking it's users. Whilst personaly I've had my own ups and downs, possitive and negative memories, pros and cons, loves and hates and despite this length of a review, I could fill this space double over with my own personal thoughts and experiences. This game and it's makers care and hope for only one thing, the money they can bleed out of it's users while they distract players with the flashy lights of pretty outfits and instill false hope that the random chances are remotely achieveable. Solid 0 10, this game deserves to be laid to rest. Edited Adendum The cheating is not nearly as prolific as previously stated and has been handle quite well of late compared to PUBG's earlier years.",0.126,0.726,0.148,0.9751,positive,0
PUBG,Cok_Oyunculu,尼玛竞技花98现在2WBP  让开挂玩的成本更低了  倒闭吧这游戏 哈哈哈哈哈哈哈哈哈哈 骗老子钱,False,2026-05-12 07:08:43,schinese,113147,尼玛竞技花98现在2WBP 让开挂玩的成本更低了 倒闭吧这游戏 哈哈哈哈哈哈哈哈哈哈 骗老子钱,schinese,"Nima Sports spends 98 and now has 2WBP, making cheating cheaper. Let’s shut down this game. Hahahahahahahahahaha. You’re cheating me out of money.",0.255,0.745,0.0,-0.802,negative,1
PUBG,Cok_Oyunculu,"У 70% игроков проблема с запуском игры. Проблема с заставкой экрана ""чёрный дым"" при запуске и после матча не решается уже 3 год, все методы доступные в интернете по устранению этой проблемы уже не актуальны, возможно за исключением сторонних приложений!",False,2026-05-13 14:29:36,russian,17230,"У 70 игроков проблема с запуском игры. Проблема с заставкой экрана ""чёрный дым"" при запуске и после матча не решается уже 3 год, все методы доступные в интернете по устранению этой проблемы уже не актуальны, возможно за исключением сторонних приложений!",russian,"70 players are having trouble launching the game. The problem with the “black smoke” screen saver at startup and after a match has not been solved for 3 years now; all the methods available on the Internet to fix this problem are no longer relevant, perhaps with the exception of third-party applications!",0.214,0.786,0.0,-0.8964,negative,1
