game_name,game_genre,review,voted_up,timestamp_created,language,playtime_forever,review_clean,detected_language,review_english,vader_neg,vader_neu,vader_pos,vader_compound,sentiment,vader_voted_match,categories,categories_str,category_count,cat_performans,cat_teknik_sorun,cat_fiyat,cat_hikaye_icerik,cat_oynanabilirlik,cat_cok_oyunculu,cat_destek_guncelleme,cat_gorsel_ses,cat_diger
Stellaris,Strateji,"How to say first? Fix bugs please.
There is translations bugs (no display of certains ressources translations), colonizations bugs while terraforming, habitats bugs while bombing (lock at 20%), and some others that I forget.

The game is Awesome since 4.3 (and maybe 4.0), lot of changes made the game interesting again.
I played the game since V1 and V2.
Early game way more clear, mid game awesome (WAR and economy), late game less problematic but need some improvement (like stop bots make habitats everywhere)
best 4X game i know.",True,2026-05-27 11:35:21,english,60605,"How to say first? Fix bugs please. There is translations bugs (no display of certains ressources translations), colonizations bugs while terraforming, habitats bugs while bombing (lock at 20 ), and some others that I forget. The game is Awesome since 4.3 (and maybe 4.0), lot of changes made the game interesting again. I played the game since V1 and V2. Early game way more clear, mid game awesome (WAR and economy), late game less problematic but need some improvement (like stop bots make habitats everywhere) best 4X game i know.",english,"How to say first? Fix bugs please. There is translations bugs (no display of certains ressources translations), colonizations bugs while terraforming, habitats bugs while bombing (lock at 20 ), and some others that I forget. The game is Awesome since 4.3 (and maybe 4.0), lot of changes made the game interesting again. I played the game since V1 and V2. Early game way more clear, mid game awesome (WAR and economy), late game less problematic but need some improvement (like stop bots make habitats everywhere) best 4X game i know.",0.08,0.693,0.228,0.9471,positive,1,['teknik_sorun'],teknik_sorun,1,0,1,0,0,0,0,0,0,0
Stellaris,Strateji,Excellent game in terms of strategy.  But could be given a different engine for simulating combat.,True,2026-05-27 06:50:45,english,87833,Excellent game in terms of strategy. But could be given a different engine for simulating combat.,english,Excellent game in terms of strategy. But could be given a different engine for simulating combat.,0.159,0.72,0.121,-0.1901,negative,0,['oynanabilirlik'],oynanabilirlik,1,0,0,0,0,1,0,0,0,0
Stellaris,Strateji,"so it seems like there are issues regarding user data collection and such but as one may be able to surmise by my playtime I'm too deep in now so do your own research before buying. Good game though, I like space",True,2026-05-27 06:19:50,english,1326,"so it seems like there are issues regarding user data collection and such but as one may be able to surmise by my playtime I'm too deep in now so do your own research before buying. Good game though, I like space",english,"so it seems like there are issues regarding user data collection and such but as one may be able to surmise by my playtime I'm too deep in now so do your own research before buying. Good game though, I like space",0.0,0.813,0.187,0.8394,positive,1,['diger'],diger,1,0,0,0,0,0,0,0,0,1
Stellaris,Strateji,has the greatest storytelling and personal roleplaying capacity of any game I've played when designing your race and kingdoms/starfaring race.,True,2026-05-27 03:05:53,english,26922,has the greatest storytelling and personal roleplaying capacity of any game I've played when designing your race and kingdoms starfaring race.,english,has the greatest storytelling and personal roleplaying capacity of any game I've played when designing your race and kingdoms starfaring race.,0.0,0.742,0.258,0.765,positive,1,['diger'],diger,1,0,0,0,0,0,0,0,0,1
Stellaris,Strateji,"amazing game with great replayability, only negative thing for me is the pricing of each dlc",True,2026-05-26 20:41:44,english,8536,"amazing game with great replayability, only negative thing for me is the pricing of each dlc",english,"amazing game with great replayability, only negative thing for me is the pricing of each dlc",0.15,0.528,0.321,0.6369,positive,1,['fiyat'],fiyat,1,0,0,1,0,0,0,0,0,0
Stellaris,Strateji,"Первые впечатления от игры большие. Цены конечно на все длс и саму игру кусаются, но первый пункт можно взять из интернета) Игру купил по скидке ради интереса. Многое в игре продумано, мне понравилось, продолжаю играть дальше.",True,2026-05-26 20:34:32,russian,1615,"Первые впечатления от игры большие. Цены конечно на все длс и саму игру кусаются, но первый пункт можно взять из интернета) Игру купил по скидке ради интереса. Многое в игре продумано, мне понравилось, продолжаю играть дальше.",russian,"First impressions of the game are great. Of course, the prices for all the DLC and the game itself are steep, but the first point can be taken from the Internet) I bought the game at a discount just for fun. A lot of things in the game are thought out, I liked it, I continue to play.",0.0,0.777,0.223,0.9354,positive,1,"['fiyat', 'oynanabilirlik']",fiyat|oynanabilirlik,2,0,0,1,0,1,0,0,0,0
Stellaris,Strateji,love it when i kill Dimensional Horror (his name is freaky josh) and i start to do experiements and suddenly my main plaents turns into freaky joshs little brothers home and kills all people (also the mode where you can play together as one empire is really fun),True,2026-05-26 20:34:11,german,2179,love it when i kill Dimensional Horror (his name is freaky josh) and i start to do experiements and suddenly my main plaents turns into freaky joshs little brothers home and kills all people (also the mode where you can play together as one empire is really fun),german,love it when i kill Dimensional Horror (his name is freaky josh) and i start to do experiements and suddenly my main plaents turns into freaky joshs little brothers home and kills all people (also the mode where you can play together as one empire is really fun),0.252,0.596,0.152,-0.7722,negative,0,['oynanabilirlik'],oynanabilirlik,1,0,0,0,0,1,0,0,0,0
Stellaris,Strateji,内容比较多，策略性很强,True,2026-05-26 17:16:06,schinese,2831,内容比较多 策略性很强,schinese,A lot of content and very strategic,0.0,1.0,0.0,0.0,neutral,0,['diger'],diger,1,0,0,0,0,0,0,0,0,1
Stellaris,Strateji,"Космос идеально подходит для того, чтобы переключить фокус с земных забот на масштабные, вечные вещи. Бездонная черная пустота, миллиарды звезд и неведомые миры веками заставляли людей смотреть вверх и забывать о повседневной суете.В астрономии и философии есть потрясающее понятие, которое очень приземляет и одновременно вдохновляет. Оно называется ""Эффект обзора"".

Находясь в черной пустоте, астронавты видят нашу планету как крошечный, хрупкий, светящийся голубой шарик, защищенный лишь тонкой полоской атмосферы. В этот момент у человека полностью стираются границы в голове. Национальные конфликты, мелкие обиды, личные драмы и бытовые проблемы мгновенно кажутся ничтожными. Приходит глубокое осознание: мы все - пассажиры одного маленького корабля, летящего сквозь бесконечность, и всё, что у нас есть- это мы сами и люди рядом.

Игра в Stellaris как раз дает прикоснуться к этому масштабу. Когда ты управляешь целыми галактиками, строишь торговые союзы и ведешь цивилизации через века, реальное время начинает лететь быстрее, а личные рубежи и ожидания переносятся гораздо легче.",True,2026-05-26 16:50:38,russian,7106,"Космос идеально подходит для того, чтобы переключить фокус с земных забот на масштабные, вечные вещи. Бездонная черная пустота, миллиарды звезд и неведомые миры веками заставляли людей смотреть вверх и забывать о повседневной суете.В астрономии и философии есть потрясающее понятие, которое очень приземляет и одновременно вдохновляет. Оно называется ""Эффект обзора"". Находясь в черной пустоте, астронавты видят нашу планету как крошечный, хрупкий, светящийся голубой шарик, защищенный лишь тонкой полоской атмосферы. В этот момент у человека полностью стираются границы в голове. Национальные конфликты, мелкие обиды, личные драмы и бытовые проблемы мгновенно кажутся ничтожными. Приходит глубокое осознание мы все - пассажиры одного маленького корабля, летящего сквозь бесконечность, и всё, что у нас есть- это мы сами и люди рядом. Игра в Stellaris как раз дает прикоснуться к этому масштабу. Когда ты управляешь целыми галактиками, строишь торговые союзы и ведешь цивилизации через века, реальное время начинает лететь быстрее, а личные рубежи и ожидания переносятся гораздо легче.",russian,"Space is ideal for switching focus from earthly concerns to large-scale, eternal things. The bottomless black void, billions of stars and unknown worlds have made people look up and forget about the everyday hustle and bustle for centuries. There is an amazing concept in astronomy and philosophy that is very grounding and inspiring at the same time. It's called the Overview Effect. From the black void, astronauts see our planet as a tiny, fragile, glowing blue ball, protected only by a thin strip of atmosphere. At this moment, the boundaries in a person’s head are completely erased. National conflicts, minor grievances, personal dramas and everyday problems instantly seem insignificant. There comes a deep realization that we are all passengers of one small ship flying through infinity, and all we have is ourselves and the people nearby. Playing Stellaris just gives you a taste of this scale. When you rule entire galaxies, build trade alliances and lead civilizations through centuries, real time begins to fly faster, and personal milestones and expectations are much easier to bear.",0.064,0.845,0.092,0.7506,positive,1,['gorsel_ses'],gorsel_ses,1,0,0,0,0,0,0,0,1,0
Stellaris,Strateji,"Stellaris je strategická hra, ktorá sa odohráva na galaktickej škále. Je o budovaní vlastného impéria, ktoré vyrastie z jedného systému až na obrovské galaktické impérium!
Štýly hrania sú rôzne: agresívni xenofóbovia, robotov milujúci materialisti, fanatickí spiritualisti s cieľom galaktickej svätej výpravy, xenofilovia budujúci federáciu, vytvorenie utópie, vládnutie železnou rukou a mnoho ďalšieho.
Nedávne desiate výročie integrovalo tri DLC do základnej hry. Takže aj pre chudobných ľudí, ako som ja :D, sa táto hra stala omnoho zaujímavejšou.
Vytvoriť robo-hivemind alebo hivemind bol vždy môj sen a teraz sa môže splniť!
Hru určite odporúčam.",True,2026-05-26 15:02:07,czech,21279,"Stellaris je strategická hra, ktorá sa odohráva na galaktickej škále. Je o budovaní vlastného impéria, ktoré vyrastie z jedného systému až na obrovské galaktické impérium! Štýly hrania sú rôzne agresívni xenofóbovia, robotov milujúci materialisti, fanatickí spiritualisti s cieľom galaktickej svätej výpravy, xenofilovia budujúci federáciu, vytvorenie utópie, vládnutie železnou rukou a mnoho ďalšieho. Nedávne desiate výročie integrovalo tri DLC do základnej hry. Takže aj pre chudobných ľudí, ako som ja D, sa táto hra stala omnoho zaujímavejšou. Vytvoriť robo-hivemind alebo hivemind bol vždy môj sen a teraz sa môže splniť! Hru určite odporúčam.",czech,"Stellaris is a strategy game that takes place on a galactic scale. It's about building your own empire that will grow from a single system to a huge galactic empire! Playstyles vary from aggressive xenophobes, robot-loving materialists, fanatical spiritualists with a goal of a galactic holy quest, xenophiles building a federation, creating a utopia, ruling with an iron fist, and much more. The recent tenth anniversary integrated three DLCs into the base game. So even for poor people like me D, this game has become much more interesting. Creating a robo-hivemind or hivemind has always been my dream and now it can come true! I definitely recommend the game.",0.039,0.778,0.183,0.9441,positive,1,['diger'],diger,1,0,0,0,0,0,0,0,0,1
Stellaris,Strateji,"An incredibly rich, always evolving game. I am never bored.",True,2026-05-26 01:49:52,english,99926,"An incredibly rich, always evolving game. I am never bored.",english,"An incredibly rich, always evolving game. I am never bored.",0.0,0.584,0.416,0.6915,positive,1,['diger'],diger,1,0,0,0,0,0,0,0,0,1
Stellaris,Strateji,"It's the deepest, most immersive 4x grand strategy space game you can find.",True,2026-05-25 22:39:50,english,14747,"It's the deepest, most immersive 4x grand strategy space game you can find.",english,"It's the deepest, most immersive 4x grand strategy space game you can find.",0.0,0.786,0.214,0.5046,positive,1,['gorsel_ses'],gorsel_ses,1,0,0,0,0,0,0,0,1,0
Stellaris,Strateji,"I've played a lot of Stellaris.  It has, at times, been an addictive experience.  I once played this game for roughly 26 hours straight, albeit with breaks for food and whatnot.  So, why am I not recommending the game?  First off, it has way too much DLC.  Even with sales, it just costs too much to be worthwhile, at least for me.  Secondly, the game keeps changing.  I know it's possible to revert to a previous version of the game but frankly I can't be bothered at this point to learn how to do that.  When seeing a game update makes you lose interest in it for months or even years, something is really wrong.  As for me, it has reached the point where I doubt I'll ever have any interest in this game again.  That said, I did mostly enjoy my time with the game.",False,2026-05-25 20:36:26,english,33832,"I've played a lot of Stellaris. It has, at times, been an addictive experience. I once played this game for roughly 26 hours straight, albeit with breaks for food and whatnot. So, why am I not recommending the game? First off, it has way too much DLC. Even with sales, it just costs too much to be worthwhile, at least for me. Secondly, the game keeps changing. I know it's possible to revert to a previous version of the game but frankly I can't be bothered at this point to learn how to do that. When seeing a game update makes you lose interest in it for months or even years, something is really wrong. As for me, it has reached the point where I doubt I'll ever have any interest in this game again. That said, I did mostly enjoy my time with the game.",english,"I've played a lot of Stellaris. It has, at times, been an addictive experience. I once played this game for roughly 26 hours straight, albeit with breaks for food and whatnot. So, why am I not recommending the game? First off, it has way too much DLC. Even with sales, it just costs too much to be worthwhile, at least for me. Secondly, the game keeps changing. I know it's possible to revert to a previous version of the game but frankly I can't be bothered at this point to learn how to do that. When seeing a game update makes you lose interest in it for months or even years, something is really wrong. As for me, it has reached the point where I doubt I'll ever have any interest in this game again. That said, I did mostly enjoy my time with the game.",0.068,0.796,0.136,0.8178,positive,0,"['fiyat', 'oynanabilirlik', 'destek_guncelleme']",fiyat|oynanabilirlik|destek_guncelleme,3,0,0,1,0,1,0,1,0,0
Stellaris,Strateji,"this game is pure cracka
buy the base game? the cracka wears off so you buy a dlc
endless cycle of buying cracka to get that hit
8hr game session incoming soon",True,2026-05-25 16:11:13,dutch,4255,this game is pure cracka buy the base game? the cracka wears off so you buy a dlc endless cycle of buying cracka to get that hit 8hr game session incoming soon,dutch,this game is pure cracka buy the base game? the cracka wears off so you buy a dlc endless cycle of buying cracka to get that hit 8hr game session incoming soon,0.0,1.0,0.0,0.0,neutral,0,['fiyat'],fiyat,1,0,0,1,0,0,0,0,0,0
Stellaris,Strateji,"游戏短评｜群星（Stellaris）
评分：7.8/10  
标签：太空4X、P社大战略、科幻帝国、叙事生成器

P社太空战略扛鼎之作，把“探索-扩张-开发-征服”的4X玩法玩出了史诗感。从自定义外星文明起步，坐着科研船摸遍未知星系，拆“宇宙盲盒”的快感直接拉满——有时是满星球金矿的狂喜，有时是撞上利维坦巨兽的惊吓，随机事件总能给你意想不到的科幻故事。

帝国管理深度拉满：科技树、思潮政体、外交博弈、舰队设计，每个系统都有讲究，玩起来像在指挥一整个文明的命运。后期还有天灾入侵、星际联盟等大事件，让宇宙格局瞬间紧张。
美中不足是新手门槛高，前期容易被一堆数值和系统绕晕；中期偶尔会陷入“重复建设”的倦怠期；DLC虽丰富但价格不菲，想玩到完整体验得花不少钱。

如果你爱科幻、能沉下心研究复杂系统，这游戏能让你通宵爆肝——毕竟看着自己的帝国从一颗星球扩张到横跨银河，那种成就感真的没话说。

我感觉自己像个人机。",True,2026-05-25 11:29:20,schinese,19587,游戏短评 群星 Stellaris 评分 7.8 10 标签 太空4X P社大战略 科幻帝国 叙事生成器 P社太空战略扛鼎之作 把 探索-扩张-开发-征服 的4X玩法玩出了史诗感 从自定义外星文明起步 坐着科研船摸遍未知星系 拆 宇宙盲盒 的快感直接拉满 有时是满星球金矿的狂喜 有时是撞上利维坦巨兽的惊吓 随机事件总能给你意想不到的科幻故事 帝国管理深度拉满 科技树 思潮政体 外交博弈 舰队设计 每个系统都有讲究 玩起来像在指挥一整个文明的命运 后期还有天灾入侵 星际联盟等大事件 让宇宙格局瞬间紧张 美中不足是新手门槛高 前期容易被一堆数值和系统绕晕 中期偶尔会陷入 重复建设 的倦怠期 DLC虽丰富但价格不菲 想玩到完整体验得花不少钱 如果你爱科幻 能沉下心研究复杂系统 这游戏能让你通宵爆肝 毕竟看着自己的帝国从一颗星球扩张到横跨银河 那种成就感真的没话说 我感觉自己像个人机,schinese,"Game Short Review Stars Stellaris Rating 7.8 10 Tags Space 4X P Society Grand Strategy Science Fiction Empire Narrative Generator P Company's space strategy is the leading work. The 4X gameplay of exploration-expansion-development-conquest has an epic feel. Starting from a customized alien civilization, traveling around unknown galaxies on a scientific research ship, and the pleasure of dismantling the blind box of the universe is straight away. Sometimes it is the ecstasy of gold mines all over the planet, sometimes it is the shock of bumping into the Leviathan beast. Random events can always give you unexpected science fiction stories. The empire management is full of depth, technology tree, ideological and political system, diplomatic game, fleet design. Each system has its own particularity. It feels like commanding the fate of an entire civilization. In the later stage, there will be natural disaster invasions, interstellar alliances and other major events, which will make the universe tense instantly. If you love science fiction and can concentrate on studying complex systems, this game will keep you up all night. After all, watching your empire expand from one planet to across the galaxy, the sense of accomplishment is truly incredible. I feel like a personal computer.",0.052,0.819,0.13,0.9506,positive,1,"['hikaye_icerik', 'oynanabilirlik']",hikaye_icerik|oynanabilirlik,2,0,0,0,1,1,0,0,0,0
Stellaris,Strateji,probably the best 4x game for all difficulty and experience levels. wish it had more of an in-depth law system where I could make my own custom laws and the AI have a genuine positive or negative reaction to it.,True,2026-05-24 23:31:44,english,5141,probably the best 4x game for all difficulty and experience levels. wish it had more of an in-depth law system where I could make my own custom laws and the AI have a genuine positive or negative reaction to it.,english,probably the best 4x game for all difficulty and experience levels. wish it had more of an in-depth law system where I could make my own custom laws and the AI have a genuine positive or negative reaction to it.,0.118,0.678,0.203,0.6597,positive,1,['oynanabilirlik'],oynanabilirlik,1,0,0,0,0,1,0,0,0,0
Stellaris,Strateji,"非常好的游戏,4.3的更新让我的电表倒转,科技就像回到了史前时代",True,2026-05-24 17:34:37,schinese,51739,"非常好的游戏,4.3的更新让我的电表倒转,科技就像回到了史前时代",schinese,"Very good game, the 4.3 update made my electricity meter turn back, technology is like returning to prehistoric times",0.0,0.749,0.251,0.6901,positive,1,['destek_guncelleme'],destek_guncelleme,1,0,0,0,0,0,0,1,0,0
Stellaris,Strateji,"Game is good, although in multiplayer resync problems can ruin games. 

Paradox DLC policy will take your wallet.",True,2026-05-24 17:30:14,english,28302,"Game is good, although in multiplayer resync problems can ruin games. Paradox DLC policy will take your wallet.",english,"Game is good, although in multiplayer resync problems can ruin games. Paradox DLC policy will take your wallet.",0.319,0.565,0.117,-0.6124,negative,0,"['fiyat', 'cok_oyunculu']",fiyat|cok_oyunculu,2,0,0,1,0,0,1,0,0,0
