game_name,game_genre,review,voted_up,timestamp_created,language,playtime_forever,review_clean,detected_language,review_english,vader_neg,vader_neu,vader_pos,vader_compound,sentiment,vader_voted_match,categories,categories_str,category_count,cat_performans,cat_teknik_sorun,cat_fiyat,cat_hikaye_icerik,cat_oynanabilirlik,cat_cok_oyunculu,cat_destek_guncelleme,cat_gorsel_ses,cat_diger
Stellaris,Strateji,"I used to love this game and have spent countless nights where I should have been studying, ruling the star systems with friends. However I am so tired of taking a break, coming back and having to relearn the game because they rework how the game runs and functions every month or so. Very few times have these changes actually improved the game, many break it. 

I understand it's paradox, but the DLC are insane, I have most of them and can that most of them should have been built into the main game for free. 

Last but not least.. The User data collection and selling of such data to third parties is such a low blow, especially for a company that charges you $40 for a base game and $160 for DLC afterwards. The data collection is invasive, unnecessary, and downright greedy. 

If I could, I wish I could return the game, DLC, and get my life back that I wasted with this game",False,2026-05-20 18:14:26,english,61561,"I used to love this game and have spent countless nights where I should have been studying, ruling the star systems with friends. However I am so tired of taking a break, coming back and having to relearn the game because they rework how the game runs and functions every month or so. Very few times have these changes actually improved the game, many break it. I understand it's paradox, but the DLC are insane, I have most of them and can that most of them should have been built into the main game for free. Last but not least.. The User data collection and selling of such data to third parties is such a low blow, especially for a company that charges you 40 for a base game and 160 for DLC afterwards. The data collection is invasive, unnecessary, and downright greedy. If I could, I wish I could return the game, DLC, and get my life back that I wasted with this game",english,"I used to love this game and have spent countless nights where I should have been studying, ruling the star systems with friends. However I am so tired of taking a break, coming back and having to relearn the game because they rework how the game runs and functions every month or so. Very few times have these changes actually improved the game, many break it. I understand it's paradox, but the DLC are insane, I have most of them and can that most of them should have been built into the main game for free. Last but not least.. The User data collection and selling of such data to third parties is such a low blow, especially for a company that charges you 40 for a base game and 160 for DLC afterwards. The data collection is invasive, unnecessary, and downright greedy. If I could, I wish I could return the game, DLC, and get my life back that I wasted with this game",0.104,0.8,0.096,-0.108,negative,1,['fiyat'],fiyat,1,0,0,1,0,0,0,0,0,0
Stellaris,Strateji,"The game is currently rated very positive for all time reviews, and mixed for recent reviews. Let me explain what's happening.

Game good. Game get update. Update causes loads of lag and very bug-ridden. Fanbase justifiably upset. Mixed reviews.

That being said, they have been working on addressing these issues since and the game runs better now. Stellaris has recently hit its 10-year anniversary and with this game getting constant free updates and new content since I think that while I agree the production team isn't without criticism the game is still really, really high quality.",True,2026-05-09 22:45:35,english,4233,"The game is currently rated very positive for all time reviews, and mixed for recent reviews. Let me explain what's happening. Game good. Game get update. Update causes loads of lag and very bug-ridden. Fanbase justifiably upset. Mixed reviews. That being said, they have been working on addressing these issues since and the game runs better now. Stellaris has recently hit its 10-year anniversary and with this game getting constant free updates and new content since I think that while I agree the production team isn't without criticism the game is still really, really high quality.",english,"The game is currently rated very positive for all time reviews, and mixed for recent reviews. Let me explain what's happening. Game good. Game get update. Update causes loads of lag and very bug-ridden. Fanbase justifiably upset. Mixed reviews. That being said, they have been working on addressing these issues since and the game runs better now. Stellaris has recently hit its 10-year anniversary and with this game getting constant free updates and new content since I think that while I agree the production team isn't without criticism the game is still really, really high quality.",0.063,0.778,0.159,0.8937,positive,1,"['performans', 'teknik_sorun', 'destek_guncelleme']",performans|teknik_sorun|destek_guncelleme,3,1,1,0,0,0,0,1,0,0
Stellaris,Strateji,"Like all paradox games, this is a scam meant to sell you DLC. The base game is a hollow shell. I paid for 1 month subscription to all the DLC and I can tell you that none of it is worth your cold hard cash. They sell you almost nothing in each DLC. It only looks like a lot of content spread out over 10 years of bloated development. They still demand retail prices for new DLC and season passes. The next DLC they promise ships that function like planets. Sounds cool but not worth paying money for it. If Paradox was a good company, they would have stopped developing this game and made Stellaris 2. But the quality in their games have spiraled into the gutter and all they care about is milking DLC. All the veterans are mad about changes and it's clear the game's balance is ruined with each new patch. They censor forums, ban dissenting opinions, and have armies of shills that will berate you for any criticism. Once you have played a complete game or two, everything becomes boring and the events are no longer interesting.",False,2026-05-14 15:16:38,english,20503,"Like all paradox games, this is a scam meant to sell you DLC. The base game is a hollow shell. I paid for 1 month subscription to all the DLC and I can tell you that none of it is worth your cold hard cash. They sell you almost nothing in each DLC. It only looks like a lot of content spread out over 10 years of bloated development. They still demand retail prices for new DLC and season passes. The next DLC they promise ships that function like planets. Sounds cool but not worth paying money for it. If Paradox was a good company, they would have stopped developing this game and made Stellaris 2. But the quality in their games have spiraled into the gutter and all they care about is milking DLC. All the veterans are mad about changes and it's clear the game's balance is ruined with each new patch. They censor forums, ban dissenting opinions, and have armies of shills that will berate you for any criticism. Once you have played a complete game or two, everything becomes boring and the events are no longer interesting.",english,"Like all paradox games, this is a scam meant to sell you DLC. The base game is a hollow shell. I paid for 1 month subscription to all the DLC and I can tell you that none of it is worth your cold hard cash. They sell you almost nothing in each DLC. It only looks like a lot of content spread out over 10 years of bloated development. They still demand retail prices for new DLC and season passes. The next DLC they promise ships that function like planets. Sounds cool but not worth paying money for it. If Paradox was a good company, they would have stopped developing this game and made Stellaris 2. But the quality in their games have spiraled into the gutter and all they care about is milking DLC. All the veterans are mad about changes and it's clear the game's balance is ruined with each new patch. They censor forums, ban dissenting opinions, and have armies of shills that will berate you for any criticism. Once you have played a complete game or two, everything becomes boring and the events are no longer interesting.",0.18,0.714,0.106,-0.9527,negative,1,"['teknik_sorun', 'fiyat', 'hikaye_icerik', 'oynanabilirlik']",teknik_sorun|fiyat|hikaye_icerik|oynanabilirlik,4,0,1,1,1,1,0,0,0,0
Stellaris,Strateji,"我没能等到人类驶向深空，但群星让我提前赴了这场约。

在我眼里，银河从不是用来征服的，是用来填补遗憾的。探索、飞升、天灾、外交——每一局都像在另一条时间线上，亲手为文明点亮一片星海。生得太早，触不到真正的星辰。

但至少在这里，我决定过它们如何闪耀。",True,2026-05-12 02:58:22,schinese,7860,我没能等到人类驶向深空 但群星让我提前赴了这场约 在我眼里 银河从不是用来征服的 是用来填补遗憾的 探索 飞升 天灾 外交 每一局都像在另一条时间线上 亲手为文明点亮一片星海 生得太早 触不到真正的星辰 但至少在这里 我决定过它们如何闪耀,schinese,"I couldn't wait until humans sailed into deep space, but the stars made me make this appointment early. In my eyes, the Milky Way is never meant for conquest, but for filling up regrets. Exploration, ascension, natural disasters, diplomacy. Every game is like being on another timeline, lighting up a sea of ​​stars for civilization with my own hands. I was born too early and cannot touch the real stars, but at least here I have decided how they shine.",0.089,0.815,0.096,-0.0772,negative,0,['diger'],diger,1,0,0,0,0,0,0,0,0,1
Stellaris,Strateji,"群星是本人入坑p社的第一款游戏（虽然现在玩钢丝多），可以说和文明6一样是我的大战略启蒙作，不可否认是一款十分优秀的游戏。
只是p社的逆天更新毁了这游戏，每次大版本都好像在玩全新的游戏一样，重新学习成本很高，然后这样也就算了，你们为什么要每次和更新都把游戏的数值向更狗屎的方向推动？？？
我喜欢这款游戏，所以我决定给它一个差评，希望p社能在以后不要再端上来像是4.3这种傻逼更新了，还有不要每个大版本大改玩法了!",False,2026-05-10 10:30:19,schinese,12773,群星是本人入坑p社的第一款游戏 虽然现在玩钢丝多 可以说和文明6一样是我的大战略启蒙作 不可否认是一款十分优秀的游戏 只是p社的逆天更新毁了这游戏 每次大版本都好像在玩全新的游戏一样 重新学习成本很高 然后这样也就算了 你们为什么要每次和更新都把游戏的数值向更狗屎的方向推动 我喜欢这款游戏 所以我决定给它一个差评 希望p社能在以后不要再端上来像是4.3这种傻逼更新了 还有不要每个大版本大改玩法了!,schinese,"Stellar Stars is the first game that I joined P Club. Although I play a lot of it now, it can be said that it is my grand strategy enlightenment game like Civilization 6. It is undeniable that it is a very good game. It is just that P Club's incredible update ruined this game. Every major version is like playing a brand new game. The cost of re-learning is very high. Then forget it. Why do you push the game's values ​​in a more shitty direction with every update? I like this game, so I decided to give it a negative review I hope that P will not come up with stupid updates like 4.3 in the future, and that it will not drastically change the gameplay with every major version!",0.103,0.731,0.166,0.7914,positive,0,"['fiyat', 'oynanabilirlik', 'destek_guncelleme']",fiyat|oynanabilirlik|destek_guncelleme,3,0,0,1,0,1,0,1,0,0
Stellaris,Strateji,"[h1] 什么时候能把导弹飞行速度改正啊 [/h1]

[i] （现在导弹发射时只有自身速度参数，从200速度的飞船上发射是30速度，从0速度的船上发射也是30速度，正确速度应该是a：200船体速度+30导弹速度，且在太空中应为+30加速度，所以现在导弹速度是极低的且不正确）
例如：不可能是以500km/h的飞机上扔下了一枚30km/h的导弹，它的正确初速度应为（500+30）km/h。 [/i]

[b] 否则小型和轻型飞船的导弹几乎没有意义。 [/b]

:steamsad::steamsad::steamsad:",True,2026-05-19 15:25:16,schinese,18225,h1 什么时候能把导弹飞行速度改正啊 h1 i 现在导弹发射时只有自身速度参数 从200速度的飞船上发射是30速度 从0速度的船上发射也是30速度 正确速度应该是a 200船体速度 30导弹速度 且在太空中应为 30加速度 所以现在导弹速度是极低的且不正确 例如 不可能是以500km h的飞机上扔下了一枚30km h的导弹 它的正确初速度应为 500 30 km h i b 否则小型和轻型飞船的导弹几乎没有意义 b steamsad steamsad steamsad,schinese,"h1 When can the missile flight speed be corrected? h1 i Now the missile only has its own speed parameter when launching. Launching from a spaceship with a speed of 200 is 30 speed. Launching from a ship with a speed of 0 is also a speed of 30. The correct speed should be a 200 hull speed 30 missile speed, and it should be 30 acceleration in space. So the current missile speed is extremely low and incorrect. For example, it is impossible to drop a 30km h missile from a 500km h aircraft. Its correct initial speed should be 500 30 km h i b Otherwise missiles for small and light craft would be almost meaningless b steamsad steamsad steamsad",0.056,0.944,0.0,-0.7269,negative,0,['diger'],diger,1,0,0,0,0,0,0,0,0,1
Stellaris,Strateji,"I cant play the game anymore, the new update made it impossible for my launcher to even open the game without my antivirus program stopping it from going up.

You know they got alot of bad spyware in the game when even windows security has to step in.",False,2026-05-10 13:02:13,english,67330,"I cant play the game anymore, the new update made it impossible for my launcher to even open the game without my antivirus program stopping it from going up. You know they got alot of bad spyware in the game when even windows security has to step in.",english,"I cant play the game anymore, the new update made it impossible for my launcher to even open the game without my antivirus program stopping it from going up. You know they got alot of bad spyware in the game when even windows security has to step in.",0.133,0.822,0.045,-0.577,negative,1,['destek_guncelleme'],destek_guncelleme,1,0,0,0,0,0,0,1,0,0
Stellaris,Strateji,"Viele Jahre war Stellaris mein bevorzugtes Strategie-Spiel. Leider hat es sich in eine Richtung entwickelt die nichts mehr für mich ist. 

Ich möchte die Galaxie erobern und dabei nicht von stark erhöhten Mali durch Reichsgröße eingeschränkt und zu Unmengen an Micromanagement gezwungen werden. Der Einfluß von Reichsgröße auf Aufstände ist außerdem extrem lästig und es gibt keine wirksamen Mittel im Spiel, um diese Niederzugschlagen oder aufzulösen - man muß also jedes Mal die betroffenen Systeme zurückerobern -  mitten in Krisen mehr als nur lästig. Das ganze Balanceing paßt einfach nicht mehr. Ich möchte nicht die meisten Gebiete durch Vasallen kontrollieren, sondern sie selber besetzen und halten. Das ist ab einer gewissen Größe quasi nicht mehr sinnvoll möglich. Außerdem sind die gefallenen Reiche, die gegeneinander Krieg führen, heute unverhältnismäßig stark - und sie schalten sich nicht mehr gegenseitig aus, so daß die Flottengrößengrenzen selbst bei optimal bis dahin verlaufenen Spiel nicht ausreichend Gegenwehr zulassen, nicht einmal mit großen Föderationsflotten. Alles in allem macht das Spiel im gegenwärtigen Zustand keinen Spaß mehr, da es früher einfach erheblich ausgewogener war. Die gewachsene Komplexität wurde in den falschen Bereichen geschaffen. Anstatt Wirtschaft, Planeten und Spionage umfangreicher zu machen, hätte ich mir gewünscht, die Komplexität im Bereich Flotten und Kriegsführung zu erhöhen und den Malus auf Reichsgröße abzuschaffen.",False,2026-05-26 20:12:00,german,184137,"Viele Jahre war Stellaris mein bevorzugtes Strategie-Spiel. Leider hat es sich in eine Richtung entwickelt die nichts mehr für mich ist. Ich möchte die Galaxie erobern und dabei nicht von stark erhöhten Mali durch Reichsgröße eingeschränkt und zu Unmengen an Micromanagement gezwungen werden. Der Einfluß von Reichsgröße auf Aufstände ist außerdem extrem lästig und es gibt keine wirksamen Mittel im Spiel, um diese Niederzugschlagen oder aufzulösen - man muß also jedes Mal die betroffenen Systeme zurückerobern - mitten in Krisen mehr als nur lästig. Das ganze Balanceing paßt einfach nicht mehr. Ich möchte nicht die meisten Gebiete durch Vasallen kontrollieren, sondern sie selber besetzen und halten. Das ist ab einer gewissen Größe quasi nicht mehr sinnvoll möglich. Außerdem sind die gefallenen Reiche, die gegeneinander Krieg führen, heute unverhältnismäßig stark - und sie schalten sich nicht mehr gegenseitig aus, so daß die Flottengrößengrenzen selbst bei optimal bis dahin verlaufenen Spiel nicht ausreichend Gegenwehr zulassen, nicht einmal mit großen Föderationsflotten. Alles in allem macht das Spiel im gegenwärtigen Zustand keinen Spaß mehr, da es früher einfach erheblich ausgewogener war. Die gewachsene Komplexität wurde in den falschen Bereichen geschaffen. Anstatt Wirtschaft, Planeten und Spionage umfangreicher zu machen, hätte ich mir gewünscht, die Komplexität im Bereich Flotten und Kriegsführung zu erhöhen und den Malus auf Reichsgröße abzuschaffen.",german,"For many years, Stellaris was my favorite strategy game. Unfortunately it has developed in a direction that is no longer for me. I want to conquer the galaxy and not be limited by greatly increased penalties due to empire size and forced to do tons of micromanagement. The influence of empire size on uprisings is also extremely annoying and there are no effective means in the game to crush or resolve them - so you have to retake the affected systems every time - more than just annoying in the middle of crises. The whole balancing thing just doesn't work anymore. I don't want to control most areas through vassals, but rather occupy and hold them myself. Once you reach a certain size, this is virtually no longer possible. In addition, the fallen empires that are waging war against each other are now disproportionately strong - and they no longer eliminate each other, so that the fleet size limits do not allow for sufficient resistance, even if the game has been going optimally up to that point, not even with large Federation fleets. All in all, the game is no longer fun in its current state, as it used to be much more balanced. The increased complexity was created in the wrong areas. Instead of making the economy, planets and espionage more extensive, I would have liked to have increased the complexity of fleets and warfare and removed the empire size penalty.",0.167,0.728,0.104,-0.9531,negative,1,"['teknik_sorun', 'oynanabilirlik']",teknik_sorun|oynanabilirlik,2,0,1,0,0,1,0,0,0,0
Stellaris,Strateji,"Perfect game, Ruined by Paradox with DLC's and horrible reworks",False,2026-05-10 06:20:27,english,7201,"Perfect game, Ruined by Paradox with DLC's and horrible reworks",english,"Perfect game, Ruined by Paradox with DLC's and horrible reworks",0.452,0.339,0.209,-0.5106,negative,1,['fiyat'],fiyat,1,0,0,1,0,0,0,0,0,0
Stellaris,Strateji,"What happens when a really neat grand strategy concept rots from feature creep and DLC creep.
Oh, and they're pumping AI slop into the mix, just for good measure.

Tragic.",False,2026-05-10 17:05:29,english,58831,"What happens when a really neat grand strategy concept rots from feature creep and DLC creep. Oh, and they're pumping AI slop into the mix, just for good measure. Tragic.",english,"What happens when a really neat grand strategy concept rots from feature creep and DLC creep. Oh, and they're pumping AI slop into the mix, just for good measure. Tragic.",0.078,0.676,0.246,0.7559,positive,0,['fiyat'],fiyat,1,0,0,1,0,0,0,0,0,0
Stellaris,Strateji,"This has been the first time i uninstalled the game since i've bought it. I don't know what Paradox is thinking, or if they are thinking at all, but at this point, every single time they touch their game, it just gets worse and worse and worse, and it has frankly become unbearable.
The constant nerfs, the constant rehauling of things that work into things that barely work... it is too much.

Paradox. Just stop. Make a Stellaris 2. Leave Stellaris 1 alone. 
When people bought this game, they weren't signing up for a live service game with yearly rehauls of all of it's systems.",False,2026-05-09 23:29:55,english,47283,"This has been the first time i uninstalled the game since i've bought it. I don't know what Paradox is thinking, or if they are thinking at all, but at this point, every single time they touch their game, it just gets worse and worse and worse, and it has frankly become unbearable. The constant nerfs, the constant rehauling of things that work into things that barely work... it is too much. Paradox. Just stop. Make a Stellaris 2. Leave Stellaris 1 alone. When people bought this game, they weren't signing up for a live service game with yearly rehauls of all of it's systems.",english,"This has been the first time i uninstalled the game since i've bought it. I don't know what Paradox is thinking, or if they are thinking at all, but at this point, every single time they touch their game, it just gets worse and worse and worse, and it has frankly become unbearable. The constant nerfs, the constant rehauling of things that work into things that barely work... it is too much. Paradox. Just stop. Make a Stellaris 2. Leave Stellaris 1 alone. When people bought this game, they weren't signing up for a live service game with yearly rehauls of all of it's systems.",0.174,0.817,0.01,-0.9612,negative,1,['diger'],diger,1,0,0,0,0,0,0,0,0,1
Stellaris,Strateji,"До Stellaris играл в основном в пошаговые стратегии, и нужно сказать что с первого раза она мне не понравилась, это было когда модно было на начальном этапе выбирать способ перемещения сквозь пространство, через пару лет я вернулся с намерением освоиться в стратегии ртс, к моему удивлению в течении нескольких месяцев она стала игрой с самым большим количеством часов наигранности, да есть баги при выкате новых обновлений, но их правят, да есть недочеты и минусы, но сам факт жизни и развития проекта, а ещё идей вложенных в него может только радовать и вдохновлять. Спасибо Paradox за за одну из лучших стратегий",True,2026-05-21 10:16:16,russian,80433,"До Stellaris играл в основном в пошаговые стратегии, и нужно сказать что с первого раза она мне не понравилась, это было когда модно было на начальном этапе выбирать способ перемещения сквозь пространство, через пару лет я вернулся с намерением освоиться в стратегии ртс, к моему удивлению в течении нескольких месяцев она стала игрой с самым большим количеством часов наигранности, да есть баги при выкате новых обновлений, но их правят, да есть недочеты и минусы, но сам факт жизни и развития проекта, а ещё идей вложенных в него может только радовать и вдохновлять. Спасибо Paradox за за одну из лучших стратегий",russian,"Before Stellaris, I played mostly turn-based strategies, and I must say that I didn’t like it the first time, it was when it was fashionable at the initial stage to choose a way to move through space, after a couple of years I returned with the intention of getting comfortable with the RTS strategy, to my surprise, within a few months it became the game with the most hours of play, yes there are bugs when rolling out new updates, but they are correct, yes there are shortcomings and disadvantages, but the very fact of life and development of the project, and also ideas those invested in it can only delight and inspire. Thanks to Paradox for one of the best strategies",0.035,0.734,0.232,0.9823,positive,1,"['teknik_sorun', 'destek_guncelleme']",teknik_sorun|destek_guncelleme,2,0,1,0,0,0,0,1,0,0
