game_name,game_genre,review,voted_up,timestamp_created,language,playtime_forever,review_clean,detected_language,review_english,vader_neg,vader_neu,vader_pos,vader_compound,sentiment,vader_voted_match,categories,categories_str,category_count,cat_performans,cat_teknik_sorun,cat_fiyat,cat_hikaye_icerik,cat_oynanabilirlik,cat_cok_oyunculu,cat_destek_guncelleme,cat_gorsel_ses,cat_diger
Stellaris,Strateji,"Used to like this game - even modded it - but nowadays, it's genuinely unenjoyable.

Pretty much all the interesting features are locked behind DLC, some of which is genuinely terrible, such as Cosmic Storms, and playing the game increasingly feels like a chore. The setting (or attempt to establish one) is uninteresting, and suffers from a lack of consistency and it not meshing very well with the type of game Stellaris is (For instance, why are there apparently three separate species, namely the pre-FTL Pyorun, the Olinbar of MSI, and the.. Yatunans.. that all share the same portrait, and have zero relation to one another?).

Generally, inconsistency is something very prominent with Stellaris in general Even the portraits aren't consistent in art style - it feels very jarring to see newer portraits next to old ones thanks to the art style somehow changing so much that the perspective went from a bust to showing 3/4ths of the body, meaning that the room backgrounds used in diplomacy do not feel consistently sized at all. Many of the game's portraits also fail to be visually interesting - one particular Humanoid portrait even lacks the variety that was shown in advertising.

Even Paradox itself has better offerings when it comes to strategy games. Stellaris just isn't very good anymore, and given the amount of DLC, I doubt it'll improve.",False,2026-05-10 18:46:02,english,192638,"Used to like this game - even modded it - but nowadays, it's genuinely unenjoyable. Pretty much all the interesting features are locked behind DLC, some of which is genuinely terrible, such as Cosmic Storms, and playing the game increasingly feels like a chore. The setting (or attempt to establish one) is uninteresting, and suffers from a lack of consistency and it not meshing very well with the type of game Stellaris is (For instance, why are there apparently three separate species, namely the pre-FTL Pyorun, the Olinbar of MSI, and the.. Yatunans.. that all share the same portrait, and have zero relation to one another?). Generally, inconsistency is something very prominent with Stellaris in general Even the portraits aren't consistent in art style - it feels very jarring to see newer portraits next to old ones thanks to the art style somehow changing so much that the perspective went from a bust to showing 3 4ths of the body, meaning that the room backgrounds used in diplomacy do not feel consistently sized at all. Many of the game's portraits also fail to be visually interesting - one particular Humanoid portrait even lacks the variety that was shown in advertising. Even Paradox itself has better offerings when it comes to strategy games. Stellaris just isn't very good anymore, and given the amount of DLC, I doubt it'll improve.",english,"Used to like this game - even modded it - but nowadays, it's genuinely unenjoyable. Pretty much all the interesting features are locked behind DLC, some of which is genuinely terrible, such as Cosmic Storms, and playing the game increasingly feels like a chore. The setting (or attempt to establish one) is uninteresting, and suffers from a lack of consistency and it not meshing very well with the type of game Stellaris is (For instance, why are there apparently three separate species, namely the pre-FTL Pyorun, the Olinbar of MSI, and the.. Yatunans.. that all share the same portrait, and have zero relation to one another?). Generally, inconsistency is something very prominent with Stellaris in general Even the portraits aren't consistent in art style - it feels very jarring to see newer portraits next to old ones thanks to the art style somehow changing so much that the perspective went from a bust to showing 3 4ths of the body, meaning that the room backgrounds used in diplomacy do not feel consistently sized at all. Many of the game's portraits also fail to be visually interesting - one particular Humanoid portrait even lacks the variety that was shown in advertising. Even Paradox itself has better offerings when it comes to strategy games. Stellaris just isn't very good anymore, and given the amount of DLC, I doubt it'll improve.",0.099,0.768,0.134,0.8594,positive,0,"['fiyat', 'gorsel_ses']",fiyat|gorsel_ses,2,0,0,1,0,0,0,0,1,0
Stellaris,Strateji,"It's a great game but constantly asking $25-50 for new DLC, while also announcing the new DLC will be made with generative Ai, means they don't care about the product and just want to grab our money. Also the information it collects and shares without user knowledge, is invasive.",False,2026-05-13 16:43:39,english,2475,"It's a great game but constantly asking 25-50 for new DLC, while also announcing the new DLC will be made with generative Ai, means they don't care about the product and just want to grab our money. Also the information it collects and shares without user knowledge, is invasive.",english,"It's a great game but constantly asking 25-50 for new DLC, while also announcing the new DLC will be made with generative Ai, means they don't care about the product and just want to grab our money. Also the information it collects and shares without user knowledge, is invasive.",0.062,0.815,0.123,0.3309,positive,0,['fiyat'],fiyat,1,0,0,1,0,0,0,0,0,0
Stellaris,Strateji,"They have irreversibly ruined the game and have zero concerns about it. Even worse performance, buggier, questionable gameplay & mechanical decisions, and subpar overpriced DLC they would rather spend time on than fixing & optimizing their broken game. This is all completely fine by Paradox's standards now. I am certainly not the first to say it and I won't be the last: the 4.0 update is one of the worst things Paradox has EVER done and they will never be able to patch the amount of holes they created at the rate they are currently going.",False,2026-05-27 05:03:30,english,25765,"They have irreversibly ruined the game and have zero concerns about it. Even worse performance, buggier, questionable gameplay mechanical decisions, and subpar overpriced DLC they would rather spend time on than fixing optimizing their broken game. This is all completely fine by Paradox's standards now. I am certainly not the first to say it and I won't be the last the 4.0 update is one of the worst things Paradox has EVER done and they will never be able to patch the amount of holes they created at the rate they are currently going.",english,"They have irreversibly ruined the game and have zero concerns about it. Even worse performance, buggier, questionable gameplay mechanical decisions, and subpar overpriced DLC they would rather spend time on than fixing optimizing their broken game. This is all completely fine by Paradox's standards now. I am certainly not the first to say it and I won't be the last the 4.0 update is one of the worst things Paradox has EVER done and they will never be able to patch the amount of holes they created at the rate they are currently going.",0.154,0.76,0.086,-0.818,negative,1,"['performans', 'teknik_sorun', 'fiyat', 'oynanabilirlik', 'destek_guncelleme']",performans|teknik_sorun|fiyat|oynanabilirlik|destek_guncelleme,5,1,1,1,0,1,0,1,0,0
Stellaris,Strateji,"Classic Paradox DLC-slopmachine, with that classic Paradox lack of quality.

I remain amazed at this company's ability to turn their games into over an overgrown, under-optimized, buggy mess.",False,2026-05-19 19:03:37,english,36869,"Classic Paradox DLC-slopmachine, with that classic Paradox lack of quality. I remain amazed at this company's ability to turn their games into over an overgrown, under-optimized, buggy mess.",english,"Classic Paradox DLC-slopmachine, with that classic Paradox lack of quality. I remain amazed at this company's ability to turn their games into over an overgrown, under-optimized, buggy mess.",0.217,0.627,0.157,-0.0258,neutral,1,['fiyat'],fiyat,1,0,0,1,0,0,0,0,0,0
Stellaris,Strateji,"I understand the game is already more than 10 years old, but the UI is just way too confusing, not saying it's outdated, just chaos. Also the steep learning curve.",False,2026-05-22 21:56:06,english,22,"I understand the game is already more than 10 years old, but the UI is just way too confusing, not saying it's outdated, just chaos. Also the steep learning curve.",english,"I understand the game is already more than 10 years old, but the UI is just way too confusing, not saying it's outdated, just chaos. Also the steep learning curve.",0.209,0.791,0.0,-0.8126,negative,1,['diger'],diger,1,0,0,0,0,0,0,0,0,1
Stellaris,Strateji,别的游戏是版本越高，越更新，支持的玩法越多，这游戏版本越高，越更新，越是砍你的各种玩法的数值，导致能玩的玩法越少，游戏越来越没意思。劝大家别买，别玩，别碰。,False,2026-05-13 06:48:37,schinese,15808,别的游戏是版本越高 越更新 支持的玩法越多 这游戏版本越高 越更新 越是砍你的各种玩法的数值 导致能玩的玩法越少 游戏越来越没意思 劝大家别买 别玩 别碰,schinese,"For other games, the higher the version, the more updated it is, and the more gameplays it supports. The higher the version of this game, the more updated it is, and the more your values ​​for various gameplays will be reduced. As a result, there will be fewer gameplays to play, and the game will become more and more boring. I advise everyone not to buy it, don’t play it, and don’t touch it.",0.035,0.837,0.128,0.7708,positive,0,['diger'],diger,1,0,0,0,0,0,0,0,0,1
Stellaris,Strateji,"Stellaris was such a great game. Now it's just a half finished mess with 200€ dlc and season pass. If you won this game, you can roll back to the older versions. But I can't recommend buying this game, not anymore, which is a shame.",False,2026-05-09 04:46:55,english,45350,"Stellaris was such a great game. Now it's just a half finished mess with 200 dlc and season pass. If you won this game, you can roll back to the older versions. But I can't recommend buying this game, not anymore, which is a shame.",english,"Stellaris was such a great game. Now it's just a half finished mess with 200 dlc and season pass. If you won this game, you can roll back to the older versions. But I can't recommend buying this game, not anymore, which is a shame.",0.16,0.748,0.092,-0.5669,negative,1,['fiyat'],fiyat,1,0,0,1,0,0,0,0,0,0
Stellaris,Strateji,玩到中期开始掉帧卡的一b，这配置都带不了,False,2026-05-11 22:01:37,schinese,882,玩到中期开始掉帧卡的一b 这配置都带不了,schinese,"In the middle of the game, the framerate started to drop. I can’t even use this configuration.",0.116,0.884,0.0,-0.2732,negative,1,['performans'],performans,1,1,0,0,0,0,0,0,0,0
Stellaris,Strateji,"Lowkey this game has its problems, but I was able to mostly ignore them because I mostly just played small variations on the same tall trade and tech build every few months on singleplayer just to occupy myself and get comfortable with a video essay. However, with all the dlc stuff, and how updates keep upending how I like to play, I am honestly finding it hard to care enough to dip back into this game. Plus I frankly cant bring myself to recommend my friends put the same money and time into this game because I care about them too much asdjsdjd",False,2026-06-05 02:55:43,english,35452,"Lowkey this game has its problems, but I was able to mostly ignore them because I mostly just played small variations on the same tall trade and tech build every few months on singleplayer just to occupy myself and get comfortable with a video essay. However, with all the dlc stuff, and how updates keep upending how I like to play, I am honestly finding it hard to care enough to dip back into this game. Plus I frankly cant bring myself to recommend my friends put the same money and time into this game because I care about them too much asdjsdjd",english,"Lowkey this game has its problems, but I was able to mostly ignore them because I mostly just played small variations on the same tall trade and tech build every few months on singleplayer just to occupy myself and get comfortable with a video essay. However, with all the dlc stuff, and how updates keep upending how I like to play, I am honestly finding it hard to care enough to dip back into this game. Plus I frankly cant bring myself to recommend my friends put the same money and time into this game because I care about them too much asdjsdjd",0.051,0.691,0.258,0.9837,positive,0,"['fiyat', 'destek_guncelleme']",fiyat|destek_guncelleme,2,0,0,1,0,0,0,1,0,0
Stellaris,Strateji,"Got a bug in one of the games, was banned while trying to create an account to report it on official forum.
Reporting bugs in this game is really burdensome.",False,2026-06-03 13:27:19,english,33265,"Got a bug in one of the games, was banned while trying to create an account to report it on official forum. Reporting bugs in this game is really burdensome.",english,"Got a bug in one of the games, was banned while trying to create an account to report it on official forum. Reporting bugs in this game is really burdensome.",0.173,0.767,0.06,-0.6115,negative,1,['teknik_sorun'],teknik_sorun,1,0,1,0,0,0,0,0,0,0
Stellaris,Strateji,While I have few hours on Steam I have been playing this game since 2020 on console and likely have hundreds if not thousands of hours there. This has got to be my favorite game of all time. Something about creating your own overarching sci fi story that lasts generations is something that most games do not have. Sadly I cannot recommed it due to the amount of predatory dlc and the new update. There was no reason for them to completely overhaul the games mechanics and the way economy works I was very happy with the gameplay loop they had and this new planetary system is just not good. The dlc while adding good content should have been mostly free updates. Please find something cheaper to spend you time on.,False,2026-05-20 02:48:19,english,239,While I have few hours on Steam I have been playing this game since 2020 on console and likely have hundreds if not thousands of hours there. This has got to be my favorite game of all time. Something about creating your own overarching sci fi story that lasts generations is something that most games do not have. Sadly I cannot recommed it due to the amount of predatory dlc and the new update. There was no reason for them to completely overhaul the games mechanics and the way economy works I was very happy with the gameplay loop they had and this new planetary system is just not good. The dlc while adding good content should have been mostly free updates. Please find something cheaper to spend you time on.,english,While I have few hours on Steam I have been playing this game since 2020 on console and likely have hundreds if not thousands of hours there. This has got to be my favorite game of all time. Something about creating your own overarching sci fi story that lasts generations is something that most games do not have. Sadly I cannot recommed it due to the amount of predatory dlc and the new update. There was no reason for them to completely overhaul the games mechanics and the way economy works I was very happy with the gameplay loop they had and this new planetary system is just not good. The dlc while adding good content should have been mostly free updates. Please find something cheaper to spend you time on.,0.031,0.821,0.148,0.9453,positive,0,"['fiyat', 'hikaye_icerik', 'oynanabilirlik', 'destek_guncelleme']",fiyat|hikaye_icerik|oynanabilirlik|destek_guncelleme,4,0,0,1,1,1,0,1,0,0
Stellaris,Strateji,"Давным-давно была отличной игрой. Сейчас не рекомендую, никакого удовольствия она доставить больше не может: 
1. новые механики только раздражают и в большинстве случаев просто отключаются в настройках перед игрой;
2. оптимизация, несмотря на обещания ее улучшить, становится только хуже;  
3. на цены на длц плевать. Я готов платить втридорога, но платить за действительно стоящие вещи, интересные, добавляющие новые механики и разнообразия в геймплей. А за скинцы на кораблики и портретики, сгенерированные нейронкой (даже если и не сгенерено, то это уже многое говорит о качестве), даже копейки жалко.
Некогда любимейшая игра, в которую я играл с момента релиза, скатилась на дно как и компания paradox. Желаю загнуться обеим навсегда. Уж лучше так, с надеждой на то, что появится кто-то новый и предложит достойный и интересный проект, чем бесконечная дойка мертвого.",False,2026-06-01 01:22:46,russian,119066,"Давным-давно была отличной игрой. Сейчас не рекомендую, никакого удовольствия она доставить больше не может 1. новые механики только раздражают и в большинстве случаев просто отключаются в настройках перед игрой 2. оптимизация, несмотря на обещания ее улучшить, становится только хуже 3. на цены на длц плевать. Я готов платить втридорога, но платить за действительно стоящие вещи, интересные, добавляющие новые механики и разнообразия в геймплей. А за скинцы на кораблики и портретики, сгенерированные нейронкой (даже если и не сгенерено, то это уже многое говорит о качестве), даже копейки жалко. Некогда любимейшая игра, в которую я играл с момента релиза, скатилась на дно как и компания paradox. Желаю загнуться обеим навсегда. Уж лучше так, с надеждой на то, что появится кто-то новый и предложит достойный и интересный проект, чем бесконечная дойка мертвого.",russian,"Was a great game a long time ago. Now I don’t recommend it, it can no longer bring any pleasure 1. new mechanics are only annoying and in most cases are simply turned off in the settings before the game 2. optimization, despite promises to improve it, is only getting worse 3. I don’t care about the prices for DLC. I'm ready to pay exorbitant prices, but to pay for things that are truly worthwhile, interesting, and add new mechanics and variety to the gameplay. And for skins for boats and portraits generated by a neuron (even if they are not generated, this already says a lot about the quality), I don’t even feel sorry for a penny. The once favorite game that I have played since release has sunk to the bottom, just like the paradox company. I wish both of them to die forever. It’s better this way, with the hope that someone new will appear and offer a worthy and interesting project, than endless milking of the dead.",0.118,0.648,0.235,0.9815,positive,0,"['performans', 'fiyat', 'oynanabilirlik']",performans|fiyat|oynanabilirlik,3,1,0,1,0,1,0,0,0,0
Stellaris,Strateji,Einfach ein geniales und rundes 4x Aufbauspiel. Ich spiele es immer wieder gerne =),True,2026-05-29 12:19:30,german,38750,Einfach ein geniales und rundes 4x Aufbauspiel. Ich spiele es immer wieder gerne ),german,Simply an ingenious and well-rounded 4x building game. I enjoy playing it again and again),0.0,0.722,0.278,0.6124,positive,1,['diger'],diger,1,0,0,0,0,0,0,0,0,1
Stellaris,Strateji,"没有一产区划，怎么种庄稼？
还有你舰容占用都*5了武器数值就不能*5一下？都不用后期天灾了，大可汗就能踹完银河了",False,2026-05-17 09:11:25,schinese,30906,没有一产区划 怎么种庄稼 还有你舰容占用都 5了武器数值就不能 5一下 都不用后期天灾了 大可汗就能踹完银河了,schinese,"There is no one-producing division, how can you grow crops, and your ship capacity is occupied? If the weapon value is 5, it can't be 5, and there is no need for late-stage natural disasters. The Great Khan can kick the entire galaxy.",0.185,0.652,0.163,-0.0516,negative,1,['diger'],diger,1,0,0,0,0,0,0,0,0,1
Stellaris,Strateji,"They recently pushed though a UI change that makes some elements off screen and unusable on steam deck.
And i cant just use the ui scaling bar, as the accept button is of screen",False,2026-05-09 05:05:46,english,6779,"They recently pushed though a UI change that makes some elements off screen and unusable on steam deck. And i cant just use the ui scaling bar, as the accept button is of screen",english,"They recently pushed though a UI change that makes some elements off screen and unusable on steam deck. And i cant just use the ui scaling bar, as the accept button is of screen",0.0,0.927,0.073,0.3818,positive,0,['diger'],diger,1,0,0,0,0,0,0,0,0,1
Stellaris,Strateji,"It takes a few play throughs and some wiki reading to get decent at.  Once you've got the basics down, the hours fly by.  Each expansion pack adds new twists and more play throughs.  I'm almost 200 hours in and still not tired of the game.",True,2026-05-09 22:34:25,english,15174,"It takes a few play throughs and some wiki reading to get decent at. Once you've got the basics down, the hours fly by. Each expansion pack adds new twists and more play throughs. I'm almost 200 hours in and still not tired of the game.",english,"It takes a few play throughs and some wiki reading to get decent at. Once you've got the basics down, the hours fly by. Each expansion pack adds new twists and more play throughs. I'm almost 200 hours in and still not tired of the game.",0.0,0.852,0.148,0.7579,positive,1,['diger'],diger,1,0,0,0,0,0,0,0,0,1
Stellaris,Strateji,"I have lost myself in this game so many times, it is so much fun to make a new civilization and guide them as they explore and establish who they are in the galaxy. If you like civilization or colony builder games you will adore this one.",True,2026-05-09 22:11:51,english,21706,"I have lost myself in this game so many times, it is so much fun to make a new civilization and guide them as they explore and establish who they are in the galaxy. If you like civilization or colony builder games you will adore this one.",english,"I have lost myself in this game so many times, it is so much fun to make a new civilization and guide them as they explore and establish who they are in the galaxy. If you like civilization or colony builder games you will adore this one.",0.042,0.782,0.176,0.8115,positive,1,['oynanabilirlik'],oynanabilirlik,1,0,0,0,0,1,0,0,0,0
