game_name,game_genre,review,voted_up,timestamp_created,language,playtime_forever,review_clean,detected_language,review_english,vader_neg,vader_neu,vader_pos,vader_compound,sentiment,vader_voted_match
XCOM 2,Strateji,I just had to leave a quick review.  Bought it and expansions for around $10.  It is so good.  And you can play it with options maxed out now with decent computer that's no more than a few years old.  Title is 10 years old its hard to believe.  This should be overwhelmingly positive so giving my thumbs up here.,True,2026-05-23 23:15:54,english,5848,I just had to leave a quick review. Bought it and expansions for around 10. It is so good. And you can play it with options maxed out now with decent computer that's no more than a few years old. Title is 10 years old its hard to believe. This should be overwhelmingly positive so giving my thumbs up here.,english,I just had to leave a quick review. Bought it and expansions for around 10. It is so good. And you can play it with options maxed out now with decent computer that's no more than a few years old. Title is 10 years old its hard to believe. This should be overwhelmingly positive so giving my thumbs up here.,0.089,0.735,0.176,0.8456,positive,1
XCOM 2,Strateji,40小时普通难度通关真的是折磨又刺激，难玩又好玩。,True,2026-05-23 08:46:56,schinese,3597,40小时普通难度通关真的是折磨又刺激 难玩又好玩,schinese,"Clearing the level on normal difficulty in 40 hours is really torture and excitement, difficult and fun at the same time",0.285,0.502,0.212,-0.3246,negative,0
XCOM 2,Strateji,"Overall: 7/10

This review is for the base game which I played 1st, before doing a run of War of the Chosen. This was a very good game overall and a different experience than most games I play :) I played XCOM 1 a few years ago and honestly didn't remember it being amazing or super fun, which is why I avoided playing XCOM 2 that I bought together with XCOM 1 for a few years. But XCOM 2 surprised me with how much fun I had with it :) I was going to give the game an 8/10 for the 1st half of the game, but the gameplay became a bit repetitive for the 2nd half and the enemy variety stagnated especially in the last 1/4 of the game. But still the game was pretty consistently fun and hilarious at times with the missed shots and domination of enemies with psi soldiers :P

I save-scummed because I had more fun with the game like that, rather than beating my head against the wall reloading a mission from the start if a soldier died. I only reloaded if a soldier was going to die or be wounded when almost all my other soldiers were wounded already. I didn't need to do so that many times but it definitely helped me enjoy the game more than if I didn't. I don't care what others think haha :D

The atmosphere and music were good, but I think I agree with others that the atmosphere/enemy design in the 1st game was better and more horror/creepy. But the gameplay was more varied & solid in the 2nd game, which is what I care about more, so I enjoyed the 2nd game overall more.

The story was compelling enough to keep me interested and I appreciate the variety of stories in the base game to keep the game fresh. I liked the Dr. Vahlen and Shen's father stories, as well as the little dialogue while on the ship from Central, Dr. Tygan, and Shen. The game did a good enough job to make me care and feel like this was a real conflict, so cudos to the writers. The story could be more fleshed out and stronger, with maybe more journal entries or dialogue giving background to the conflict. But it was enough for me to hear these interactions and read the research notes giving backstory :)

There was unfortunately a lack of polish in some aspects of the game, like the voiceover for Central during a few mission briefings not matching the subtitles and a few other dialogue like that throughout the game from Dr. Tygan and Shen. Also the ""Make Items Available"" buttons when editing your soldier loadouts never worked for me and just randomly seemed to remove 1 or 2 items from some soldiers. I had to go through all my ""Available"" or wounded soldiers to manually remove their items to equip to my squad, which became pretty annoying near the end especially when my squad was fairly customized with their items.

I also tried playing through the game again through the ""expansion"" War of the Chosen, which altered a lot of the game's mechanics more than added new content on top of the base game. I played through I think the first 5-6 missions, to the point when I had the first Retaliation mission with the first Chosen. I found myself not that interested to play through the game a 2nd time and found the War of the Chosen additions to be a little too much for me to care to manage. The story of the Chosen seemed more like a Saturday morning cartoon set of villains, who weren't established enough for me to have an interesting backstory for me to care to play the game again to discover it seems like their story/gameplay interactions as well as the 3 Factions' stories. The Factions were a little more interesting but not enough for me, with the most interesting being the ADVENT deserters. But yeah, overall I enjoyed the game but I think starting a new playthrough made me realize this was a 7/10 and not an 8/10 game, as I wasn't eager or open to replay the game which I find myself feeling with a number of 8/10 games I rate. Especially since this isn't the longest game, like 30-50 hours for me, it wouldn't be crazy to replay it compared to a Final Fantasy or long RPG, so I think sitting with my feelings about the game helped me realize I didn't enjoy it as much as I initially thought.

Overall a very good game but not as amazing as a lot of people say, at least for me. I think I don't love TRPG's enough to seek out more, but I would open to playing more that fit a setting or story that I am interested in, such as XCOM.",True,2026-05-23 04:18:47,english,5048,"Overall 7 10 This review is for the base game which I played 1st, before doing a run of War of the Chosen. This was a very good game overall and a different experience than most games I play ) I played XCOM 1 a few years ago and honestly didn't remember it being amazing or super fun, which is why I avoided playing XCOM 2 that I bought together with XCOM 1 for a few years. But XCOM 2 surprised me with how much fun I had with it ) I was going to give the game an 8 10 for the 1st half of the game, but the gameplay became a bit repetitive for the 2nd half and the enemy variety stagnated especially in the last 1 4 of the game. But still the game was pretty consistently fun and hilarious at times with the missed shots and domination of enemies with psi soldiers P I save-scummed because I had more fun with the game like that, rather than beating my head against the wall reloading a mission from the start if a soldier died. I only reloaded if a soldier was going to die or be wounded when almost all my other soldiers were wounded already. I didn't need to do so that many times but it definitely helped me enjoy the game more than if I didn't. I don't care what others think haha D The atmosphere and music were good, but I think I agree with others that the atmosphere enemy design in the 1st game was better and more horror creepy. But the gameplay was more varied solid in the 2nd game, which is what I care about more, so I enjoyed the 2nd game overall more. The story was compelling enough to keep me interested and I appreciate the variety of stories in the base game to keep the game fresh. I liked the Dr. Vahlen and Shen's father stories, as well as the little dialogue while on the ship from Central, Dr. Tygan, and Shen. The game did a good enough job to make me care and feel like this was a real conflict, so cudos to the writers. The story could be more fleshed out and stronger, with maybe more journal entries or dialogue giving background to the conflict. But it was enough for me to hear these interactions and read the research notes giving backstory ) There was unfortunately a lack of polish in some aspects of the game, like the voiceover for Central during a few mission briefings not matching the subtitles and a few other dialogue like that throughout the game from Dr. Tygan and Shen. Also the ""Make Items Available"" buttons when editing your soldier loadouts never worked for me and just randomly seemed to remove 1 or 2 items from some soldiers. I had to go through all my ""Available"" or wounded soldiers to manually remove their items to equip to my squad, which became pretty annoying near the end especially when my squad was fairly customized with their items. I also tried playing through the game again through the ""expansion"" War of the Chosen, which altered a lot of the game's mechanics more than added new content on top of the base game. I played through I think the first 5-6 missions, to the point when I had the first Retaliation mission with the first Chosen. I found myself not that interested to play through the game a 2nd time and found the War of the Chosen additions to be a little too much for me to care to manage. The story of the Chosen seemed more like a Saturday morning cartoon set of villains, who weren't established enough for me to have an interesting backstory for me to care to play the game again to discover it seems like their story gameplay interactions as well as the 3 Factions' stories. The Factions were a little more interesting but not enough for me, with the most interesting being the ADVENT deserters. But yeah, overall I enjoyed the game but I think starting a new playthrough made me realize this was a 7 10 and not an 8 10 game, as I wasn't eager or open to replay the game which I find myself feeling with a number of 8 10 games I rate. Especially since this isn't the longest game, like 30-50 hours for me, it wouldn't be crazy to replay it compared to a Final Fantasy or long RPG, so I think sitting with my feelings about the game helped me realize I didn't enjoy it as much as I initially thought. Overall a very good game but not as amazing as a lot of people say, at least for me. I think I don't love TRPG's enough to seek out more, but I would open to playing more that fit a setting or story that I am interested in, such as XCOM.",english,"Overall 7 10 This review is for the base game which I played 1st, before doing a run of War of the Chosen. This was a very good game overall and a different experience than most games I play ) I played XCOM 1 a few years ago and honestly didn't remember it being amazing or super fun, which is why I avoided playing XCOM 2 that I bought together with XCOM 1 for a few years. But XCOM 2 surprised me with how much fun I had with it ) I was going to give the game an 8 10 for the 1st half of the game, but the gameplay became a bit repetitive for the 2nd half and the enemy variety stagnated especially in the last 1 4 of the game. But still the game was pretty consistently fun and hilarious at times with the missed shots and domination of enemies with psi soldiers P I save-scummed because I had more fun with the game like that, rather than beating my head against the wall reloading a mission from the start if a soldier died. I only reloaded if a soldier was going to die or be wounded when almost all my other soldiers were wounded already. I didn't need to do so that many times but it definitely helped me enjoy the game more than if I didn't. I don't care what others think haha D The atmosphere and music were good, but I think I agree with others that the atmosphere enemy design in the 1st game was better and more horror creepy. But the gameplay was more varied solid in the 2nd game, which is what I care about more, so I enjoyed the 2nd game overall more. The story was compelling enough to keep me interested and I appreciate the variety of stories in the base game to keep the game fresh. I liked the Dr. Vahlen and Shen's father stories, as well as the little dialogue while on the ship from Central, Dr. Tygan, and Shen. The game did a good enough job to make me care and feel like this was a real conflict, so cudos to the writers. The story could be more fleshed out and stronger, with maybe more journal entries or dialogue giving background to the conflict. But it was enough for me to hear these interactions and read the research notes giving backstory ) There was unfortunately a lack of polish in some aspects of the game, like the voiceover for Central during a few mission briefings not matching the subtitles and a few other dialogue like that throughout the game from Dr. Tygan and Shen. Also the ""Make Items Available"" buttons when editing your soldier loadouts never worked for me and just randomly seemed to remove 1 or 2 items from some soldiers. I had to go through all my ""Available"" or wounded soldiers to manually remove their items to equip to my squad, which became pretty annoying near the end especially when my squad was fairly customized with their items. I also tried playing through the game again through the ""expansion"" War of the Chosen, which altered a lot of the game's mechanics more than added new content on top of the base game. I played through I think the first 5-6 missions, to the point when I had the first Retaliation mission with the first Chosen. I found myself not that interested to play through the game a 2nd time and found the War of the Chosen additions to be a little too much for me to care to manage. The story of the Chosen seemed more like a Saturday morning cartoon set of villains, who weren't established enough for me to have an interesting backstory for me to care to play the game again to discover it seems like their story gameplay interactions as well as the 3 Factions' stories. The Factions were a little more interesting but not enough for me, with the most interesting being the ADVENT deserters. But yeah, overall I enjoyed the game but I think starting a new playthrough made me realize this was a 7 10 and not an 8 10 game, as I wasn't eager or open to replay the game which I find myself feeling with a number of 8 10 games I rate. Especially since this isn't the longest game, like 30-50 hours for me, it wouldn't be crazy to replay it compared to a Final Fantasy or long RPG, so I think sitting with my feelings about the game helped me realize I didn't enjoy it as much as I initially thought. Overall a very good game but not as amazing as a lot of people say, at least for me. I think I don't love TRPG's enough to seek out more, but I would open to playing more that fit a setting or story that I am interested in, such as XCOM.",0.091,0.712,0.197,0.9985,positive,1
XCOM 2,Strateji,"awesome strategy game. it is wonderfully crafted and I would highly recommend to anyone who loves a good strategy game, I honestly think that it is best played with the Tactical legacy DLC and with out a doubt War of the Chosen. adds TONS of cool content and is essential to anyone who would like to play with mods on considering how almost every addon requires it.",True,2026-05-23 03:24:01,english,2253,"awesome strategy game. it is wonderfully crafted and I would highly recommend to anyone who loves a good strategy game, I honestly think that it is best played with the Tactical legacy DLC and with out a doubt War of the Chosen. adds TONS of cool content and is essential to anyone who would like to play with mods on considering how almost every addon requires it.",english,"awesome strategy game. it is wonderfully crafted and I would highly recommend to anyone who loves a good strategy game, I honestly think that it is best played with the Tactical legacy DLC and with out a doubt War of the Chosen. adds TONS of cool content and is essential to anyone who would like to play with mods on considering how almost every addon requires it.",0.068,0.571,0.361,0.9794,positive,1
XCOM 2,Strateji,"Still holds up a decade after release. 

I see alot of reviews complaining about bugs, I didnt encounter anything too bad (minor temporary visual bugs here and there).

The complaints about gameplay are from people who dont understand percentages. I only play on ironman mode. If missing a few shots that had a 85% chance of hitting ends your run, you are doing it wrong.",True,2026-05-23 01:12:46,english,3428,"Still holds up a decade after release. I see alot of reviews complaining about bugs, I didnt encounter anything too bad (minor temporary visual bugs here and there). The complaints about gameplay are from people who dont understand percentages. I only play on ironman mode. If missing a few shots that had a 85 chance of hitting ends your run, you are doing it wrong.",english,"Still holds up a decade after release. I see alot of reviews complaining about bugs, I didnt encounter anything too bad (minor temporary visual bugs here and there). The complaints about gameplay are from people who dont understand percentages. I only play on ironman mode. If missing a few shots that had a 85 chance of hitting ends your run, you are doing it wrong.",0.176,0.766,0.058,-0.836,negative,0
XCOM 2,Strateji,"I wish they continue making more of these. Hands down one of my favourite games here. 
The Chosen storyline is engaging and super worth it. 
10/10",True,2026-05-22 17:37:15,english,5401,I wish they continue making more of these. Hands down one of my favourite games here. The Chosen storyline is engaging and super worth it. 10 10,english,I wish they continue making more of these. Hands down one of my favourite games here. The Chosen storyline is engaging and super worth it. 10 10,0.0,0.678,0.322,0.872,positive,1
XCOM 2,Strateji,"This is a great game, with a lot of cool mods.  The DLCs aren't bad either.  If you like turn-based strategy, I'd suggest giving this a shot.",True,2026-05-22 14:05:18,english,8958,"This is a great game, with a lot of cool mods. The DLCs aren't bad either. If you like turn-based strategy, I'd suggest giving this a shot.",english,"This is a great game, with a lot of cool mods. The DLCs aren't bad either. If you like turn-based strategy, I'd suggest giving this a shot.",0.0,0.609,0.391,0.9209,positive,1
XCOM 2,Strateji,"A pesar de los años sigue siendo un juegazo, gran historia, magníficas mecánicas, muchísimas horas de diversión.",True,2026-05-21 22:36:03,spanish,1723,"A pesar de los años sigue siendo un juegazo, gran historia, magníficas mecánicas, muchísimas horas de diversión.",spanish,"Despite the years, it is still a great game, great story, magnificent mechanics, many hours of fun.",0.0,0.458,0.542,0.9468,positive,1
XCOM 2,Strateji,电子真冰，值得拥有。推荐所有喜欢策略游戏的朋友们来玩。不喜欢角色形象的话可以用无敌的创意工坊解决。,True,2026-05-21 22:01:01,schinese,4191,电子真冰 值得拥有 推荐所有喜欢策略游戏的朋友们来玩 不喜欢角色形象的话可以用无敌的创意工坊解决,schinese,"Electronic Real Ice is worth owning. I recommend it to all friends who like strategy games. If you don’t like the character image, you can use the invincible creative workshop to solve it.",0.0,0.551,0.449,0.9545,positive,1
XCOM 2,Strateji,"about a decade ago they told me and 2 other guys: you win a game on Steam, choose any.
two other dorks chose GTA V.

and I chose this Peak. No regrets whatsoever.

runs like ♥♥♥♥♥♥♥ - it is notoriously single-threaded. but it's worth it.

Caxap, if you're reading this, thanks again.",True,2026-05-21 20:20:53,english,12586,"about a decade ago they told me and 2 other guys you win a game on Steam, choose any. two other dorks chose GTA V. and I chose this Peak. No regrets whatsoever. runs like - it is notoriously single-threaded. but it's worth it. Caxap, if you're reading this, thanks again.",english,"about a decade ago they told me and 2 other guys you win a game on Steam, choose any. two other dorks chose GTA V. and I chose this Peak. No regrets whatsoever. runs like - it is notoriously single-threaded. but it's worth it. Caxap, if you're reading this, thanks again.",0.021,0.764,0.214,0.8851,positive,1
XCOM 2,Strateji,"This is by far one of, if not my favorite games, the combination of tactical combat turn base combat, as well slight degree of gambling based on hit percentages. As well getting to create and design you own solider that grow and evolve and maybe even die really makes you draw a deep connection with them throughout your playthrough. Furthermore I feel like modern xcom really is able to create such a cinematic experience with the kill cams, the tension builds slowly and you see either a satisfying squirt of blood and ragdoll or get devastating as you just barley miss shot. Truly this game is a peak experience in tactical turn based combat.",True,2026-05-21 19:56:57,english,7128,"This is by far one of, if not my favorite games, the combination of tactical combat turn base combat, as well slight degree of gambling based on hit percentages. As well getting to create and design you own solider that grow and evolve and maybe even die really makes you draw a deep connection with them throughout your playthrough. Furthermore I feel like modern xcom really is able to create such a cinematic experience with the kill cams, the tension builds slowly and you see either a satisfying squirt of blood and ragdoll or get devastating as you just barley miss shot. Truly this game is a peak experience in tactical turn based combat.",english,"This is by far one of, if not my favorite games, the combination of tactical combat turn base combat, as well slight degree of gambling based on hit percentages. As well getting to create and design you own solider that grow and evolve and maybe even die really makes you draw a deep connection with them throughout your playthrough. Furthermore I feel like modern xcom really is able to create such a cinematic experience with the kill cams, the tension builds slowly and you see either a satisfying squirt of blood and ragdoll or get devastating as you just barley miss shot. Truly this game is a peak experience in tactical turn based combat.",0.187,0.694,0.119,-0.8929,negative,0
XCOM 2,Strateji,I played this before on Console and Mobile and together I have at least 3k hours but being able to mod with the vast majority of mods available at least ads more than 4k hours of extra stuff to have fun and play the game more and I'm also happy to see that there is still a huge community in the series still so thank you community for keeping the game alive and continuing to add stuff!,True,2026-05-21 18:44:30,english,4242,I played this before on Console and Mobile and together I have at least 3k hours but being able to mod with the vast majority of mods available at least ads more than 4k hours of extra stuff to have fun and play the game more and I'm also happy to see that there is still a huge community in the series still so thank you community for keeping the game alive and continuing to add stuff!,english,I played this before on Console and Mobile and together I have at least 3k hours but being able to mod with the vast majority of mods available at least ads more than 4k hours of extra stuff to have fun and play the game more and I'm also happy to see that there is still a huge community in the series still so thank you community for keeping the game alive and continuing to add stuff!,0.0,0.734,0.266,0.9783,positive,1
