game_name,game_genre,review,voted_up,timestamp_created,language,playtime_forever,review_clean,detected_language,review_english,vader_neg,vader_neu,vader_pos,vader_compound,sentiment,vader_voted_match
XCOM 2,Strateji,"Este juego es como la droga, difícil, te hace mal, pero no puedes dejarla. tengo el juego en 3 plataformas distintas y he hecho ragequit mas veces de las que me gustaría admitir. Pero siempre vuelves a recaer, este juego no se que tiene pero siempre tiene te dan ganas de volver y probar una build nueva y una campaña nueva con mods, mas si juegas Long War. Creo que es porque es  muy satisfactorio de jugar cuando te salen las cosas bien, matar un pod de 3 aliens tochos sin que te toquen se siente igual de bien que apalizar a un sionista por la calle.",True,2026-05-10 16:57:44,spanish,14448,"Este juego es como la droga, difícil, te hace mal, pero no puedes dejarla. tengo el juego en 3 plataformas distintas y he hecho ragequit mas veces de las que me gustaría admitir. Pero siempre vuelves a recaer, este juego no se que tiene pero siempre tiene te dan ganas de volver y probar una build nueva y una campaña nueva con mods, mas si juegas Long War. Creo que es porque es muy satisfactorio de jugar cuando te salen las cosas bien, matar un pod de 3 aliens tochos sin que te toquen se siente igual de bien que apalizar a un sionista por la calle.",spanish,"This game is like drugs, difficult, it makes you sick, but you can't give it up. I have the game on 3 different platforms and I have done ragequit more times than I would like to admit. But you always fall back, I don't know what this game has but it always makes you want to go back and try a new build and a new campaign with mods, especially if you play Long War. I think it's because it's very satisfying to play when things go well, killing a pod of 3 aliens without them touching you feels just as good as beating up a Zionist in the street.",0.136,0.676,0.187,0.6405,positive,1
XCOM 2,Strateji,"A legendary 10-year masterclass in tactical stress, ""95% hit chances,"" and pure heartbreak.

It’s 2026, and XCOM 2 is officially ten years old, yet it remains the gold standard against which every other turn-based tactics game is measured. Firaxis took the ""underdog"" fantasy and dialed it to eleven, turning you from a global superpower into a ragtag resistance movement operating out of a stolen alien ship. The gameplay is a perfect, agonizing loop of high-stakes decision-making. Every time you send your squad into the field, you aren't just playing a game; you’re managing a group of people you’ve grown to love, knowing full well that a single bad roll or a poorly timed ""Sectopod"" reveal can result in permanent death. It is brutal, it is unfair, and it is arguably the most satisfying strategy experience ever put on Steam.

The ""War of the Chosen"" expansion is no longer just DLC; in 2026, it’s considered the only way to truly experience the game. The addition of the Chosen—mini-bosses who taunt you, kidnap your soldiers, and sabotage your research—adds a layer of personal rivalry that was missing from the base game. When you combine that with the three new resistance factions and the ""Sitrep"" mission modifiers, no two campaigns ever feel the same. This is a game where you spend half your time in the ""Avenger"" base management screen, sweating over which research project to prioritize, and the other half in the field, screaming at your monitor because your best Ranger missed a point-blank shotgun blast. It is a masterpiece of ""calculated risk"" that rewards brilliance and punishes overconfidence with equal enthusiasm.

What truly keeps XCOM 2 alive a decade later is the sheer insanity of its modding community. With the ""Long War of the Chosen"" mod and thousands of custom voice packs, maps, and classes, you can essentially play this game forever. Whether you’re turning your soldiers into characters from Star Wars or adding 500+ mods to create a ""Season 10"" hardcore campaign like the top YouTubers, the flexibility of the engine is legendary. While the industry has moved on to newer titles, most strategy fans eventually find themselves crawling back to the Avenger. It’s a game that respects your intelligence, tests your patience, and provides a sense of triumph that few other titles can match. Good luck out there, Commander—the Council is watching.

10/10 — I missed a 99% shot and lost my favorite medic. I’m going to uninstall, then immediately start a new Ironman run.",True,2026-05-15 16:08:10,english,174,"A legendary 10-year masterclass in tactical stress, ""95 hit chances,"" and pure heartbreak. It s 2026, and XCOM 2 is officially ten years old, yet it remains the gold standard against which every other turn-based tactics game is measured. Firaxis took the ""underdog"" fantasy and dialed it to eleven, turning you from a global superpower into a ragtag resistance movement operating out of a stolen alien ship. The gameplay is a perfect, agonizing loop of high-stakes decision-making. Every time you send your squad into the field, you aren't just playing a game you re managing a group of people you ve grown to love, knowing full well that a single bad roll or a poorly timed ""Sectopod"" reveal can result in permanent death. It is brutal, it is unfair, and it is arguably the most satisfying strategy experience ever put on Steam. The ""War of the Chosen"" expansion is no longer just DLC in 2026, it s considered the only way to truly experience the game. The addition of the Chosen mini-bosses who taunt you, kidnap your soldiers, and sabotage your research adds a layer of personal rivalry that was missing from the base game. When you combine that with the three new resistance factions and the ""Sitrep"" mission modifiers, no two campaigns ever feel the same. This is a game where you spend half your time in the ""Avenger"" base management screen, sweating over which research project to prioritize, and the other half in the field, screaming at your monitor because your best Ranger missed a point-blank shotgun blast. It is a masterpiece of ""calculated risk"" that rewards brilliance and punishes overconfidence with equal enthusiasm. What truly keeps XCOM 2 alive a decade later is the sheer insanity of its modding community. With the ""Long War of the Chosen"" mod and thousands of custom voice packs, maps, and classes, you can essentially play this game forever. Whether you re turning your soldiers into characters from Star Wars or adding 500 mods to create a ""Season 10"" hardcore campaign like the top YouTubers, the flexibility of the engine is legendary. While the industry has moved on to newer titles, most strategy fans eventually find themselves crawling back to the Avenger. It s a game that respects your intelligence, tests your patience, and provides a sense of triumph that few other titles can match. Good luck out there, Commander the Council is watching. 10 10 I missed a 99 shot and lost my favorite medic. I m going to uninstall, then immediately start a new Ironman run.",english,"A legendary 10-year masterclass in tactical stress, ""95 hit chances,"" and pure heartbreak. It s 2026, and XCOM 2 is officially ten years old, yet it remains the gold standard against which every other turn-based tactics game is measured. Firaxis took the ""underdog"" fantasy and dialed it to eleven, turning you from a global superpower into a ragtag resistance movement operating out of a stolen alien ship. The gameplay is a perfect, agonizing loop of high-stakes decision-making. Every time you send your squad into the field, you aren't just playing a game you re managing a group of people you ve grown to love, knowing full well that a single bad roll or a poorly timed ""Sectopod"" reveal can result in permanent death. It is brutal, it is unfair, and it is arguably the most satisfying strategy experience ever put on Steam. The ""War of the Chosen"" expansion is no longer just DLC in 2026, it s considered the only way to truly experience the game. The addition of the Chosen mini-bosses who taunt you, kidnap your soldiers, and sabotage your research adds a layer of personal rivalry that was missing from the base game. When you combine that with the three new resistance factions and the ""Sitrep"" mission modifiers, no two campaigns ever feel the same. This is a game where you spend half your time in the ""Avenger"" base management screen, sweating over which research project to prioritize, and the other half in the field, screaming at your monitor because your best Ranger missed a point-blank shotgun blast. It is a masterpiece of ""calculated risk"" that rewards brilliance and punishes overconfidence with equal enthusiasm. What truly keeps XCOM 2 alive a decade later is the sheer insanity of its modding community. With the ""Long War of the Chosen"" mod and thousands of custom voice packs, maps, and classes, you can essentially play this game forever. Whether you re turning your soldiers into characters from Star Wars or adding 500 mods to create a ""Season 10"" hardcore campaign like the top YouTubers, the flexibility of the engine is legendary. While the industry has moved on to newer titles, most strategy fans eventually find themselves crawling back to the Avenger. It s a game that respects your intelligence, tests your patience, and provides a sense of triumph that few other titles can match. Good luck out there, Commander the Council is watching. 10 10 I missed a 99 shot and lost my favorite medic. I m going to uninstall, then immediately start a new Ironman run.",0.137,0.728,0.135,-0.2261,negative,0
XCOM 2,Strateji,在幽浮2前我是一点也没接触过美式战旗，甚至我一度因为某些乱打战旗tag的游戏以为自己讨厌战旗这一整个分支，15块钱不到买不了吃亏买不了上当，绝对物超所值,True,2026-05-17 09:20:28,schinese,500,在幽浮2前我是一点也没接触过美式战旗 甚至我一度因为某些乱打战旗tag的游戏以为自己讨厌战旗这一整个分支 15块钱不到买不了吃亏买不了上当 绝对物超所值,schinese,"Before XCOM 2, I had never been exposed to the American War Flag at all. I even thought that I hated the whole branch of War Flag because of some games that randomly used the War Flag tag. I couldn’t buy it for less than 15 yuan, and I couldn’t buy it. I couldn’t be fooled. It’s definitely worth the money.",0.239,0.685,0.075,-0.9401,negative,0
XCOM 2,Strateji,"I love this game so much, its now an annual ritual for me to give it a playthrough.",True,2026-05-24 19:42:10,english,2426,"I love this game so much, its now an annual ritual for me to give it a playthrough.",english,"I love this game so much, its now an annual ritual for me to give it a playthrough.",0.0,0.802,0.198,0.6369,positive,1
XCOM 2,Strateji,"O jogo é uma delícia, não passo raiva nenhuma.

> Botei o rookie para atirar a queima roupa no ET. 
85% de chance de acerto... errou o tiro.

> Botei o sniper para atirar no amaldiçoado ET.
90% de chance de acerto... errou o tiro. 

> A equipe toda atira no maldito ET e erra.

> AT-TE alienígena que atira duas vezes mata dois da minha equipe em um round.

10/10",True,2026-05-29 20:34:47,brazilian,6979,"O jogo é uma delícia, não passo raiva nenhuma. Botei o rookie para atirar a queima roupa no ET. 85 de chance de acerto... errou o tiro. Botei o sniper para atirar no amaldiçoado ET. 90 de chance de acerto... errou o tiro. A equipe toda atira no maldito ET e erra. AT-TE alienígena que atira duas vezes mata dois da minha equipe em um round. 10 10",brazilian,"The game is a delight, I don't get angry at all. I had the rookie shoot point-blank at ET. 85 hit chance... missed the shot. I set the sniper to shoot the cursed ET. 90 hit chance... missed the shot. The whole team shoots at the damn ET and misses. AT-TE alien that shoots twice kills two of my team in one round. 10 10",0.211,0.659,0.129,-0.6906,negative,0
XCOM 2,Strateji,"El juego de los porcentajes inventados, pero está bien para divertirte un rato.",True,2026-05-28 18:37:54,spanish,2301,"El juego de los porcentajes inventados, pero está bien para divertirte un rato.",spanish,"The game of invented percentages, but it's good to have some fun.",0.0,0.546,0.454,0.8519,positive,1
XCOM 2,Strateji,"Игра очень стремительная, начинается резко и заканчивается так же. В общем игрой больше доволен, но для новичков в жанре пошаговых боёв она может показать очень трудной даже на низких настройках сложности. Про знаменитые мемные промахи при 99% я молчу. Главноё проблемой во время прохождения стал контент из DLC про королев пришельцев, но тут писать об этом не буду,  есть отзывы под самим дополнением.",True,2026-05-22 17:39:53,russian,2146,"Игра очень стремительная, начинается резко и заканчивается так же. В общем игрой больше доволен, но для новичков в жанре пошаговых боёв она может показать очень трудной даже на низких настройках сложности. Про знаменитые мемные промахи при 99 я молчу. Главноё проблемой во время прохождения стал контент из DLC про королев пришельцев, но тут писать об этом не буду, есть отзывы под самим дополнением.",russian,"The game is very fast paced, starts abruptly and ends the same way. Overall, I'm more pleased with the game, but for newcomers to the genre of turn-based battles, it can be very difficult even on low difficulty settings. I’m silent about the famous meme misses at 99. The main problem during the playthrough was the content from the DLC about the alien queens, but I won’t write about it here, there are reviews under the add-on itself.",0.204,0.773,0.023,-0.9489,negative,0
XCOM 2,Strateji,好游戏，就是对抗压能力要求比较高，开局教学那两个人是必死的，别救了,True,2026-05-16 14:40:58,schinese,7753,好游戏 就是对抗压能力要求比较高 开局教学那两个人是必死的 别救了,schinese,"It’s a good game, but it requires high pressure resistance. The two people in the opening tutorial are bound to die. Don’t save them.",0.237,0.581,0.182,-0.4404,negative,0
XCOM 2,Strateji,Türkçe dil desteği olmadığı için oyunu tam olarak anlayamadım. Ayrıca virüs tehdidi uyarısı aldığım için yamayı da yüklemedim. Bu sebeplerden dolayı oyunu maalesef oynayamadım ve tavsiye etmiyorum.,False,2026-05-12 01:51:31,turkish,89,Türkçe dil desteği olmadığı için oyunu tam olarak anlayamadım. Ayrıca virüs tehdidi uyarısı aldığım için yamayı da yüklemedim. Bu sebeplerden dolayı oyunu maalesef oynayamadım ve tavsiye etmiyorum.,turkish,"Since there is no Turkish language support, I could not fully understand the game. Also, I did not install the patch because I received a virus threat warning. For these reasons, unfortunately, I could not play the game and I do not recommend it.",0.268,0.682,0.05,-0.8704,negative,1
XCOM 2,Strateji,"If you're looking for a great tactical game then I very much recommend this one, it scratches such a specific itch that very few other games scratch and I really like how you get attached to your characters. I do have 3 minor complaints though sadly:
1.  the turn timers in a lot of missions feel very abstract and artificially imposed to combat a certain playing style. I think there were way better solutions to solve these problems, thankfully this isn't too restrictive and some levels (especially those in the DLC impose better solutions.
2. the early game can feel quite repetitive in subsequent playthroughs
3. while you progress through the game, you unlock new unit types and classes, sadly a lot of the ones you unlock in the late game require you to level up a new unit from level one which at that point in the game is just not worth it since once leveld up they don't provide that much of a bonus compared to other units of the same level.

But again, a lot of these flaws are very minor and I would still recommend getting this game (especially if you're a fan of similar games in the genre like mewgenics). If it goes on sale I also highly recommend getting the ""war of the chosen"" DLC since it introduces a lot of fun new elements (though I do recommend trying the base game first)",True,2026-06-04 13:49:05,english,3768,"If you're looking for a great tactical game then I very much recommend this one, it scratches such a specific itch that very few other games scratch and I really like how you get attached to your characters. I do have 3 minor complaints though sadly 1. the turn timers in a lot of missions feel very abstract and artificially imposed to combat a certain playing style. I think there were way better solutions to solve these problems, thankfully this isn't too restrictive and some levels (especially those in the DLC impose better solutions. 2. the early game can feel quite repetitive in subsequent playthroughs 3. while you progress through the game, you unlock new unit types and classes, sadly a lot of the ones you unlock in the late game require you to level up a new unit from level one which at that point in the game is just not worth it since once leveld up they don't provide that much of a bonus compared to other units of the same level. But again, a lot of these flaws are very minor and I would still recommend getting this game (especially if you're a fan of similar games in the genre like mewgenics). If it goes on sale I also highly recommend getting the ""war of the chosen"" DLC since it introduces a lot of fun new elements (though I do recommend trying the base game first)",english,"If you're looking for a great tactical game then I very much recommend this one, it scratches such a specific itch that very few other games scratch and I really like how you get attached to your characters. I do have 3 minor complaints though sadly 1. the turn timers in a lot of missions feel very abstract and artificially imposed to combat a certain playing style. I think there were way better solutions to solve these problems, thankfully this isn't too restrictive and some levels (especially those in the DLC impose better solutions. 2. the early game can feel quite repetitive in subsequent playthroughs 3. while you progress through the game, you unlock new unit types and classes, sadly a lot of the ones you unlock in the late game require you to level up a new unit from level one which at that point in the game is just not worth it since once leveld up they don't provide that much of a bonus compared to other units of the same level. But again, a lot of these flaws are very minor and I would still recommend getting this game (especially if you're a fan of similar games in the genre like mewgenics). If it goes on sale I also highly recommend getting the ""war of the chosen"" DLC since it introduces a lot of fun new elements (though I do recommend trying the base game first)",0.074,0.765,0.161,0.9678,positive,1
XCOM 2,Strateji,It is a great game that doesn't even need a review. Just a 3 min scroll through the negatives will show you most of them are for the 2K launcher that was already removed ages ago. if you are here chance is you want to buy it or already played it.,True,2026-05-26 10:41:57,english,3329,It is a great game that doesn't even need a review. Just a 3 min scroll through the negatives will show you most of them are for the 2K launcher that was already removed ages ago. if you are here chance is you want to buy it or already played it.,english,It is a great game that doesn't even need a review. Just a 3 min scroll through the negatives will show you most of them are for the 2K launcher that was already removed ages ago. if you are here chance is you want to buy it or already played it.,0.0,0.827,0.173,0.8316,positive,1
XCOM 2,Strateji,Проработана и кто любит данный жанр обязательно должен поиграть особенно лонг вар,True,2026-05-17 06:52:33,russian,28496,Проработана и кто любит данный жанр обязательно должен поиграть особенно лонг вар,russian,"It’s well-developed and anyone who loves this genre should definitely play it, especially long war",0.174,0.459,0.367,0.5606,positive,1
XCOM 2,Strateji,Ive owned this title since it came out.  It really sucks multiplayer is dead(at least from the in game matchmaking).  But this is one of the best strategy games of all time. So many tech paths and variables to the gameplay. This game has crazy replayablitiy.  I recommend if you like turn based games,True,2026-06-03 19:07:34,english,15233,Ive owned this title since it came out. It really sucks multiplayer is dead(at least from the in game matchmaking). But this is one of the best strategy games of all time. So many tech paths and variables to the gameplay. This game has crazy replayablitiy. I recommend if you like turn based games,english,Ive owned this title since it came out. It really sucks multiplayer is dead(at least from the in game matchmaking). But this is one of the best strategy games of all time. So many tech paths and variables to the gameplay. This game has crazy replayablitiy. I recommend if you like turn based games,0.075,0.739,0.186,0.852,positive,1
XCOM 2,Strateji,美式战旗天花板，无论关卡设计还是人物设计都是顶级，是值得玩了再玩的游戏,True,2026-05-17 05:37:40,schinese,5895,美式战旗天花板 无论关卡设计还是人物设计都是顶级 是值得玩了再玩的游戏,schinese,American battle flag ceiling. Both level design and character design are top-notch. It is a game worth playing again and again.,0.107,0.741,0.152,0.0258,neutral,0
XCOM 2,Strateji,作为诞生于大型科幻架构游戏余晖时期的《XCOM2》，此时好兄弟《质量效应》《命令与征服》《死亡空间》等这些同样拥有大型且完整世界观设定的科幻游戏早已坟堆种树了，《XCOM2》无疑扛起了大旗，事实上它确实做到了。虽然从主线剧情来看XCOM2有点短小，但系列设定和内容表现上它是完整的。,True,2026-05-17 05:23:20,schinese,3069,作为诞生于大型科幻架构游戏余晖时期的 XCOM2 此时好兄弟 质量效应 命令与征服 死亡空间 等这些同样拥有大型且完整世界观设定的科幻游戏早已坟堆种树了 XCOM2 无疑扛起了大旗 事实上它确实做到了 虽然从主线剧情来看XCOM2有点短小 但系列设定和内容表现上它是完整的,schinese,"XCOM2 was born in the afterglow period of large-scale science fiction architecture games. At this time, science fiction games with large and complete world settings such as Good Brothers, Mass Effect, Command and Conquer, and Dead Space have already been planted in the graveyard.",0.129,0.813,0.058,-0.5574,negative,0
XCOM 2,Strateji,神一样的游戏 每年都打一些新Mod玩个新档 100/10,True,2026-05-14 13:13:51,schinese,79456,神一样的游戏 每年都打一些新Mod玩个新档 100 10,schinese,God-like game. Every year I play some new mods and play a new game. 100 10,0.0,0.745,0.255,0.5859,positive,1
XCOM 2,Strateji,"Favorite Turn based game, star wars mods with WOTC is peak gameplay. In my 200+ hours. Made 104th, 501st, 212th, 327th, 91st, mandolorian custom character pools,",True,2026-06-08 06:26:42,english,14027,"Favorite Turn based game, star wars mods with WOTC is peak gameplay. In my 200 hours. Made 104th, 501st, 212th, 327th, 91st, mandolorian custom character pools,",english,"Favorite Turn based game, star wars mods with WOTC is peak gameplay. In my 200 hours. Made 104th, 501st, 212th, 327th, 91st, mandolorian custom character pools,",0.118,0.784,0.098,-0.1531,negative,0
XCOM 2,Strateji,excellent strategy game. love the tempo and that decisions are not rushed.,True,2026-06-07 15:36:57,english,8324,excellent strategy game. love the tempo and that decisions are not rushed.,english,excellent strategy game. love the tempo and that decisions are not rushed.,0.0,0.559,0.441,0.836,positive,1
XCOM 2,Strateji,"самая сложная игра в моей жизни. Я привык проходить игры на хардкоре, но эта игра меня сломала...
10/10 пойду проходить дальше",True,2026-06-07 14:18:31,russian,295,"самая сложная игра в моей жизни. Я привык проходить игры на хардкоре, но эта игра меня сломала... 10 10 пойду проходить дальше",russian,"the most difficult game of my life. I'm used to playing games on hardcore, but this game broke me... 10 10 I'll move on",0.2,0.75,0.05,-0.6365,negative,0
