game_name,game_genre,review,voted_up,timestamp_created,language,playtime_forever,review_clean,detected_language,review_english,vader_neg,vader_neu,vader_pos,vader_compound,sentiment,vader_voted_match
XCOM 2,Strateji,"МЕНЕДЖМЕНТ НИЩЕТЫ И ГЕЙМДИЗАЙНЕРСКОЕ БЕССИЛИЕ

 В моем случае наиграно не так много часов, но чтобы сделать какой-то вывод о данном шедевре, я запас пару интересных мыслей о ней, и с ""удовольствием"" поделюсь ими с вами. 
 Начнем с того что, если вы играли в великолепную XCOM: Enemy Unknown / Within и ждете от сиквела честной военной тактики, где жизнь каждого элитного бойца спецназначения — это высший приоритет, а экономика работает на снабжение фронта, то забудьте. Вторая часть — это не тактика. Это душный симулятор борьбы с ленивым геймдизайном, завернутый в клише фантастики 90-х.

ПЛЮСЫ:
1. Атмосфера партизанского сопротивления. 
На бумаге идея «мы проиграли войну и партизаним на угнанном корабле» звучит круто и стильно.
2. Механики фракций из DLC. 
 Жнецы с их невидимостью и детонаторами, а также Заступники действительно вносят разнообразие в унылый стоковый геймплей, а он унылый, кто бы что не говорил. Они выпустили это ДЛС только для того, чтобы разнообразить карты, противников, добавить союзников и в целом, я так понял, втихую чуть забалансить игру, потому что их травмированный жест былых времен(вот раньше было лучше) - явно никто не оценил.

С плюсами все, думаю тут многого и не скажешь.

МИНУСЫ:
1. Искусственная сложность вместо интеллекта врагов. 
 Разработчики не смогли сделать искусственный интеллект пришельцев умным. Вместо этого они усложнили игру тем, что скрутили игроку руки. Сложность растет не от хитрых маневров врага, а от того, насколько сильно вам зажали яйца в тиски ограничений. Карманы бойцов обрезаны: вы физически не можете положить боевому товарищу в инвентарь и гранату, и копеечный ментальный щит от гипноза одновременно. Выбирай: или ты взрываешь стены, или твой боец сходит с ума. Это все даже на мизерном, лоховском(как сказали бы, я уверен, фанаты этой игры, именно этой игры, а не вселенной) уровне сложности. К тому же, чем выше сложность игры, тем все сильнее ресурсы и время, драгоценное ваше время в игре - становится под расчет, никто не даст вам фармить точки на карте сколько вам это нужно, через пару, или пару-тройку(дай Бог) дней вас убедительно попросят выдвинуться на задание по спасению какого то е%%на, потому что это КРИТИЧЕСКИ важно для СОПРОТИВЛЕНИЯ, и вот вы уже понимаете, что с прошлого задания все ваши бойцы либо погибли(зачастую), либо ранены и взять их не получится, настало время героев современности - Новобранцев).

2. Маразм игровой экономики и интерфейса.
 Игра заставляет вас играть в бухгалтерский менеджмент нищеты. У вас на базе летает гигантский хайтек-корабль, работают лучшие умы планеты, но чтобы выдать бойцу карманную аптечку или улучшить автомат, вам нужно лично гриндить ресурсы и собирать ржавые гвозди по помойкам. При этом интерфейс откровенно держит игрока за дебила: во вкладке производства Наножилет (+1 ХП, сующийся в слот вместо гранаты) покупается поштучно и стоит как крыло самолета, а нормальная броня «Хищник» имеет плашку [УЛУЧШИТЬ: ОТРЯД]. Но из-за дебильного визуала новичок уверен, что ему придется спонсировать каждого солдата отдельно, из-за чего совершает критические ошибки в развитии базы. Я хочу подметить, игра не для новичков вселенной, чтобы начать играть в нее условно с этой части, вам нужно знать, что было в прошлой, не потому что сюжет связан(хотя и поэтому тоже), а потому что механики все оттуда перекочевали. Даже при выборе уровня сложности вам говорят - ВЫ УВЕРЕНЫ, ЧТО ХОТИТЕ ОТКЛЮЧИТЬ ОБУЧЕНИЕ? Да бл;%%%ь уверен, Боже... И это будет критическая ошибка опять же для новичка, но я думаю они и не нажмут ее, хотя кто его знает.

3. Наглое жульничество ИИ. 
 В игре полностью отсутствует честная позиционная война. Механика «Шаг в сторону» позволяет пришельцам виртуально высовываться из-за угла на соседнюю клетку, из-за чего ваше «Полное укрытие (100%)» внутри железного грузовика превращается в братскую могилу(и да, я знаю, что машины в игре взрываются, тут идет описании укрытие со 100% защитой под позицию врага). Враг просто простреливает текстуры металла по диагонали сквозь сплошной борт. ИИ видит карту сквозь туман войны, знает ваши позиции и пассивно ведет патрули прямо к вашему отряду, искусственно зажимая в клещи, причем отчасти игровую условность они соблюли, враг в тумане войны ТЕБЯ видит, ты(как игрок) знаешь где он, но твои бойцы нет). Это все еще самый низкий уровень сложности, с включенными бафами для игрока и дебаффами для противника) И да, я понимаю, что это XCOM, я знаю, что боец может промахнуться в упор, с 91%-м шансом попадания, но если вы ищете просто проходняк в этой игре, вы сильно разочаруетесь, под пиво в нее не зайти, просто поиграть ради того, ЧТОБЫ ПОИГРАТЬ - не выйдет, это не кс, не ведьмак, не гта, это даже не Герои Меча и Магии, это абсолютно другой мир. И аргументы от типов, которые тупа заучили все тактики и механики этого детища не прокатят, я позиционируюсь - как новичок, и транслирую данную информацию в сторону новичков.

4. Каша из информации и ложная срочность.
 Игра постоянно орет вам под руку: «ШЕФ(замечательный перевод), срочно лети туда!», «Проект Аватар растет!», «Избранные собирают данные!». На деле вас заставляют тратить недели на сюжетную чушь (вроде вскрытия Офицера, грубо говоря, ради пары строчек диалога), пока ваш отряд бегает с базовыми пукалками против прокачанных пришельцев. Игра нагло врет в лицо, создавая иллюзию дефицита времени там, где можно просто сидеть и копить ресурсы. 
 Даже если вы, условно, идеально разобрались с Избранной(одной из) на миссиях и не даете ей прикоснуться к бойцам, её шкала знаний всё равно пассивно растет каждый месяц просто по скрипту, потому что разработчикам было лень прописать адекватную механику противодействия(клоуны).

 Тут вроде бы все. И опять же, я повторюсь, я не фанат вселенной, не сидел в этих играх по 500+ часов, не тактический игрок в данном жанре игр. У меня нет понимания, как на сложностях уровня от Нормально и выше - контрить обычных нпц, которые из 5 попаданий уверенно раза 3-4 точно попадут, я не хардкор ""геймер"", я просто хотел пройти новую часть и очень даже полюбившейся мне 1(Enemy Within или Unknown, какая там первой издалась). Причем первую часть я проходил далеко не на среднем уровне сложности, но с этой явно что то не так. 
 Видел также много комментариев, где игроки хвалят ее за ощутимую сложность, Господи, да на здоровье ребята, но нужно же как то видеть край, когда у игры есть банальный выбор уровня этой самой сложности) 

ИГРАТЬ ИЛИ НЕ ИГРАТЬ НОВИЧКУ?
 Да: Если вы мазохист или как такие люди себя еще называют - хардкорщик(только самая высокая сложность), любите систему Save Scumming (перезагрузки по 20 раз за ход ради сброса зашитого рандома) и готовы терпеть промахи при 95% шанса попадания в упор.

 НЕТ: Если вы цените размеренный мыслительный процесс, логику войны, честные правила и хотите гордиться своим отрядом, а не чувствовать себя заплюexperimental сычихой с калеками-новобранцами в середине кампании. И да, я знаю, что дальше ты начинаешь прокачиваться, получается дать отпор более сильным врагам, но сама система, суть прогрессии убивает стимул хоть как то пытаться их победить той же логикой, потому что все всегда склоняется к вечному исследованию, покупке прокачке и вечному фарму (а мы помним, что вечно фармить не дадут)), где дай бог твой условный сержант или Лейтенант, а то и выше (там звание, если мне не изменяет память вплоть до полковника) - будет просто убит в самой сухой, тупой и невероятно раздражающей ситуации. Игра не прощает НИКАКИХ ошибок, и понятно, что перезагружать задание - это норма для нее, там даже отдельная кнопка есть, начать задание заново) 
 И весь этот спектр эмоций выливается в одно обычное объяснение - вечный загон по нехватке времени, эта функция выполнена слишком глупо, потому что даже когда ты уже неплохой такой ШЕФ и у тебя серьезная подготовка бойцов - данное чувство вас не покинет.

Стим гад не пропустил весь обзор, но пару слов еще ЕСТЬ)
[ПРОДОЛЖЕНИЕ ОБЗОРА ЧИТАЙТЕ НИЖЕ В КОММЕНТАРИЯХ]",False,2026-06-06 14:39:51,russian,1283,"МЕНЕДЖМЕНТ НИЩЕТЫ И ГЕЙМДИЗАЙНЕРСКОЕ БЕССИЛИЕ В моем случае наиграно не так много часов, но чтобы сделать какой-то вывод о данном шедевре, я запас пару интересных мыслей о ней, и с ""удовольствием"" поделюсь ими с вами. Начнем с того что, если вы играли в великолепную XCOM Enemy Unknown Within и ждете от сиквела честной военной тактики, где жизнь каждого элитного бойца спецназначения это высший приоритет, а экономика работает на снабжение фронта, то забудьте. Вторая часть это не тактика. Это душный симулятор борьбы с ленивым геймдизайном, завернутый в клише фантастики 90-х. ПЛЮСЫ 1. Атмосфера партизанского сопротивления. На бумаге идея мы проиграли войну и партизаним на угнанном корабле звучит круто и стильно. 2. Механики фракций из DLC. Жнецы с их невидимостью и детонаторами, а также Заступники действительно вносят разнообразие в унылый стоковый геймплей, а он унылый, кто бы что не говорил. Они выпустили это ДЛС только для того, чтобы разнообразить карты, противников, добавить союзников и в целом, я так понял, втихую чуть забалансить игру, потому что их травмированный жест былых времен(вот раньше было лучше) - явно никто не оценил. С плюсами все, думаю тут многого и не скажешь. МИНУСЫ 1. Искусственная сложность вместо интеллекта врагов. Разработчики не смогли сделать искусственный интеллект пришельцев умным. Вместо этого они усложнили игру тем, что скрутили игроку руки. Сложность растет не от хитрых маневров врага, а от того, насколько сильно вам зажали яйца в тиски ограничений. Карманы бойцов обрезаны вы физически не можете положить боевому товарищу в инвентарь и гранату, и копеечный ментальный щит от гипноза одновременно. Выбирай или ты взрываешь стены, или твой боец сходит с ума. Это все даже на мизерном, лоховском(как сказали бы, я уверен, фанаты этой игры, именно этой игры, а не вселенной) уровне сложности. К тому же, чем выше сложность игры, тем все сильнее ресурсы и время, драгоценное ваше время в игре - становится под расчет, никто не даст вам фармить точки на карте сколько вам это нужно, через пару, или пару-тройку(дай Бог) дней вас убедительно попросят выдвинуться на задание по спасению какого то е на, потому что это КРИТИЧЕСКИ важно для СОПРОТИВЛЕНИЯ, и вот вы уже понимаете, что с прошлого задания все ваши бойцы либо погибли(зачастую), либо ранены и взять их не получится, настало время героев современности - Новобранцев). 2. Маразм игровой экономики и интерфейса. Игра заставляет вас играть в бухгалтерский менеджмент нищеты. У вас на базе летает гигантский хайтек-корабль, работают лучшие умы планеты, но чтобы выдать бойцу карманную аптечку или улучшить автомат, вам нужно лично гриндить ресурсы и собирать ржавые гвозди по помойкам. При этом интерфейс откровенно держит игрока за дебила во вкладке производства Наножилет ( 1 ХП, сующийся в слот вместо гранаты) покупается поштучно и стоит как крыло самолета, а нормальная броня Хищник имеет плашку УЛУЧШИТЬ ОТРЯД . Но из-за дебильного визуала новичок уверен, что ему придется спонсировать каждого солдата отдельно, из-за чего совершает критические ошибки в развитии базы. Я хочу подметить, игра не для новичков вселенной, чтобы начать играть в нее условно с этой части, вам нужно знать, что было в прошлой, не потому что сюжет связан(хотя и поэтому тоже), а потому что механики все оттуда перекочевали. Даже при выборе уровня сложности вам говорят - ВЫ УВЕРЕНЫ, ЧТО ХОТИТЕ ОТКЛЮЧИТЬ ОБУЧЕНИЕ? Да бл ь уверен, Боже... И это будет критическая ошибка опять же для новичка, но я думаю они и не нажмут ее, хотя кто его знает. 3. Наглое жульничество ИИ. В игре полностью отсутствует честная позиционная война. Механика Шаг в сторону позволяет пришельцам виртуально высовываться из-за угла на соседнюю клетку, из-за чего ваше Полное укрытие (100 ) внутри железного грузовика превращается в братскую могилу(и да, я знаю, что машины в игре взрываются, тут идет описании укрытие со 100 защитой под позицию врага). Враг просто простреливает текстуры металла по диагонали сквозь сплошной борт. ИИ видит карту сквозь туман войны, знает ваши позиции и пассивно ведет патрули прямо к вашему отряду, искусственно зажимая в клещи, причем отчасти игровую условность они соблюли, враг в тумане войны ТЕБЯ видит, ты(как игрок) знаешь где он, но твои бойцы нет). Это все еще самый низкий уровень сложности, с включенными бафами для игрока и дебаффами для противника) И да, я понимаю, что это XCOM, я знаю, что боец может промахнуться в упор, с 91 -м шансом попадания, но если вы ищете просто проходняк в этой игре, вы сильно разочаруетесь, под пиво в нее не зайти, просто поиграть ради того, ЧТОБЫ ПОИГРАТЬ - не выйдет, это не кс, не ведьмак, не гта, это даже не Герои Меча и Магии, это абсолютно другой мир. И аргументы от типов, которые тупа заучили все тактики и механики этого детища не прокатят, я позиционируюсь - как новичок, и транслирую данную информацию в сторону новичков. 4. Каша из информации и ложная срочность. Игра постоянно орет вам под руку ШЕФ(замечательный перевод), срочно лети туда! , Проект Аватар растет! , Избранные собирают данные! . На деле вас заставляют тратить недели на сюжетную чушь (вроде вскрытия Офицера, грубо говоря, ради пары строчек диалога), пока ваш отряд бегает с базовыми пукалками против прокачанных пришельцев. Игра нагло врет в лицо, создавая иллюзию дефицита времени там, где можно просто сидеть и копить ресурсы. Даже если вы, условно, идеально разобрались с Избранной(одной из) на миссиях и не даете ей прикоснуться к бойцам, её шкала знаний всё равно пассивно растет каждый месяц просто по скрипту, потому что разработчикам было лень прописать адекватную механику противодействия(клоуны). Тут вроде бы все. И опять же, я повторюсь, я не фанат вселенной, не сидел в этих играх по 500 часов, не тактический игрок в данном жанре игр. У меня нет понимания, как на сложностях уровня от Нормально и выше - контрить обычных нпц, которые из 5 попаданий уверенно раза 3-4 точно попадут, я не хардкор ""геймер"", я просто хотел пройти новую часть и очень даже полюбившейся мне 1(Enemy Within или Unknown, какая там первой издалась). Причем первую часть я проходил далеко не на среднем уровне сложности, но с этой явно что то не так. Видел также много комментариев, где игроки хвалят ее за ощутимую сложность, Господи, да на здоровье ребята, но нужно же как то видеть край, когда у игры есть банальный выбор уровня этой самой сложности) ИГРАТЬ ИЛИ НЕ ИГРАТЬ НОВИЧКУ? Да Если вы мазохист или как такие люди себя еще называют - хардкорщик(только самая высокая сложность), любите систему Save Scumming (перезагрузки по 20 раз за ход ради сброса зашитого рандома) и готовы терпеть промахи при 95 шанса попадания в упор. НЕТ Если вы цените размеренный мыслительный процесс, логику войны, честные правила и хотите гордиться своим отрядом, а не чувствовать себя заплюexperimental сычихой с калеками-новобранцами в середине кампании. И да, я знаю, что дальше ты начинаешь прокачиваться, получается дать отпор более сильным врагам, но сама система, суть прогрессии убивает стимул хоть как то пытаться их победить той же логикой, потому что все всегда склоняется к вечному исследованию, покупке прокачке и вечному фарму (а мы помним, что вечно фармить не дадут)), где дай бог твой условный сержант или Лейтенант, а то и выше (там звание, если мне не изменяет память вплоть до полковника) - будет просто убит в самой сухой, тупой и невероятно раздражающей ситуации. Игра не прощает НИКАКИХ ошибок, и понятно, что перезагружать задание - это норма для нее, там даже отдельная кнопка есть, начать задание заново) И весь этот спектр эмоций выливается в одно обычное объяснение - вечный загон по нехватке времени, эта функция выполнена слишком глупо, потому что даже когда ты уже неплохой такой ШЕФ и у тебя серьезная подготовка бойцов - данное чувство вас не покинет. Стим гад не пропустил весь обзор, но пару слов еще ЕСТЬ) ПРОДОЛЖЕНИЕ ОБЗОРА ЧИТАЙТЕ НИЖЕ В КОММЕНТАРИЯХ",russian,"МЕНЕДЖМЕНТ НИЩЕТЫ И ГЕЙМДИЗАЙНЕРСКОЕ БЕССИЛИЕ В моем случае наиграно не так много часов, но чтобы сделать какой-то вывод о данном шедевре, я запас пару интересных мыслей о ней, и с ""удовольствием"" поделюсь ими с вами. Начнем с того что, если вы играли в великолепную XCOM Enemy Unknown Within и ждете от сиквела честной военной тактики, где жизнь каждого элитного бойца спецназначения это высший приоритет, а экономика работает на снабжение фронта, то забудьте. Вторая часть это не тактика. Это душный симулятор борьбы с ленивым геймдизайном, завернутый в клише фантастики 90-х. ПЛЮСЫ 1. Атмосфера партизанского сопротивления. На бумаге идея мы проиграли войну и партизаним на угнанном корабле звучит круто и стильно. 2. Механики фракций из DLC. Жнецы с их невидимостью и детонаторами, а также Заступники действительно вносят разнообразие в унылый стоковый геймплей, а он унылый, кто бы что не говорил. Они выпустили это ДЛС только для того, чтобы разнообразить карты, противников, добавить союзников и в целом, я так понял, втихую чуть забалансить игру, потому что их травмированный жест былых времен(вот раньше было лучше) - явно никто не оценил. С плюсами все, думаю тут многого и не скажешь. МИНУСЫ 1. Искусственная сложность вместо интеллекта врагов. Разработчики не смогли сделать искусственный интеллект пришельцев умным. Вместо этого они усложнили игру тем, что скрутили игроку руки. Сложность растет не от хитрых маневров врага, а от того, насколько сильно вам зажали яйца в тиски ограничений. Карманы бойцов обрезаны вы физически не можете положить боевому товарищу в инвентарь и гранату, и копеечный ментальный щит от гипноза одновременно. Выбирай или ты взрываешь стены, или твой боец сходит с ума. Это все даже на мизерном, лоховском(как сказали бы, я уверен, фанаты этой игры, именно этой игры, а не вселенной) уровне сложности. К тому же, чем выше сложность игры, тем все сильнее ресурсы и время, драгоценное ваше время в игре - становится под расчет, никто не даст вам фармить точки на карте сколько вам это нужно, через пару, или пару-тройку(дай Бог) дней вас убедительно попросят выдвинуться на задание по спасению какого то е на, потому что это КРИТИЧЕСКИ важно для СОПРОТИВЛЕНИЯ, и вот вы уже понимаете, что с прошлого задания все ваши бойцы либо погибли(зачастую), либо ранены и взять их не получится, настало время героев современности - Новобранцев). 2. Маразм игровой экономики и интерфейса. Игра заставляет вас играть в бухгалтерский менеджмент нищеты. У вас на базе летает гигантский хайтек-корабль, работают лучшие умы планеты, но чтобы выдать бойцу карманную аптечку или улучшить автомат, вам нужно лично гриндить ресурсы и собирать ржавые гвозди по помойкам. При этом интерфейс откровенно держит игрока за дебила во вкладке производства Наножилет ( 1 ХП, сующийся в слот вместо гранаты) покупается поштучно и стоит как крыло самолета, а нормальная броня Хищник имеет плашку УЛУЧШИТЬ ОТРЯД . Но из-за дебильного визуала новичок уверен, что ему придется спонсировать каждого солдата отдельно, из-за чего совершает критические ошибки в развитии базы. Я хочу подметить, игра не для новичков вселенной, чтобы начать играть в нее условно с этой части, вам нужно знать, что было в прошлой, не потому что сюжет связан(хотя и поэтому тоже), а потому что механики все оттуда перекочевали. Даже при выборе уровня сложности вам говорят - ВЫ УВЕРЕНЫ, ЧТО ХОТИТЕ ОТКЛЮЧИТЬ ОБУЧЕНИЕ? Да бл ь уверен, Боже... И это будет критическая ошибка опять же для новичка, но я думаю они и не нажмут ее, хотя кто его знает. 3. Наглое жульничество ИИ. В игре полностью отсутствует честная позиционная война. Механика Шаг в сторону позволяет пришельцам виртуально высовываться из-за угла на соседнюю клетку, из-за чего ваше Полное укрытие (100 ) внутри железного грузовика превращается в братскую могилу(и да, я знаю, что машины в игре взрываются, тут идет описании укрытие со 100 защитой под позицию врага). Враг просто простреливает текстуры металла по диагонали сквозь сплошной борт. ИИ видит карту сквозь туман войны, знает ваши позиции и пассивно ведет патрули прямо к вашему отряду, искусственно зажимая в клещи, причем отчасти игровую условность они соблюли, враг в тумане войны ТЕБЯ видит, ты(как игрок) знаешь где он, но твои бойцы нет). Это все еще самый низкий уровень сложности, с включенными бафами для игрока и дебаффами для противника) И да, я понимаю, что это XCOM, я знаю, что боец может промахнуться в упор, с 91 -м шансом попадания, но если вы ищете просто проходняк в этой игре, вы сильно разочаруетесь, под пиво в нее не зайти, просто поиграть ради того, ЧТОБЫ ПОИГРАТЬ - не выйдет, это не кс, не ведьмак, не гта, это даже не Герои Меча и Магии, это абсолютно другой мир. И аргументы от типов, которые тупа заучили все тактики и механики этого детища не прокатят, я позиционируюсь - как новичок, и транслирую данную информацию в сторону новичков. 4. Каша из информации и ложная срочность. Игра постоянно орет вам под руку ШЕФ(замечательный перевод), срочно лети туда! , Проект Аватар растет! , Избранные собирают данные! . На деле вас заставляют тратить недели на сюжетную чушь (вроде вскрытия Офицера, грубо говоря, ради пары строчек диалога), пока ваш отряд бегает с базовыми пукалками против прокачанных пришельцев. Игра нагло врет в лицо, создавая иллюзию дефицита времени там, где можно просто сидеть и копить ресурсы. Даже если вы, условно, идеально разобрались с Избранной(одной из) на миссиях и не даете ей прикоснуться к бойцам, её шкала знаний всё равно пассивно растет каждый месяц просто по скрипту, потому что разработчикам было лень прописать адекватную механику противодействия(клоуны). Тут вроде бы все. И опять же, я повторюсь, я не фанат вселенной, не сидел в этих играх по 500 часов, не тактический игрок в данном жанре игр. У меня нет понимания, как на сложностях уровня от Нормально и выше - контрить обычных нпц, которые из 5 попаданий уверенно раза 3-4 точно попадут, я не хардкор ""геймер"", я просто хотел пройти новую часть и очень даже полюбившейся мне 1(Enemy Within или Unknown, какая там первой издалась). Причем первую часть я проходил далеко не на среднем уровне сложности, но с этой явно что то не так. Видел также много комментариев, где игроки хвалят ее за ощутимую сложность, Господи, да на здоровье ребята, но нужно же как то видеть край, когда у игры есть банальный выбор уровня этой самой сложности) ИГРАТЬ ИЛИ НЕ ИГРАТЬ НОВИЧКУ? Да Если вы мазохист или как такие люди себя еще называют - хардкорщик(только самая высокая сложность), любите систему Save Scumming (перезагрузки по 20 раз за ход ради сброса зашитого рандома) и готовы терпеть промахи при 95 шанса попадания в упор. НЕТ Если вы цените размеренный мыслительный процесс, логику войны, честные правила и хотите гордиться своим отрядом, а не чувствовать себя заплюexperimental сычихой с калеками-новобранцами в середине кампании. И да, я знаю, что дальше ты начинаешь прокачиваться, получается дать отпор более сильным врагам, но сама система, суть прогрессии убивает стимул хоть как то пытаться их победить той же логикой, потому что все всегда склоняется к вечному исследованию, покупке прокачке и вечному фарму (а мы помним, что вечно фармить не дадут)), где дай бог твой условный сержант или Лейтенант, а то и выше (там звание, если мне не изменяет память вплоть до полковника) - будет просто убит в самой сухой, тупой и невероятно раздражающей ситуации. Игра не прощает НИКАКИХ ошибок, и понятно, что перезагружать задание - это норма для нее, там даже отдельная кнопка есть, начать задание заново) И весь этот спектр эмоций выливается в одно обычное объяснение - вечный загон по нехватке времени, эта функция выполнена слишком глупо, потому что даже когда ты уже неплохой такой ШЕФ и у тебя серьезная подготовка бойцов - данное чувство вас не покинет. Стим гад не пропустил весь обзор, но пару слов еще ЕСТЬ) ПРОДОЛЖЕНИЕ ОБЗОРА ЧИТАЙТЕ НИЖЕ В КОММЕНТАРИЯХ",0.004,0.994,0.003,-0.3687,negative,1
