game_name,game_genre,review,voted_up,timestamp_created,language,playtime_forever
The Witcher 3,RPG,"DLC announced 11 years after release, my favourite game keeps getting better",True,2026-05-27 10:17:40,english,6160
The Witcher 3,RPG,"I started The Witcher 3 without playing the earlier games and didn’t really know the world or the author. I just jumped in like any other game. But soon I realized how amazing it was. 
I’ve always been a bit into Slavic culture, and this game is full of it music, environments, history, even the way people live. Every NPC feels like they belong there, every quest is meaningful, and the world is alive.
The combat, crafting, monsters, RPG systems, graphics, and atmosphere all hit the mark. Sometimes it’s chill and relaxing, other times it’s chaotic or mysterious. You can spend hours just exploring or focusing on a single quest.
Finishing it made me wish I could delete my memory and play it all over again. On older PCs, FPS can drop, but on modern hardware it runs perfectly.
The Witcher 3 is just a perfect mix of story, world, and gameplay truly unforgettable.",True,2026-05-15 07:39:09,english,22599
The Witcher 3,RPG,"[h1] Начало пути: От книжных страниц к Вызиме [/h1]

Мое подлинное знакомство с этой вселенной началось задолго до третьей части. В свое время именно «Ведьмак 2» заставил меня совершить безумный, но прекрасный поступок - прочесть всю книжную сагу Анджея Сапковского залпом, всего за одну неделю.

Только зная предысторию, понимая цену каждого шрама на теле Геральта и каждую интригу королей, можно по-настоящему оценить масштаб финала. Когда пришла очередь третьей игры, я ступила на эти земли не просто игроком, а человеком, который знает цену каждому слову в диалогах.

Отголоски той старой книжной любви и по сей день определяют мою суть. Мой ник - MeowYen - зарожден и выкован именно этой бесконечной привязанностью к Йеннифэр из Венгерберга. И раз уж зашла речь о чувствах: в Сети до сих пор не утихают глупые споры о том, кого же выбрать ведьмаку - Йеннифэр или Трисс. Смешно даже тратить на это время. Выбор очевиден, и это, разумеется, Йен. Лаванда и крыжовник не терпят компромиссов.

[h1] Анализ мира: Магия, эстетика и суровая реальность [/h1]
Этот мир жесток, но отрицать его величие невозможно.
[list]
    [*] [b]Атмосфера и визуал: [/b] Игра невероятно красивая. Авторам удалось передать меланхоличную, живую красоту славянского фэнтези. Солнце, садящееся за болота Велена, золотые поля Новиграда и суровые, омываемые штормами скалы Скеллиге - каждый кадр выглядит как ожившее полотно.
    [*] [b]Музыкальное сопровождение:[/b] Звуки этого мира - отдельный мед для ушей. Музыка группы Percival и Марчина Пшибыловича создает осязаемый уют у костра и заставляет сердце биться чаще во время боя. Она проникает под кожу и остается там навсегда.
    [*] [b]Ролевая система: [/b] Как ролевая игра с глубокими RPG-элементами, третья часть выполнена на высочайшем уровне. Это культовое произведение своего времени. Здесь нет однозначного добра и зла. Твои решения имеют вес, а последствия могут настигнуть спустя десятки часов, когда ты меньше всего этого ждешь.
[/list]

[b] Техническое состояние: [/b]

Будем честны и снимем розовые очки. Техническое состояние игры - это полное отражение нашей реальности: оно несовершенно. Даже после множества обновлений и версий следующего поколения (Next-Gen) игра сохранила свои шрамы.

Вы по-прежнему будете сталкиваться с капризным поведением Плотвы, застревающей в заборах, ломающимися скриптами физики и периодическими падениями частоты кадров в густонаселенных городах. Этот мир прекрасен, но он собран руками смертных, а значит, полон изъянов. Но всё ещё лучше подавляющего кол-ва игр.

[b] Цирилла: Сердце бури [/b]
Дитя Старшей Крови, Ласточка, Фалька. Цирилла - это незаметный, но абсолютный центр всего сюжета и повествования. Вокруг нее вращаются шестеренки политики, магии и войн.

Но главное не в ее силе перемещения между мирами. Цири - потрясающий пример для подражания. Она ломается, совершает ошибки, бежит от судьбы, но каждый раз находит в себе силы встать, обнажить ласточкин клинок и встретить опасность лицом к лицу. Это история взросления сильной, независимой женщины в мире, который пытается использовать ее в своих целях.

Это не просто игра, это эпоха, к которой хочется возвращаться.

[i] «Ты спросишь, есть ли в этой жизни хоть что-то, ради чего стоит обнажать меч и терпеть удары судьбы. Я отвечу тебе без тени сомнения. Дело вовсе не в спасении мира, не в интригах королей и не в магии древних свитков. Всё это - лишь пыль под копытами наших коней.Истинный смысл обретается там, где сквозь шум бури ты слышишь голос того, кто тебе дорог. Ради возможности защитить тех, кого мы любим, ради того, чтобы увидеть их живыми и невредимыми, стоит пройти сквозь любой ад. Всё остальное - пустое». 
- Йеннифэр из Венгерберга. [/i]",True,2026-06-01 18:25:27,russian,18598
The Witcher 3,RPG,"Ben seni oynamadan önce oyun oynadığımı sanırdım,
Ferhat ile şirini, aslı ile keremi aşk diye bilirdim.
İlyas ve ilyadayı,truvayı efsaneler efsanesi sanardım,
Odun ateşinde pişen hatay dönerini lezzetli diye bilirdim.
Ben senle tanışmadan önce gözlerim görür sanardım.
Tolstoyu,Dostevelsyi edebiyatın kendisi sanardım.
Ben senle tanışmadan önce oyunları oyun sanardım.",True,2026-05-19 16:53:30,turkish,15104
The Witcher 3,RPG,"After 10 years, this game still looks better than some brand-new releases today. On the highest settings, it sometimes feels like a fantasy vacation with ray tracing instead of sunscreen. 🌲⚔️
You ride peacefully through the world, admire the scenery… and suddenly get jumped by some monster hiding in the bushes. 10/10 atmosphere.
The story? Absolutely brilliant. It feels like playing an interactive fantasy book — except every now and then you beat people up with two swords. Every quest somehow has its own little story, and even the side quests are often more exciting than the entire main stories of other games.
And then there are the DLCs…
With Hearts of Stone and Blood and Wine, it honestly feels like you’re getting an entire extra game. Hours upon hours of additional fun, new areas, new characters, and even more reasons why you wanted to do “just one more quest”… and suddenly it’s 3 AM.
Small downside:
Sometimes the gameplay turns into “Ride from ? to ? and clear 17 bandit camps along the way.” The grinding can occasionally get a bit annoying. But at least even riding around looks gorgeous.",True,2026-05-23 17:11:24,english,39204
The Witcher 3,RPG,"For those returning to the game because of the new DLC, remember, silver is for monsters and steel is for fools.",True,2026-05-27 12:33:14,english,15671
The Witcher 3,RPG,"ruchasz potwory, odcinasz głowy czarodziejką czego chcieć więcej",True,2026-05-17 10:33:55,polish,8858
The Witcher 3,RPG,"Советую
Дом это вовсе не то место, где можно закрыться на ключ.
Чтобы найти настоящий дом, иногда приходится пройти долгий путь
Ведьмак",True,2026-05-12 21:28:28,russian,3357
The Witcher 3,RPG,利维亚的杰洛特，布拉维坎的屠夫，女术士无情打桩机，无敌的白狼，却连2楼落下的伤害都承受不住，2cm火柴盒高度的水池岸都爬不上,True,2026-05-12 03:37:02,schinese,7892
The Witcher 3,RPG,"есть у этой замечательной игры один, но очень огромный, минус из-за которого хочется разбить компьютер, выпить гору снотворного со слабительным и больше никогда не быть онлайн - она рано или поздно заканчивается...
я старался своими силами решить эту проблему - оставлял основной сюжет на самый последний момент, выполнял все побочки, исследовал каждый сантиметр карты, купил сизон пасс...
но все бестолку - это лишь оттягивало неизбежный момент... момент, когда тебе теперь придется высыпаться, а ноут использовать для просмотра сериалов и фильмов... момент, когда ты захочешь стереть себе память, чтобы опять пройти эту игру. Это невыносимо настолько, насколько только может быть невыносима горечь потери чего-то личного.
Правильно Ольгерд и Гюнтер в Каменных сердцах сказали - бойся своих желаний, ведь они могут исполниться.
Люди, если вы не хотите делить свою жизнь на ""до"" и ""после"" (ведьмака) - не покупайте эту игру. Иначе потом своим внукам будете как последний старпер выносить мозг вечными маразмами по поводу ""какой годной игрой был ведьмак"" и что ""таких игр больше не делают"". Из-за чего в конце концов вас сдадут в дом престарелых (впрочем, и там вы всех достанете своими ностальгическими за*бами.",True,2026-05-28 12:02:29,russian,7194
The Witcher 3,RPG,"[b]Introduction :[/b]
The Witcher 3: Wild Hunt est un RPG en monde ouvert développé par CD Projekt Red, sorti en mai 2015. On y incarne Geralt de Riv, un sorceleur lancé à la recherche de Ciri, sa fille adoptive, traquée par la Chasse Sauvage. Adapté des romans d'Andrzej Sapkowski, c'est devenu une des références absolues du jeu de rôle moderne, multi-primé GOTY et toujours cité une décennie plus tard.

[b]Ce que j'ai aimé :[/b]
[list]
[*]📜 L'écriture des quêtes secondaires est sans équivalent dans le genre. Là où la plupart des RPG enchaînent les ""tuez 10 rats"", chaque quête de TW3 a une vraie histoire, des choix moraux gris et des conséquences souvent inattendues.
[*]🌍 Le monde ouvert est massif sans être vide : Velen, Novigrad, Skellige et Toussaint dégagent chacun une identité visuelle, sonore et culturelle propre. La direction artistique slave/médiévale est sublime.
[*]🎬 Les cinématiques d'introduction de chaque quête, combinées à un doubleur français impeccable pour Geralt, donnent une vraie épaisseur cinématographique à l'ensemble.
[*]⚔️ Le système d'alchimie, de signes magiques et de combat à l'épée offre une vraie profondeur tactique, surtout en difficulté Mort ou Gloire où préparer ses huiles et décoctions devient essentiel.
[*]🍷 Les deux extensions Hearts of Stone et Blood and Wine sont parmi les meilleurs DLC jamais sortis. Blood and Wine est même considéré par beaucoup comme un jeu à part entière qui dépasse certains AAA modernes.
[/list]

[b]Ce que j'ai moins aimé :[/b]
[list]
[*]🐴 La maniabilité de Roach, le cheval, est restée mémorable pour de mauvaises raisons : il se bloque dans le décor, s'arrête sans raison et la conduite est franchement perfectible.
[*]🖱️ L'interface PC a clairement été pensée d'abord pour manette. Le menu d'inventaire et les raccourcis claviers/souris sont peu ergonomiques, même après les patches.
[*]🤖 L'IA des humains en combat est nettement en dessous de celle des monstres : ils foncent en ligne droite et la difficulté s'effondre en fin de partie quand Geralt devient surpuissant.
[/list]

[b]Conclusion :[/b]
The Witcher 3 reste, dix ans après sa sortie, un sommet du RPG occidental. Son écriture, son univers et la liberté narrative qu'il offre n'ont quasiment pas pris une ride — la mise à jour next-gen gratuite a même prolongé sa pertinence. Quelques aspérités techniques persistent, mais elles sont vite oubliées face à la richesse de l'aventure. Si vous n'y avez jamais joué, c'est probablement le meilleur point d'entrée possible dans le RPG narratif moderne.

[b]Note :[/b] ★★★★★",True,2026-05-26 10:01:53,french,809404
The Witcher 3,RPG,"Отличная игра, сколько не играю люблю иногда заходить в нее да перепроходить заново.
Буквально единственная игра которую можно перепроходить миллион раз и тебе не надоест, да конечно боевка тут не такая прям вау, но все равно много разнообразия, магия тоже есть и даже несколько их, можешь играть как через магический билд так и через физический, или вообще алхимиком быть да бомбы раскидывать, боссы тут тоже вполне нормальные, не сложные и понятно как против них драться.
Классный сюжет да и персонажи живые, диалоги интересно слушать, ведь в большинства играх они кажуться какими то пустыми диалоги, 2 DLC так вообще шикарные, вообщем игра игра стоит внимания 
10/10 первая игра которую я ставлю такую высокую оценку и не просто так",True,2026-05-10 16:56:41,russian,31137
The Witcher 3,RPG,"""Se você tá procurando um mundo aberto gigante pra se perder, joga The Witcher 3. O mapa é absurdo de lindo, cheio de vilas, castelos, pântanos e segredos para descobrir. Você joga como um caçador de monstros, então tem que rastrear criaturas, usar magias e espadas. É um dos melhores mundos abertos já feitos.""",True,2026-05-27 23:43:50,brazilian,54607
The Witcher 3,RPG,Başlarda aşırı önyargılıydım ama bi anlık kararla seriye başlama kararı aldım ve witcher 2 aşırı hoşuma gitti dolayısıyla direkt bu oyuna başladım ve 100 saat nasıl gecti anlamadım bile. Herkes hayatında bir kere witcher serisini deneyimlemeli,True,2026-05-20 13:17:09,turkish,6149
The Witcher 3,RPG,"Probably one of my favorite games of all time. For how old the game is at this point it still looks great at the time of this review. The story is amazing, and even the side quests have more plot than main story missions in other AAA titles. The games makes you think critically, and not just assume things at face value, it is very easy to assume something is bad just because it is a monster, but you can talk to a lot of them and realize they're sentient in a lot of cases and not harmful to humans. You could easily go through the game just killing everything, but I really appreciate the nuance the game has when it comes to determining your enemy if you want to look into things more. Humans can often be more monstrous than some of the actual monsters throughout the game.",True,2026-05-21 23:21:14,english,9902
The Witcher 3,RPG,Oyun akıcı ve güzel hikayesi güzel ama basit bir taşa çıkmakda zorlanıyor karekterimiz parkur yapabilse daha güzel olurmuş onun dışında fazla eksiği yok,True,2026-05-10 14:53:31,turkish,1914
The Witcher 3,RPG,"Dios mio, que juegazo, no se ni que significa rpg pero esto es una obra maestra, tiene buenos graficos, bichos raros, monton de misiones y muchas mujeres potentes, eso es todo",True,2026-05-20 16:33:13,spanish,4439
The Witcher 3,RPG,战斗真是太拉垮了，前前后后玩了好几次都因为这个战斗没玩下去，极致的不跟手，索敌的视角也是一坨，只听说剧情很顶，但我又想亲身体验，不想看攻略了解剧情，这就很难受,True,2026-05-15 08:48:51,schinese,378
The Witcher 3,RPG,"I had played this game before and finished it, but it never truly clicked with me. So I decided to start a new save file, this time on a higher difficulty, with a commitment to fully immerse myself in every mechanic the game had to offer.

And boy, what a game.

The atmosphere is nothing short of fantastic. I could listen to the soundtrack for hours on end, and the visuals still look stunning for an 11-year-old game. The characters are genuine and memorable, starting with the protagonist himself, Geralt. Every quest feels meaningful and well-crafted, and I even developed a genuine love for Gwent, something that was completely absent in my first playthrough. By the end, I truly felt like a witcher.

10/10 — An Absolute Masterpiece.",True,2026-05-24 12:34:31,english,11472
The Witcher 3,RPG,"A game that puts its predecessors to shame. There is a massive leap forward in gameplay, graphics, and world-building compared to the first two games in the series. The introduction is far better as well; the prologue is short, sweet, and does a wonderful job at introducing all of the game mechanics and gets you up to speed on the story, something the previous game sorely lacked.

The world is massive and alive. Cities are densely populated, while the numerous villages, keeps, and smaller communities all have their own people and stories. With all these characters comes a wealth of side-quests, most of which are interesting and well written. If you are someone who likes to complete everything, Act 1 can be quite daunting, as you are dropped into the world with seemingly endless content, which adds significantly to the game’s length.

As with the previous games, the story is very well written and extremely well paced. “Tension” is the word I would use to describe it best, as it does a fantastic job keeping you hooked and invested. You can complete it in many different ways and in many different orders, and the developers have foreseen a lot of unpredictable and interesting routes you can take.

The new alchemy system is much better than in previous instalments. Once you craft a potion or oil, you only need to meditate to refill it. Crafting has also improved, but still felt a little tedious, especially towards the end of the game. Skills and mutagens allow you to customize your playstyle and it felt like there were very few filler unlocks.

Gone are the days of dice poker and the annoying RNG behind it, as it has been replaced with something far superior: Gwent. This card game can be like crack to the right person, and it was truly a joy collecting every card and building every deck. Alas, as you start to get further into the game, you can effectively solve Gwent, which detracts from the enjoyment. It still remains one of the greatest mini-games I’ve ever encountered in an RPG.

The DLC deserve their own reviews, but I will briefly mention them here:
[list]
[*] Hearts of Stone is a small, but thrilling story with a lot of surprises and had me swinging like a pendulum when picking sides. The return of an old friend was great and certainly adds a lot if 	you are a longtime fan of the games.

[*] Blood & Wine is a truly masterful DLC in a beautiful setting. In my opinion, the story surpasses the base game, and the side content is great as well. The player housing is a great touch and finally gives Geralt a place to call home.
[/list]
Overall, I am not sure why I waited so long to play this game. Even over ten years later, it holds up remarkably well and stands out as one of the greatest RPGs of all time.

[b]10/10[/b]",True,2026-05-20 00:45:41,english,8979
The Witcher 3,RPG,"По правде говоря, за все время пытался пройти игру раза 4 наверное, только 5 попытка прохождения стала той самой, пожалуй одна из лучших игр в которые я играл за всю свою жизнь. В ней прекрасно все, диалоги, боевка, сюжет. Если вы еще не проходили Ведьмака, вы многое упускаете. Однозначно рекомендую к прохождению, игра не просто так считается легендарной",True,2026-05-27 18:24:23,russian,5688
The Witcher 3,RPG,"Simplesmente não tenho palavras para descrever o carinho que tenho por esse jogo, sem dúvidas é o meu favorito de todos os tempos. O jogo atualmente já tem mais de 10 anos de lançamento e continua me surpreendendo, cada vez que jogo novamente descubro algo novo e tenho um pequeno vislumbre da minha primeira jogatina. Eu poderia dizer que gosto do jogo pelos personagens e lore cativantes, pelo belo mundo aberto, pela trilha sonora, pelo GWENT ou pela exploração recompensadora. Mas a verdade é que acompanhar o bruxão nas suas aventuras e sentir o peso de cada escolha me conectou com o jogo como nunca antes havia acontecido. Sei que existem muitas críticas sobre a mecânica de combate, nado, etc. Mas eu não poderia de forma alguma deixar de recomendar essa pérola e, mesmo que minimamente, poder influenciar alguém a ter uma experiência com essa obra prima.🐺❤️",True,2026-06-03 21:03:35,brazilian,2808
