game_name,game_genre,review,voted_up,timestamp_created,language,playtime_forever
The Witcher 3,RPG,"Jogo bom pra crlh, principalmente para quem gosta de história, escolhas e mundo aberto.

O jogo tem muitas missões interessantes, e várias delas parecem tão bem feitas quanto a história principal. As escolhas que você faz realmente importam e podem mudar o rumo de algumas situações.

O mundo é grande, bonito e cheio de lugares para explorar, monstros para enfrentar e personagens marcantes. O Geralt também é um protagonista muito bom, com um jeito sério, mas ao mesmo tempo carismático.

No começo, a jogabilidade pode parecer um pouco confusa, principalmente por causa dos menus e sistemas do jogo. Mas depois que você se acostuma, a experiência fica muito melhor.

Na minha opinião, The Witcher 3 é um dos melhores RPGs já feitos. Vale muito a pena para quem gosta de uma história forte e de passar muitas horas explorando.",True,2026-06-07 05:10:12,brazilian,6536
The Witcher 3,RPG,"The best game of all time, period. Still offering new expansion 10 years after launch is bonkers.",True,2026-06-07 04:23:20,english,34780
The Witcher 3,RPG,"⭐⭐⭐⭐⭐ Obra-prima dos RPGs

The Witcher 3: Wild Hunt é, sem dúvida, um dos melhores RPGs já criados. A jornada de Geralt de Rívia oferece uma combinação quase perfeita entre narrativa, exploração, combate e desenvolvimento de personagens.

O mundo aberto é gigantesco, vivo e repleto de atividades interessantes. Diferente de muitos jogos do gênero, até mesmo as missões secundárias possuem histórias bem escritas, personagens memoráveis e escolhas que realmente fazem o jogador refletir sobre suas decisões.

A ambientação é fantástica, com cenários impressionantes, trilha sonora marcante e uma atmosfera medieval sombria que prende a atenção do início ao fim. A exploração é extremamente recompensadora, sempre existindo algo novo para descobrir em cada canto do mapa.

O sistema de combate é divertido e estratégico, exigindo o uso correto de espadas, sinais, poções e óleos para enfrentar monstros e inimigos cada vez mais desafiadores. Além disso, a progressão do personagem permite criar diferentes estilos de jogo.

Outro destaque são as expansões Hearts of Stone e Blood and Wine, que possuem qualidade comparável — ou até superior — a muitos jogos completos disponíveis no mercado.

Mesmo anos após seu lançamento, The Witcher 3 continua sendo uma referência para a indústria dos videogames. Uma aventura emocionante, repleta de personagens inesquecíveis, escolhas impactantes e momentos épicos.

Recomendado para qualquer fã de RPG, fantasia medieval e histórias bem contadas. Uma verdadeira obra-prima. 🐺⚔️🍷",True,2026-06-07 03:42:56,brazilian,29435
The Witcher 3,RPG,"simplesmente melhor jogo já feito, Geraldão é foda quer cmer geral",True,2026-06-07 02:02:48,brazilian,2864
The Witcher 3,RPG,"Peak game, i suck a gwent though so it loses 1 point for that. 9/10 in terms of gameplay, modding capabilities honestly a 10/10, graphics are good, optimisation is also a 9/10 and the quests are good, only issue(s) i have are minor ones like using witcher senses slowing you down or movement being jank. overall a 9/10 game or a 10/10 if my device was good lol.",True,2026-06-07 01:33:20,english,3251
The Witcher 3,RPG,"My favorite open world story game so far. The setting, the characters, the world, the atmosphere, the soundtrack, etc. is just one of the best of its kind. What sets this game apart from other bangers like rdr2 for me is especially the setting and the world. The moment you enter Velen for the first time, the game just keeps going with fascinating and captivating the player. Every inch of this world is so enjoyable to explore and astonishing on its own and the story.... oh the story. The main quest is beautifully written and just never gets boring. it might be a bit complicated when you are not familiar with the world of the witcher and its previous parts but let me ensure you, you still can play this gem completely blind. It basically can be considered a stand-alone title. Besides the main story, even the completely optional side story are better then most main storyline in other games. The Questline of the Bloody Baron is up until today a dear memory of mine since its so complex and really shocked me. It left me there sitting like ""♥♥♥♥♥♥♥♥♥, was this the right decision?"" So yeah, if you havent played this Masterpiece and deserved GOTY yet, what are you wating for. They could even demand 60 and i would still gladly buy it. And by the way. the 2 dlcs are a MUST BUY. so get the GOTY edition and not the standard one. Especially Blood and Wine itself is as big as a whole new game and adds a totally unique new storyline as mysterious and captivating like the rest. GET THE GAME!!!!!!!!!!!!!!!!",True,2026-06-07 01:32:27,english,8648
The Witcher 3,RPG,"Primeira vez no pc, mas não é a primeira vez no jogo. Tendo platinado 2x no playstation e em busca de todas as conquistas na steam.

Não tem o que dizer sobre, só uma dos melhores games RPG da década. tem tudo que você precisa e imagina na pele do bruxo Geralt. Jogão!!!",True,2026-06-07 00:32:19,brazilian,1123
The Witcher 3,RPG,"Лучшая игра десятилетия, скорее всего даже за все время. Отличный сюжет, подогревающий длительный интерес к игре и постоянно держащий в предвкушении ""что же будет дальше?"". Настолько прекрасно проработаны персонажи, что даже нпс чувствуются ""живыми"". Постоянные шутки от главных и второстепенных персонажей, ирония, сарказм. В целом, считаю, что персонажи в этой игре являются одним из ее главных достоинств. Я не видел игры, в которой настолько хорошо будут проработаны персонажи. Атмосфера во время игры вообще заслуживает отдельной статьи.  Шедевральная музыка, прекрасно подходящая под атмосферу, персонажей, события. После 4.0 картинка стала великолепной, способна потягаться со многими современными проектами в плане графики. Огромное множество выборов на протяжении игры на вкус и цвет каждого - от ведьмака-пацифиста до ведьмака-геноцидника. Возможность ""одевать"" Геральта как захочешь: хочешь, чтобы он ходил в шмотках с нпс - пожалуйста; хочешь собрать один из кучи сетов - пожалуйста. Также множество билдов на вкачку умений на Геральта: маг, алхимик, воин, всевозможные миксы. Помимо основного сюжета отлично проработаны доп. задания и ведьмачьи заказы, многие из которых не дадут заскучать, если захочешь разбавить сюжет. Куда же без всеми любимого гвинта, хоть сиди с каждым попавшимся играй. Возможность нажраться, посетить бордель, переспать с кучей чародеек, постоянный мат являются ко всему перечисленному приятным бонусом. Даже не знаю, что сказать о длс, они просто прекрасны. 2 дополнительные интереснейшие истории, которые некоторым зайдут даже больше, чем основная сюжетка. В общем и целом, эта игра стоит каждую потраченную на нее копейку даже без скидок. Игра, которую хочется перепроходить снова и снова. Даже если ее оставить на время, вернувшись в ведьмака, можно снова засесть за компом на неделю, играя только в этот шедевр.",True,2026-06-06 22:54:42,russian,12707
The Witcher 3,RPG,"Genuinamente de mi tipo de juegos favoritos. Encontré misiones que me hicieron carme de culo con los desenlaces. Encontré NPCs que genuinamente hacen lo que dicen, me jugué 2 veces las mismas misiones para ver sus resultados distintos y les juro que es una completa locura.
El nivel de detalle de las armaduras hasta me dejó sorprendido, te podes quedar viendo a tu Geralt simplimente por lo fachero que le quedan las armaduras. 
Por favor, si se lo pueden permitir, jueguenlo si les gustan los mundos de fantasía.",True,2026-06-06 22:21:49,spanish,11665
The Witcher 3,RPG,"One of the best games I have ever played. I have never been more immersed in a story than when I was playing Witcher 3. The main story is great, but I would argue that the side quests and contracts are even better. There are memorable characters all over, and your choices through the story affect how they interact with you. This also includes the different creatures and monsters, all of which have interesting lore that often is inspired by real folklore. Besides the story and the world, the combat is also pretty fun, and it gives you several playstyles to choose from. This is just describing the main game, but the DLCs are EVEN BETTER! 

Buy it all and thank me later!",True,2026-06-06 22:19:53,english,12409
The Witcher 3,RPG,"The Witcher 3 é, para mim, a melhor história já feita em um videogame. E não estou falando apenas da campanha principal, mas também das missões secundárias, que são tão bem escritas e desenvolvidas que muitas vezes parecem fazer parte da história principal.

Cada personagem tem personalidade, cada escolha tem consequências e cada missão consegue prender sua atenção de um jeito diferente. É impressionante como até as tarefas mais simples possuem uma narrativa envolvente e memorável.

O mundo do jogo é vivo, rico em detalhes e cheio de histórias para contar. Você começa uma missão achando que será algo rápido e, de repente, está envolvido em uma trama tão interessante quanto a campanha principal.

Poucos jogos conseguem alcançar o nível de escrita, construção de personagens e narrativa que The Witcher 3 apresenta. Para mim, ele continua sendo uma referência quando o assunto é contar uma boa história nos videogames.

Simplesmente uma obra-prima. 🐺⚔️🎮",True,2026-06-06 22:01:35,brazilian,6424
The Witcher 3,RPG,I liked the card game gwent inside the normal game. It gives it another dimension.,True,2026-06-06 21:42:10,english,1502
The Witcher 3,RPG,"Playing this for the first time, more then ten years after release and I think it's one of, or maye THE best game i've played!",True,2026-06-06 20:49:24,dutch,2824
The Witcher 3,RPG,剧情还行 动作手感是真不行 勉强给好评吧,True,2026-06-06 19:40:37,schinese,5907
The Witcher 3,RPG,"Um RPG de mundo aberto q ficou pra historia. Entra no game disposto a aprender e a curtir a historia q vc vai amar. O combate é muito bom, tem uma boa variedade de monstros, mundo vivo e muito lindo!
Dito isso, único bruxo mais fod4 q o Geralt é o Ronaldinho gaucho.
Vamos Carpeadoo!!",True,2026-06-06 16:02:29,brazilian,5719
The Witcher 3,RPG,"Ein fantastisches Spiel! Die Grafik ist verdammt gut und das Entdecken der Welt macht riesigen Spaß. Besonders toll ist es, in die Geschichte von Geralt einzutauchen. Eine schöne, abenteuerlastige Geschichte, die man einfach erleben muss. Ein wahres Erlebnis.",True,2026-06-06 15:28:00,german,4387
The Witcher 3,RPG,"Well. My first ever singleplayer game (simulator games not included) to reach 50 hours. And yeah it was great. The game came out in 2015 so one feels its age, it is janky, you will get frustrated, the horse is even worse at time, and the combat is okay, not good, not bad just okay. But where the game ironically shines is the visuals and the environments, how a 11 year old game can look so good made me speechless. You have a massive map one that would take 100+ hours to fully explore, it stays fresh mostly, and ofcourse 2 expansion packs. I just finished the base game (51.2 hours it took me) , I'm jumping to Clair Obscur: Expedition 33 and Cyberpunk 2077 now, but best believe I WILL BE BACK TO COMPLETE THE EXPANSIONS. ONE THING WHERE THIS GAME DOES SHINE AND WHAT CARRIES IT ULTIMATELY IS THE STORY ITS SO DAMN GOOD. 36 Diff endings technically but with the main characters about 7. Anyways I digress, if you enjoy open world games with a very very good story, choices that matter, and a massive and beautiful world filled with content and are fine dealing with the jankiness any 11 year old game will suffer off, and the combat, which although not amazing I did like it, then be my guest. This game will not dissapoint!",True,2026-06-06 15:13:34,english,2843
The Witcher 3,RPG,战斗手感很一般，剧情有点意思。,True,2026-06-06 13:10:29,schinese,494
The Witcher 3,RPG,买了这么多年 一直没通关，再次重新玩。。。,True,2026-06-06 12:47:07,schinese,1209
The Witcher 3,RPG,银剑斩妖魔，钢剑除奸恶，当然，白狼有三把剑,True,2026-06-06 12:30:50,schinese,5538
The Witcher 3,RPG,小时候玩的盗版，配置不太好用着二十帧的最低画质玩了不知道几个周目，现在大学依然玩。伟大无需多言。,True,2026-06-06 12:05:53,schinese,5046
The Witcher 3,RPG,Gerçekten efsanevi bir oyun tüm görevlerleriyle dlcleriyle 2 kere bitirdim yapanların eline emeğine sağlık witcher 4 çıkmaya yakın bidaha başlarım.,True,2026-06-06 11:35:16,turkish,14074
The Witcher 3,RPG,好玩，记得看剧情，不看剧情少一半的乐趣，三个平台都玩所以游戏时长少,True,2026-06-06 11:33:56,schinese,4597
The Witcher 3,RPG,谁能想到2015年的游戏还能免费更新此时代版，更令人惊喜的是后续还会推出全新dlc，露就秒好吧。对每一部产品都如此上心的游戏公司应该唯独CDPR一家吧。,True,2026-06-06 11:04:44,schinese,2817
The Witcher 3,RPG,巫师三最吸引我的是沉浸感 我喜欢选择不同选项带来不同结局的感觉 看到最后杰洛特和希里在白乌鸦葡萄园的树下聊着猎魔人的委托[spoiler]ps：要是维瑟米尔也在就好了[/spoiler]  女爵姐妹重归于好 这就是我心中的完美结局 血与酒>石之心>本体 期待要出的新dlc,True,2026-06-06 11:03:31,schinese,4949
The Witcher 3,RPG,"Un des meilleurs jeu que j'ai fait, le jeu en monde ouvert avec la meilleure narration selon moi. Je l'ai fait avec ses dlc (qui sont a eux seuls quasiment un jeu a part entiere) a sa sortie. je le refait 10 ans apres c'est toujours aussi genial (seul le systeme de combat a un peu vieilli mais ca passe encore) et les devs annoncent un nouveau dlc pour 2027? ce jeu est genial.",True,2026-06-06 10:23:38,french,4595
The Witcher 3,RPG,"Nice story and gameplay, i strongly recommend",True,2026-06-06 10:12:13,english,4129
The Witcher 3,RPG,"This is not just my favorite RPG. This is probably my favorite game, period.

The world is ridiculous in the best way. You ride into some muddy village thinking you’ll clear one tiny question mark, and three hours later you’re dealing with a cursed family drama, a monster with better lore than most main villains, a morally impossible choice, and somehow a quick round of Gwent because apparently Geralt has time for cards while the world is falling apart.

That’s what makes it special. The side quests don’t feel like filler. They feel like short stories with real characters, ugly choices, and endings that don’t always let you feel clean. The world is beautiful, sad, funny, cruel, and alive. Velen, Novigrad, Skellige, Toussaint — every place has its own mood, music, problems, and people you remember.

Geralt is also one of the best main characters in games. Tired, dry, dangerous, secretly soft, and constantly dragged into everyone else’s terrible life decisions. The writing, music, atmosphere, monsters, DLCs, and little quiet moments all come together into something that still feels huge and personal at the same time.

I love this game. Not “yeah, it’s good” love. More like “I was supposed to do one quest and now it’s 3 AM and I’m emotionally attached to a horse, a bard, and a deck of cards” love. Absolute masterpiece.",True,2026-06-06 10:05:05,english,613
The Witcher 3,RPG,"Прекрасная игра с прекрасной историей. Тут всё: и посмеяться, и в осадочек выпасть.

«У Меча Предназначения два острия... Одно из них - ты. Другое - смерть.»",True,2026-06-06 09:22:15,russian,5843
The Witcher 3,RPG,"Ich habe das Spiel extra auf Steam gekauft um nochmal alle Trophäen erspielen zu können, nachdem ich schon 100% auf Playstation und auf GOG habe. Bin ich verrückt? Klar, aber der Witcher 3 ist einfach eines der besten Spiele aller Zeiten.",True,2026-06-06 08:40:36,german,702
The Witcher 3,RPG,Jogo Fantástico mal comecei e já estou curtindo muito pretendo jogar por muito tempo,True,2026-06-06 05:50:36,brazilian,633
The Witcher 3,RPG,"Wow! I sat on this game too long. Everyone who recommended it that I thought was annoying about it was 1,000% correct. Huge Gwent fan ... who knew?",True,2026-06-06 05:14:28,english,1761
The Witcher 3,RPG,情节吸引，动作流畅，世界宏大，体验优秀。,True,2026-06-06 04:33:09,tchinese,3312
The Witcher 3,RPG,现在玩了几个小时感觉还不错，我是玩完了天国拯救1和2的，感觉巫师和他们有些像，自由度也挺高，不错,True,2026-06-06 02:04:47,schinese,889
The Witcher 3,RPG,Played the game for almost 9 hrs currently. Legendary. Pretty sure I am still about 300 hrs to go based on the sheer size of the map and the quality of the quests. :🗺,True,2026-06-05 23:12:20,english,517
The Witcher 3,RPG,"Got The Witcher 3 when it was only like 10 euros (including the Hearts of Stone and Blood and Wine expansion)

Honestly one of the best games I have played so far. Great story (with important decision making), graphics, music, playability, etc...

Haven't played in other difficulties other than Normal, but can say it gives the player a decent challenge without compromising the story.

Overall would recommend it to anyone. 

9/10",True,2026-06-05 18:18:00,english,7859
The Witcher 3,RPG,剧情党狂喜，任务设计很到位，通过不断的做地图任务，可以透彻的了解故事背景，也使玩家能够很好的代入到游戏中来，爱不释手喽,True,2026-06-05 18:12:37,schinese,1871
The Witcher 3,RPG,"ci sto giocando dopo anni e anni dall'uscita ma stupisce ancora, niente da dire capolavoro apparte per alcuni bug col cavallo e con l'immersione in acqua ma il resto è uno spettacolo. unica pecca per le lunghe può diventare noioso e far passare la voglia di giocarci.
in conclusione ultra consigliato anche dopo 11 anni.",True,2026-06-05 18:12:12,italian,4959
The Witcher 3,RPG,只要被那相当烂的战斗手感调教后就好玩了，主线支线人物塑造都不错捏,True,2026-06-05 17:08:28,schinese,4497
The Witcher 3,RPG,"Лучшее детище своего года , насколько история мрачная, настолько она и захватывающая",True,2026-06-05 16:37:19,russian,4233
The Witcher 3,RPG,"At first I want to point out, how beautifully detailed this game is. For example I was incredibly astonished that a rescued archer of a quest was suddenly an ally in the endgame. (I don’t want to spoiler more…) 

In fact every decision has an impact to the course of the game. I would therefore recommend making decisions thoughtfully and at times with empathy. Just because I harmed a character, that decision meant a particular quest wasn’t even available to begin with, and I was therefore denied an achievement. For that reason, I’ve decided to start the game from scratch for the third time.

Although I’m already completed the story, it’s still exciting to start afresh. After all, the game offers a variety of playstyles based on the character’s development. Plus, when starting a new game, you can of course choose a school of sorcery you’re not yet familiar with.

I wish especially the newer players a lot of fun, exploring this breathtaking open world of this never getting old masterpiece as I did.",True,2026-06-05 16:04:28,german,21752
The Witcher 3,RPG,"Игра супер. Давно видела обзоры, отзывы, видео об этой игре. Решилась купить в прошлом году в марте, и до сих пор не оттянуть за уши. Просто сок. Книги тоже все прочитала, открытый мир, разные обширные квесты, много персонажей, которым можно посочувствовать (Кровавый барон в моем случае). Конечно же гвинт, из-за которого Цири отошла на второй план, но конечно достижения с ним полный геморрой. Трисс/Йеннифэр? - Йен.",True,2026-06-05 15:03:56,russian,17505
The Witcher 3,RPG,"清朝画质
每次开都有missing content
虽然女主真好看但是真没法玩",False,2026-06-05 14:17:00,schinese,113
The Witcher 3,RPG,"⚔️ MISTROVSKÉ DÍLO, KTERÉ NEMÁ KONKURENCI ⚔️

CZ - Zaklínač 3: Divoký hon je pro mě absolutní srdcovka a dost možná nejlepší hra, jakou jsem kdy hrál. Svět, který CD Projekt RED vytvořil, vás kompletně pohltí. Příběh Geralta z Rivie je napsaný tak geniálně, že i obyčejné vedlejší úkoly mají lepší děj než celé jiné hry. Postavy jako Yennefer, Ciri nebo Triss vám přirostou k srdci a na tenhle zážitek jen tak nezapomenete.

A co se týče DLC (Srdce z kamene / O víně a krvi)? To nejsou jen nějaké levné přídavky. Jsou to v podstatě celé další hry, které kvalitou a atmosférou (zejména pohádkový Toussaint) posouvají laťku ještě výš.

Tuhle hru by si měl zahrát povinně každý, kdo to s hraním myslí vážně. Chytlo mě to natolik, že jsem v tom nechal kus života a pokořil všech 78 achievementů na 100 %. 10/10 a dal bych i víc, kdyby to šlo.

⚔️ A MASTERPIECE THAT HAS NO EQUAL ⚔️

ENG - The Witcher 3: Wild Hunt is an absolute masterpiece and quite possibly the best game I have ever played. The world that CD Projekt RED created completely consumes you. Geralt of Rivia's story is so brilliantly written that even simple side quests have better plots than entire other games. Characters like Yennefer, Ciri, or Triss will truly grow on you, and it's an experience you won't easily forget.

And as for the DLCs (Hearts of Stone / Blood and Wine)? These aren't just cheap add-ons. They are basically entire new games that push the bar even higher with their quality and atmosphere (especially the fairytale-like Toussaint).

This game is a must-play for anyone who takes gaming seriously. I loved it so much that I dedicated a huge chunk of my time to it and unlocked all 78 achievements for a 100% completion. 10/10, and I’d give it more if I could.",True,2026-06-05 13:38:11,czech,15618
