game_name,game_genre,review,voted_up,timestamp_created,language,playtime_forever
The Witcher 3,RPG,"The Witcher 3: Wild Hunt
Ein Meisterwerk, das die Zeit einfach nicht kennt.

Es gibt Spiele, die man spielt. Und dann gibt es Spiele, die man erlebt. The Witcher 3 gehört eindeutig zur zweiten Kategorie, und das auch noch mehr als ein Jahrzehnt nach seinem Release.

Was mich bis heute am meisten beeindruckt: Die Welt. Nicht die Größe allein, denn offene Welten gibt es viele. Sondern wie verdammt lebendig sich alles anfühlt. Novigrad mit seinen engen Gassen und dem Geruch nach Verrat in der Luft. Die kargen Sümpfe von Velen, wo Krieg und Armut in jedem NPC-Gesicht ablesbar sind. Skellige, das sich anfühlt wie ein nordischer Traum, der jeden Moment zum Alptraum werden kann. Jede Region erzählt ihre eigene Geschichte, bevor überhaupt ein Wort gesprochen wurde.

Grafisch ist das Spiel bis heute eine Schönheit. Gerade mit den modernen Patches und Next-Gen-Updates sieht Geralt von Riva immer noch besser aus als viele Spiele, die dieses Jahr erschienen sind. Sonnenuntergänge über dem Meer bei Skellige, Gewitterstürme über den Feldern von Velen, nachts der Blick auf einen erleuchteten Novigrad von weitem. Das alles hat etwas fast Malerisches.

Das Gameplay macht ebenfalls einfach Spaß. Das Kampfsystem ist flüssig, die Alchemie belohnt Neugier, und das Zeichen-System gibt dem Kampf Tiefe ohne ihn zu überladen. Wer auf Schwierigkeit spielt, merkt schnell: hier denkt man lieber kurz nach, bevor man einfach draufhaut.

Und dann die Geschichte. Geralt sucht Ciri, ein simples Fundament, auf dem CD Projekt Red eine der emotionalsten, komplexesten und moralisch grauesten Storys gebaut hat, die das Medium je gesehen hat. Keine klaren Gut-Böse-Grenzen, keine einfachen Entscheidungen. Jede Wahl hat Gewicht, und man merkt das oft erst viel später.

Wer The Witcher 3 noch nicht gespielt hat, dem fehlt schlicht etwas. Und wer es schon kennt, der weiß genau wovon ich rede.

Klare Empfehlung. Kein Wenn und Aber.",True,2026-06-07 20:19:19,german,5240
The Witcher 3,RPG,"很好玩，剧情很好，但需要耐心和细心才能顺利玩下去，不然容易卡任务。
战斗方面有很多流派，成型了后打最高难度都很简单。
全成就难度比较高，建议通关后控制台解锁。",True,2026-06-07 17:00:42,schinese,14566
The Witcher 3,RPG,"Nigdy nie ograłem żadnej gry 2 razy aż do teraz, i pomimo że 
   nadal nie moge znalezc wszystkich kart do gwinta
   skelige to dla mnie teren wroga po speedrunie głównej fabuły w tej części mapy
   a baron na moją pomoc nie może narzekać (kmwtw hehe)
i fakt ze nie zmieniam wyborów to jednak te widoki mają coś w sobie a sama historia siedzi w głowie tak mocno ze chce się ją odtworzyć jeszcze raz. Piękne 8/10 bo mało nagich kobitek.",True,2026-06-06 23:41:17,polish,5518
The Witcher 3,RPG,"Оцінка: 10/10 (Шедевр на всі часи)

Знаєте це особливе відчуття, коли після фінальних титрів ти просто сидиш перед монітором у повній тиші, дивишся на головне меню і не знаєш, як жити це ігрове життя далі? Саме це зараз відбувається зі мною. Я вперше в житті пройшов «Відьмак 3: Дикий Гін» разом із двома масштабними доповненнями, і тепер офіційно оголошую себе затятим фанатом цієї гри.

120+ годин пролетіли як одна мить. Я пройшов шлях від засніжених скель Скелліге та брудних боліт Велена до сонячних, наче зітканих зі казок, долин Туссенту. І кожна хвилина цього часу була варта того.

Чому ця гра зобов'язана бути у вашій бібліотеці:

Сюжет та квести, які змінюють стандарти: Тут немає банальних завдань «принеси-подай». Навіть другорядні замовлення на монстрів чи випадкові зустрічі на дорозі мають таку драматургію, якої немає в більшості сучасних ігор у головному сюжеті. Історія тримає в напрузі до останнього кадру, а персонажі стають рідними.

Світ, у який віриш: Він живий, брудний, жорстокий, але водночас неймовірно красивий. Музичний супровід — це окремий вид мистецтва. Слов'янські мотиви та епічні бойові теми створюють таку атмосферу, що ти буквально шкірою відчуваєш прохолоду туссентського вечора чи туман Велена.

Доповнення, які кращі за окремі ігри: «Серця з Каменю» та «Кров і Вино» — це не просто DLC, це монументальні шедеври. Перше дарує неймовірну, глибоку та філософську історію з геніальними антагоністами, а друге — красиве, грандіозне прощання з Білим Вовком, яке залишає напрочуд теплий та затишний посмак.

Мій вердикт:
Якщо ви, як і я колись, чомусь відкладали знайомство з цією історією — не повторюйте мою помилку. Це не просто RPG, це еталон ігрової індустрії. Гра дарує унікальне відчуття пригоди, де кожне твоє рішення має реальні, іноді дуже важкі та непередбачувані наслідки.

Тепер, коли мій Геральт нарешті знайшов свій заслужений спокій, я точно знаю, що ще не раз повернуся на цей Відьмацький Шлях. Браво, CD Projekt RED. Це було незабутньо!",True,2026-06-06 16:04:09,russian,7573
The Witcher 3,RPG,"What an incredible work of art. For a ten year old game, the immersion, story telling and game world still destroys so many modern games.",True,2026-06-06 14:36:22,english,1716
The Witcher 3,RPG,"オープンワールドの絶対的金字塔であることはもはや圧倒的自明の理
圧倒的な世界観、圧倒的な音楽、圧倒的なマップ造形、圧倒的なキャラデザ、圧倒的なエフェクト、優れた戦闘システムに圧倒的なデザイン、全てが高水準にまとまった過去類をみない程のＲＰＧ
なにより驚きなのは圧倒的なストーリー分岐であり、サブクエストでの行動ひとつが世界を捻じ曲げ、己の運命を先変万化させる力を持つと言える
モンスター及びキャラクター造形に関しても並外れた完成度であり、中世ダークファンタジーという泡沫の夢を圧倒的な表現力をもって我々の視覚、聴覚、嗅覚、味覚、触覚、さらには第六感にまで感じさせるパワーを創り出している
自身に眠る獅子の鼓動を呼び覚まし、広大無辺の夢想郷を開拓したいのならばぜひ一度手に取ってほしいと願う",True,2026-06-04 18:11:15,japanese,5332
The Witcher 3,RPG,"GOAT. 
It may take you a while to get into the combat and physics of the game BUT when it clicks, it really clicks!
This game will not only have an expansion releasing 12 years after it's release, BUT even with that hype aside, the current expansions and the sale prices you can get it for is a no-brainer.",True,2026-06-04 07:28:28,english,4717
The Witcher 3,RPG,"สารภาพตามตรงนะตอนเริ่มเล่น The Witcher 3 ใหม่ๆ กูยังไม่เข้าใจเลยว่าทำไมคนเขาถึงอวยเกมนี้กันนักหนาว่าดีอย่างนั้นดีอย่างนี้ เล่นไปช่วงแรกก็รู้สึกเฉยๆ แถมยังขัดใจสุดๆ กับเรื่อง NPC หน้าซ้ำ! โดยเฉพาะพวก NPC ที่มีเควสหรือตัวละครที่เราต้องไปสนทนาด้วยเนี่ย หน้าตาดันซ้ำกันชิบหาย คนที่ชอบจำหน้าตัวละครคู่กับชื่อแบบกู บอกเลยว่าสับสนโคตรๆ บางทีตัวนี้หน้าเหมือนตัวนู้น คนนั้นหน้าเหมือนคนนี้ เล่นไปงงไปจนแทบจะถอดใจ (ส่วนไอ้พวก NPC ขยะที่เดินไปเดินมาไม่มีบทพูด อันนั้นกูหยวนๆ ให้ไม่นับละกัน)""แต่ก็นั่นแหละ พอเล่นไปเรื่อยๆ จนเข้าสู่ช่วงกลางเกมไปจนถึงช่วงเรทเกม ความคิดกูก็เปลี่ยนไปว่ะ! พอกลไกทุกอย่างมันเริ่มทำงาน เควสที่วางไว้มันเริ่มเผยปมที่เข้มข้นจนกูถึงบางอ้อว่าทำไมคนถึงยกย่องเกมนี้กันนัก มันไม่ใช่แค่เกม แต่มันคือการผจญภัยที่บีบคั้นอารมณ์และตรรกะสุดๆ""สรุปสั้นๆ ให้ฟังคือ: เกมนี้ดีจริงแบบที่เขาอวยกัน แต่อย่าถามหาความหลากหลายของใบหน้า NPC โดยเฉพาะตัวที่มีบทบาทสำคัญหรือมีเควสให้ทำ เพราะจุดตายเดียวของเกมนี้คือหน้าตาที่ซ้ำกันจนน่าหงุดหงิด ถ้าใครเป็นคนประเภทที่ชอบจำหน้าจำชื่อตัวละครแบบกู เตรียมใจไว้เลยว่ามีสับสนกันบ้าง แต่ถ้าผ่านจุดนี้ไปได้ จะเข้าใจเลยว่าทำไมเกมระดับตำนานตัวนี้ถึงครองใจคนได้ทั้งโลก",True,2026-06-03 04:30:52,thai,9070
The Witcher 3,RPG,The best RPG ever made. Runs really good on my laptop with 1080p-120fps and 1440p-60-90fps with  AI upscaling.,True,2026-06-02 21:38:47,english,248
The Witcher 3,RPG,"O melhor jogo que ja joguei na minha vida, atmosfera , historia, personagens, porr jogo unico demais, zerei 3 vezes pirata e comprei o game para zerar de novo,a espera da nova expansao para sentir aquele momento unico novamamente",True,2026-05-31 22:46:52,brazilian,11205
The Witcher 3,RPG,"До сих пор лучшая игра, в которую когда-либо играл. Все еще помню впечатления от игры, играя на слабом компе. Здорово, что анонсировали новое ДЛС - повод перепройти игру",True,2026-05-30 13:28:04,russian,3297
The Witcher 3,RPG,"The Witcher 3: Wild Hunt is one of the greatest RPGs ever made. The world feels alive, every choice matters, and even the side quests are written better than most full games. Playing as Geralt never gets boring thanks to the amazing characters, dark fantasy atmosphere, and emotional storytelling.

The open world is massive and beautiful, filled with monsters, secrets, and unforgettable moments. The soundtrack is incredible, the DLCs are basically full games on their own, and the writing makes you care about even small characters you meet for only a few minutes.

Combat can feel a little clunky at times, especially compared to newer action RPGs, but the story and exploration easily make up for it. If you enjoy games with deep lore, meaningful choices, and hundreds of hours of content, this is a masterpiece you shouldn’t miss.

10/10 — A legendary RPG that sets the standard for open-world storytelling.",True,2026-05-29 11:59:33,english,2586
The Witcher 3,RPG,ця гра поглинає своєю атмосферою життя відьмака . І у неї хочеться грати годинами бо історія надто інтересна і світ цікаво досліджува.,True,2026-05-28 17:55:43,ukrainian,563
The Witcher 3,RPG,"This is the second time I've played this game, because the first time I didn't understand it narratively, in an Open World it has the well-known Formula of Ubisoft games, I don't like the game mechanics, they are quite old for 2026, but the Campaign and the Fantasy world combined with the RPG are some of the best things there are!",True,2026-05-28 14:29:51,greek,9823
The Witcher 3,RPG,"Hru jsem dohrál několikrát na Playstationu, GOGu a teď tady na Steamu. Je to hra, co se dá hrát pořád a každý gamer by si ji měl zahrát. Pokud to uvidíš ve slevě za 10 éček tak ani neváhej a rovnou to dej do košíku :-)
+ Polský dabing je ultimatní :) a k Zaklínači patří.

Enjoy",True,2026-05-28 09:31:36,czech,6651
The Witcher 3,RPG,"[h1]That's Why He's The Goat[/h1]
I had already played The Witcher 3 years ago on console, but coming back now to fully complete it and go for the platinum was a completely different experience. After the next-gen update, the game still looks incredible for something that originally came out in 2015. The atmosphere, cities, forests, soundtrack, characters… everything still feels top tier even today. It’s one of those games where you start a random side quest and end up completely invested in it.

The world feels alive all the time, and that’s what makes the game so special to me. The characters are memorable, the writing is amazing, and even after so many years it still does things better than a lot of modern RPGs. (Geralt is that guy)

The DLCs are masterpieces too. Hearts of Stone is excellent, but Blood and Wine is honestly on another level. Easily one of the best expansions I’ve ever played. After finally taking the time to experience everything the game had to offer, I can easily say this is one of the GOATS, really excited for the newly announced DLC and also for The Witcher 4 with Ciri.",True,2026-05-28 01:43:56,english,13049
The Witcher 3,RPG,"Primeiro jogo que parei pra prestar atenção na história, sensacional. Boa jogabilidade e nada maçante, fiz as principais em alguns dias, indescritível o quanto esse jogo é bom!!!",True,2026-05-27 22:27:19,brazilian,3764
The Witcher 3,RPG,I play this game every few years without looking anything up just to try and relive some of the best gaming experiences of my life. I don't know that there will be a better game but I hope every developer tries to make one as good or better than Witcher 3: Wild Hunt,True,2026-05-27 21:23:47,english,21400
The Witcher 3,RPG,"Witcher 3 is pure immersion. The world pulls you in instantly, the story is incredible and full of memorable characters, and the combat, while simple, is fun and satisfying. It’s the kind of game you lose yourself in for hours without even noticing.",True,2026-05-27 17:07:28,english,5845
The Witcher 3,RPG,"Finally picked up this game after years sitting in my library (huge mistake). I’m currently midway through the main story and already finished the Hearts of Stone DLC.

The writing is amazing, and some quests genuinely make you question your moral choices. My only issue is the loot scaling once you’re past level 30. Other than that, this is easily one of the best RPGs I’ve played.

i will add more review after i finish second dlc",True,2026-05-27 07:47:04,english,6534
The Witcher 3,RPG,"Очень хорошая игра, отличная атмосфера, хорошие персонажи и интересный сюжет.",True,2026-05-24 20:03:00,danish,3809
The Witcher 3,RPG,Such a rich story and pleasing game play.,True,2026-05-24 06:34:20,english,1616
The Witcher 3,RPG,"（微剧透）对于喜欢中世纪的玩家来说，这款游戏能给你带来一段独特的猎魔之旅。这是一款剧情驱动型游戏，主线故事以找女儿展开，在各个地区寻找线索，最后帮助女儿度过难关。支线繁多，且并不重复，大多有趣简短并有许多富含深度的故事，本作剧情较为开放，无论主线还是支线，都有众多分支选择，你的选择将改写许多人的命运甚至地方时局也因你的介入而改变，庞大的故事网为买个热爱角色扮演的玩家搭建好舞台。两款dlc非常推荐入手，两个dlc的故事非常不错，远超本体质量，且体量庞大，两个dlc加上能让游戏时长翻倍，并且也加上了许多有趣的机制。
接下来就是对巫师三的吐槽，当我第一次游玩这款游戏时，就被这枯燥慢节奏的开头给劝退，人物对话缓慢文本又长，给刚入坑的我玩困了。后来再一次游玩后，发现这游戏的马非常不好骑而且战斗系统也很拉跨，虽说没到垃圾的程度，但却完全提不起兴趣。接着本体主线是我一直很想吐槽的点，非常烦人的套圈式剧情，即做A事件要去做B事件，而做B事件又要做C事件，有些还要继续套下去。并且由于我是一个对中世纪题材不太感冒的人，这游戏带给我的驱动动力太少了，完全没有让人沉迷的感觉，骑马时的一次次重新加速，打架时一次次重复闪避，开始让我不断地产生疲倦，不过还在我还是打完了一周目。
最后总结：不错的剧情推动型游戏，而且量大管饱，但手感不行，节奏太慢。个人评分：7/10",True,2026-05-23 17:37:53,schinese,7304
The Witcher 3,RPG,"This was the first of the 3 (soon 4) that I played. I will always have the memory of coming back from training 2+ hours of boxing and then spending the rest of the day on this back in 2019, having so much fun and progressing.
I'm yet to 100% it but that is def a future goal when I come back.",True,2026-05-23 00:22:29,english,5237
The Witcher 3,RPG,"Ведьмак 3 со всеми DLC — это лучшая RPG в истории.

Сама игра легендарна, но дополнения — это вообще разрыв. Каменные сердца подарили Ольгерда и Гюнтера о'Дима — шедевральный, мрачный сюжет, от которого мурашки по коже. А Кровь и Вино? Туссент настолько красивый, что ощущается как отдельная игра, а финал дает Геральту тот самый идеальный заслуженный покой. Это шедевр на века, 11 из 10.",True,2026-05-22 10:19:28,russian,17239
The Witcher 3,RPG,"As a book fan I knew this was going to be great, but I was wrong. It was absolutely INCREDIBLE!!!
I can't explain how much this game affected me. The story, the characters, the sceneries.. Simply astonishing.
It took me 6 year to finish the whole story including DLCs, but it was just because I did not want it to end (now it did and i don't know how to process that)
Maybe the combat was a little hard for me, anyway that's my fault as I played most of the game on ""Death March"" difficulty. At the same time I was too lazy to learn all about every aspect of the game. I was always a simple sword kinda gal, but it's really useful to learn all about alchemy, potions, bombs, signs, mutagens and really get into what kind of build you want IF you want to play at high difficulty. There's really not much I can say without spoilers. Only thing - i'm a big fan of Regis from books and it was a big pleasure to play Blood and Wine DLC with him in it.",True,2026-05-21 22:07:42,english,17996
The Witcher 3,RPG,"Короче, Ведьмак 3 - это когда весь мир на грани уничтожения, твою приемную дочь преследуют призрачные всадники, а ты стоишь посреди грязной деревни и орешь на местного барона, потому что он не хочет играть с тобой в карты. Гвинт здесь - это вообще смысл жизни, а спасение человечества - так, приятный бонус. Отдельного уважения заслуживает Плотва: эта кобыла явно познала дзен и научилась телепортироваться на крыши домов, застревать головой в заборах и полностью игнорировать законы физики. Еще Геральт работает профессиональным синоптиком и постоянно бубнит под нос про дождь и ветер. При этом экономика в игре потрясающая: ты можешь легально обнести хату любого нищего крестьянина, забрав у него последний тухлый сыр и сломанную кочергу, и тебе ничего не будет. Но стоит случайно нажать кнопку атаки рядом со стражником в городе - и тебя сотрут в порошок за долю секунды. Ну и главный мем игры - это хрустальные колени великого ведьмака. Геральт прошел через жуткие мутации, побеждает огромных монстров и мастерски крутит пируэты с мечом, но гарантированно умирает, если упадет с высоты обычного забора. В общем, 10 шевелящихся Плотв из 10, шедевр на сотни часов, пойду соберу еще пару карт для колоды Нильфгаарда, пока дочка там как-нибудь сама справляется.",True,2026-05-21 15:03:21,russian,1978
The Witcher 3,RPG,"최근 게임 기준으로 해도 수작이라고 봄. 조작감 구리고 낡은 ui인 건 맞는데, 이게 약간 옛날 메이플 같은 맛이 있음. 불편해서 오히려 모험하는 느낌이 많이 든다 해야하나. 슥슥 넘어가면 할 땐 편하겠지만 1달만 지나가도 다 잊힐건데. 다만 동굴 탐험은 좀 빡침 맵이 어둡고 길이 잘 안 보임. 

서브퀘스트랑 탐험요소가 많기는 한데 메인퀘스트만 즐겨도 충분한 볼륨이 나옴. 그리고 게임 스토리 좋다는 경우 대부분이, 게임 치고 겸사겸사 좋은 거지 순수 문학 작품한테는 밀리는 경우가 많은데. 위쳐3는 원작 소설 뛰어넘었다고 봐야함. 다양한 선택지가 있고 캐릭터랑 세계가 살아숨쉬는 게 활자로 전달할 수 없는 몰입감이 있음.",True,2026-05-19 06:06:22,koreana,4284
The Witcher 3,RPG,"Winds howling. Your adopted daughter is missing and the world is ending.

Anyway, do you want to play a card game?

10/10. Roach is currently on the roof",True,2026-05-18 18:34:33,english,3244
The Witcher 3,RPG,проходил очень давно на иксбоксе и игра ахуй куча вариаций постоянно есть какие то ситуации на прямой дороге то гуль нападёт до дезертиры попытаются ограбить крч просо вау молчу про сюжет (а уж тем более молчу про задание где нужно сжечь ребёнка) игра класс руки целовал сд проджект,True,2026-05-16 21:26:15,russian,210
The Witcher 3,RPG,"One of the Greatest Game Ever made its not just a Game its a Journey. 10/10 Game all day everyday

Nails every aspect of game making The Story Graphics Combat Pacing Side quests etc Its soo good Just buy the game and play the game its life changing stuff.

The DLC is also great Blood and wine that is. hearts and stones bad.",True,2026-05-15 08:15:40,english,11144
The Witcher 3,RPG,"I was not sure whether I would love this game as I was not familiar with the genre, but I've been hooked to this game ever since the 1st minute. Definitely one of the best games I've ever played! 10/10 for me.",True,2026-05-14 18:41:43,english,4327
